,index,title,slide_url,paper_url,filename
291,291,Causal structure-based root cause analysis of outliers,icml.cc/media/icml-2022/Slides/17528.pdf,proceedings.mlr.press/v162/budhathoki22a/budhathoki22a.pdf,291.pdf
292,292,Context-Aware Drift Detection,icml.cc/media/icml-2022/Slides/18018.pdf,proceedings.mlr.press/v162/cobb22a/cobb22a.pdf,292.pdf
293,293,On Convergence of Gradient Descent Ascent: A Tight Local Analysis,icml.cc/media/icml-2022/Slides/18080.pdf,proceedings.mlr.press/v162/li22e/li22e.pdf,293.pdf
294,294,Removing Batch Normalization Boosts Adversarial Training,icml.cc/media/icml-2022/Slides/16542_YaovHjb.pdf,proceedings.mlr.press/v162/wang22ap/wang22ap.pdf,294.pdf
295,295,Instrumental Variable Regression with Confounder Balancing,icml.cc/media/icml-2022/Slides/17636.pdf,proceedings.mlr.press/v162/wu22e/wu22e.pdf,295.pdf
296,296,Generalized Beliefs for Cooperative AI,icml.cc/media/icml-2022/Slides/17846_LOGZdFa.pdf,proceedings.mlr.press/v162/muglich22a/muglich22a.pdf,296.pdf
297,297,Continual Repeated Annealed Flow Transport Monte Carlo,icml.cc/media/icml-2022/Slides/17566.pdf,proceedings.mlr.press/v162/matthews22a/matthews22a.pdf,297.pdf
298,298,High Probability Guarantees for Nonconvex Stochastic Gradient Descent with Heavy Tails,icml.cc/media/icml-2022/Slides/18184.pdf,proceedings.mlr.press/v162/li22q/li22q.pdf,298.pdf
299,299,Forget-free Continual Learning with Winning Subnetworks,icml.cc/media/icml-2022/Slides/17874_IbOCPzd.pdf,proceedings.mlr.press/v162/kang22b/kang22b.pdf,299.pdf
300,300,Causal Transformer for Estimating Counterfactual Outcomes,icml.cc/media/icml-2022/Slides/17694.pdf,proceedings.mlr.press/v162/melnychuk22a/melnychuk22a.pdf,300.pdf
301,301,Greedy when Sure and Conservative when Uncertain about the Opponents,icml.cc/media/icml-2022/Slides/17558.pdf,proceedings.mlr.press/v162/fu22b/fu22b.pdf,301.pdf
302,302,Generative Flow Networks for Discrete Probabilistic Modeling,icml.cc/media/icml-2022/Slides/17136.pdf,proceedings.mlr.press/v162/zhang22v/zhang22v.pdf,302.pdf
303,303,Convergence Rates of Non-Convex Stochastic Gradient Descent Under a Generic Lojasiewicz Condition and Local Smoothness,icml.cc/media/icml-2022/Slides/18100.pdf,proceedings.mlr.press/v162/scaman22a/scaman22a.pdf,303.pdf
304,304,A Deep Learning Approach for the Segmentation of Electroencephalography Data in Eye Tracking Applications,icml.cc/media/icml-2022/Slides/17762_8T47rwd.pdf,proceedings.mlr.press/v162/wolf22a/wolf22a.pdf,304.pdf
305,305,Algorithms for the Communication of Samples,icml.cc/media/icml-2022/Slides/16208_nU1fbWT.pdf,proceedings.mlr.press/v162/theis22a/theis22a.pdf,305.pdf
306,306,An Equivalence Between Data Poisoning and Byzantine Gradient Attacks,icml.cc/media/icml-2022/Slides/17454.pdf,proceedings.mlr.press/v162/farhadkhani22b/farhadkhani22b.pdf,306.pdf
307,307,An Initial Alignment between Neural Network and Target is Needed for Gradient Descent to Learn,icml.cc/media/icml-2022/Slides/18036.pdf,proceedings.mlr.press/v162/abbe22a/abbe22a.pdf,307.pdf
308,308,FEDformer: Frequency Enhanced Decomposed Transformer for Long-term Series Forecasting,icml.cc/media/icml-2022/Slides/17986.pdf,proceedings.mlr.press/v162/zhou22g/zhou22g.pdf,308.pdf
309,309,Minimizing Control for Credit Assignment with Strong Feedback,icml.cc/media/icml-2022/Slides/18060_cDpHBE2.pdf,proceedings.mlr.press/v162/meulemans22a/meulemans22a.pdf,309.pdf
310,310,Diffusion bridges vector quantized variational autoencoders,icml.cc/media/icml-2022/Slides/17284_8BTCFal.pdf,proceedings.mlr.press/v162/cohen22b/cohen22b.pdf,310.pdf
311,311,A Single-Loop Gradient Descent and Perturbed Ascent Algorithm for Nonconvex Functional Constrained Optimization,icml.cc/media/icml-2022/Slides/18162.pdf,proceedings.mlr.press/v162/lu22a/lu22a.pdf,311.pdf
312,312,Deconfounded Value Decomposition for Multi-Agent Reinforcement Learning,icml.cc/media/icml-2022/Slides/18102.pdf,proceedings.mlr.press/v162/li22l/li22l.pdf,312.pdf
313,313,Causal Inference Through the Structural Causal Marginal Problem,icml.cc/media/icml-2022/Slides/17834.pdf,proceedings.mlr.press/v162/gresele22a/gresele22a.pdf,313.pdf
314,314,DAVINZ: Data Valuation using Deep Neural Networks at Initialization,icml.cc/media/icml-2022/Slides/17500.pdf,proceedings.mlr.press/v162/wu22j/wu22j.pdf,314.pdf
315,315,Inductive Biases and Variable Creation in Self-Attention Mechanisms,icml.cc/media/icml-2022/Slides/18074_OEKs04D.pdf,proceedings.mlr.press/v162/edelman22a/edelman22a.pdf,315.pdf
316,316,Low-Precision Stochastic Gradient Langevin Dynamics,icml.cc/media/icml-2022/Slides/17246.pdf,proceedings.mlr.press/v162/zhang22ag/zhang22ag.pdf,316.pdf
317,317,Anticorrelated Noise Injection for Improved Generalization,icml.cc/media/icml-2022/Slides/18422_cNMW25O.pdf,proceedings.mlr.press/v162/orvieto22a/orvieto22a.pdf,317.pdf
318,318,Functional Generalized Empirical Likelihood Estimation for Conditional Moment Restrictions,icml.cc/media/icml-2022/Slides/17910.pdf,proceedings.mlr.press/v162/kremer22a/kremer22a.pdf,318.pdf
319,319,Welfare Maximization in Competitive Equilibrium: Reinforcement Learning for Markov Exchange Economy,icml.cc/media/icml-2022/Slides/18356.pdf,proceedings.mlr.press/v162/liu22l/liu22l.pdf,319.pdf
320,320,Mitigating Modality Collapse in Multimodal VAEs via Impartial Optimization,icml.cc/media/icml-2022/Slides/17492.pdf,proceedings.mlr.press/v162/javaloy22a/javaloy22a.pdf,320.pdf
321,321,Topology-aware Generalization of Decentralized SGD,icml.cc/media/icml-2022/Slides/18374.pdf,proceedings.mlr.press/v162/zhu22d/zhu22d.pdf,321.pdf
322,322,Boosting Graph Structure Learning with Dummy Nodes,icml.cc/media/icml-2022/Slides/17952.pdf,proceedings.mlr.press/v162/liu22d/liu22d.pdf,322.pdf
323,323,Sample Efficient Learning of Predictors that Complement Humans,icml.cc/media/icml-2022/Slides/17544.pdf,proceedings.mlr.press/v162/charusaie22a/charusaie22a.pdf,323.pdf
324,324,Soft Truncation: A Universal Training Technique of Score-based Diffusion Model for High Precision Score Estimation,icml.cc/media/icml-2022/Slides/17648.pdf,proceedings.mlr.press/v162/kim22i/kim22i.pdf,324.pdf
325,325,On the Practicality of Deterministic Epistemic Uncertainty,icml.cc/media/icml-2022/Slides/16366.pdf,proceedings.mlr.press/v162/postels22a/postels22a.pdf,325.pdf
326,326,Simplex Neural Population Learning: Any-Mixture Bayes-Optimality in Symmetric Zero-sum Games,icml.cc/media/icml-2022/Slides/18416.pdf,proceedings.mlr.press/v162/liu22h/liu22h.pdf,326.pdf
327,327,Towards Scaling Difference Target Propagation by Learning Backprop Targets,icml.cc/media/icml-2022/Slides/18240.pdf,proceedings.mlr.press/v162/ernoult22a/ernoult22a.pdf,327.pdf
328,328,Understanding Gradient Descent on the Edge of Stability in Deep Learning,icml.cc/media/icml-2022/Slides/18396.pdf,proceedings.mlr.press/v162/arora22a/arora22a.pdf,328.pdf
329,329,Lazy Estimation of Variable Importance for Large Neural Networks,icml.cc/media/icml-2022/Slides/18088.pdf,proceedings.mlr.press/v162/gao22h/gao22h.pdf,329.pdf
330,330,Content Addressable Memory Without Catastrophic Forgetting by Heteroassociation with a Fixed Scaffold,icml.cc/media/icml-2022/Slides/18272_F0EsyZv.pdf,proceedings.mlr.press/v162/sharma22b/sharma22b.pdf,330.pdf
331,331,Sample and Communication-Efficient Decentralized Actor-Critic Algorithms with Finite-Time Analysis,icml.cc/media/icml-2022/Slides/18418.pdf,proceedings.mlr.press/v162/chen22ah/chen22ah.pdf,331.pdf
332,332,Fast and Reliable Evaluation of Adversarial Robustness with Minimum-Margin Attack,icml.cc/media/icml-2022/Slides/16828.pdf,proceedings.mlr.press/v162/gao22i/gao22i.pdf,332.pdf
333,333,Combining Diverse Feature Priors,icml.cc/media/icml-2022/Slides/16524.pdf,proceedings.mlr.press/v162/jain22b/jain22b.pdf,333.pdf
334,334,Inferring Cause and Effect in the Presence of Heteroscedastic Noise,icml.cc/media/icml-2022/Slides/18424.pdf,proceedings.mlr.press/v162/xu22f/xu22f.pdf,334.pdf
335,335,DynaMixer: A Vision MLP Architecture with Dynamic Mixing,icml.cc/media/icml-2022/Slides/17199.pdf,proceedings.mlr.press/v162/wang22i/wang22i.pdf,335.pdf
336,336,Fishr: Invariant Gradient Variances for Out-of-Distribution Generalization,icml.cc/media/icml-2022/Slides/17213.pdf,proceedings.mlr.press/v162/rame22a/rame22a.pdf,336.pdf
337,337,On the Learning of Non-Autoregressive Transformers,icml.cc/media/icml-2022/Slides/17613.pdf,proceedings.mlr.press/v162/huang22k/huang22k.pdf,337.pdf
338,338,Directed Acyclic Transformer for Non-Autoregressive Machine Translation,icml.cc/media/icml-2022/Slides/17957.pdf,proceedings.mlr.press/v162/huang22m/huang22m.pdf,338.pdf
339,339,Generative Modeling for Multi-task Visual Learning,icml.cc/media/icml-2022/Slides/17651.pdf,proceedings.mlr.press/v162/bao22c/bao22c.pdf,339.pdf
340,340,Parametric Visual Program Induction with Function Modularization,icml.cc/media/icml-2022/Slides/17855.pdf,proceedings.mlr.press/v162/duan22c/duan22c.pdf,340.pdf
341,341,VLMixer: Unpaired Vision-Language Pre-training via Cross-Modal CutMix,icml.cc/media/icml-2022/Slides/18165.pdf,proceedings.mlr.press/v162/wang22h/wang22h.pdf,341.pdf
342,342,Bayesian Nonparametric Learning for Point Processes with Spatial Homogeneity: A Spatial Analysis of NBA Shot Locations,icml.cc/media/icml-2022/Slides/15957_umEIaLy.pdf,proceedings.mlr.press/v162/yin22a/yin22a.pdf,342.pdf
343,343,Self-Supervised Models of Audio Effectively Explain Human Cortical Responses to Speech,icml.cc/media/icml-2022/Slides/18093.pdf,proceedings.mlr.press/v162/vaidya22a/vaidya22a.pdf,343.pdf
344,344,Content Addressable Memory Without Catastrophic Forgetting by Heteroassociation with a Fixed Scaffold,icml.cc/media/icml-2022/Slides/18271.pdf,proceedings.mlr.press/v162/sharma22b/sharma22b.pdf,344.pdf
345,345,Evaluating the Adversarial Robustness of Adaptive Test-time Defenses,icml.cc/media/icml-2022/Slides/18041.pdf,proceedings.mlr.press/v162/croce22a/croce22a.pdf,345.pdf
346,346,Demystifying the Adversarial Robustness of Random Transformation Defenses,icml.cc/media/icml-2022/Slides/18177.pdf,proceedings.mlr.press/v162/sitawarin22a/sitawarin22a.pdf,346.pdf
347,347,DSTAGNN: Dynamic Spatial-Temporal Aware Graph Neural Network for Traffic Flow Forecasting,icml.cc/media/icml-2022/Slides/16007_u1jifE0.pdf,proceedings.mlr.press/v162/lan22a/lan22a.pdf,347.pdf
348,348,Omni-Granular Ego-Semantic Propagation for Self-Supervised Graph Representation Learning,icml.cc/media/icml-2022/Slides/16119.pdf,proceedings.mlr.press/v162/yang22d/yang22d.pdf,348.pdf
349,349,On Collective Robustness of Bagging Against Data Poisoning,icml.cc/media/icml-2022/Slides/17411.pdf,proceedings.mlr.press/v162/chen22k/chen22k.pdf,349.pdf
350,350,Hindering Adversarial Attacks with Implicit Neural Representations,icml.cc/media/icml-2022/Slides/18019.pdf,proceedings.mlr.press/v162/rusu22a/rusu22a.pdf,350.pdf
351,351,From Noisy Prediction to True Label: Noisy Prediction Calibration via Generative Model,icml.cc/media/icml-2022/Slides/18349_XuN1nb6.pdf,proceedings.mlr.press/v162/bae22a/bae22a.pdf,351.pdf
352,352,Exploring and Exploiting Hubness Priors for High-Quality GAN Latent Sampling,icml.cc/media/icml-2022/Slides/16223_u087A6c.pdf,proceedings.mlr.press/v162/liang22b/liang22b.pdf,352.pdf
353,353,Estimating the Optimal Covariance with Imperfect Mean in Diffusion Probabilistic Models,icml.cc/media/icml-2022/Slides/16751_I3rNZYq.pdf,proceedings.mlr.press/v162/bao22d/bao22d.pdf,353.pdf
354,354,Generalizing to New Physical Systems via Context-Informed Dynamics Model,icml.cc/media/icml-2022/Slides/18049_HKq7MJo.pdf,proceedings.mlr.press/v162/kirchmeyer22a/kirchmeyer22a.pdf,354.pdf
355,355,Knowledge Base Question Answering by Case-based Reasoning over Subgraphs,icml.cc/media/icml-2022/Slides/18311.pdf,proceedings.mlr.press/v162/das22a/das22a.pdf,355.pdf
356,356,When AUC meets DRO: Optimizing Partial AUC for Deep Learning with Non-Convex Convergence Guarantee,icml.cc/media/icml-2022/Slides/18411.pdf,proceedings.mlr.press/v162/zhu22g/zhu22g.pdf,356.pdf
357,357,SpeqNets: Sparsity-aware permutation-equivariant graph networks,icml.cc/media/icml-2022/Slides/17681.pdf,proceedings.mlr.press/v162/morris22a/morris22a.pdf,357.pdf
358,358,GNNRank: Learning Global Rankings from Pairwise Comparisons via Directed Graph Neural Networks,icml.cc/media/icml-2022/Slides/18121_2ZdoEBe.pdf,proceedings.mlr.press/v162/he22b/he22b.pdf,358.pdf
359,359,Neural-Symbolic Models for Logical Queries on Knowledge Graphs,icml.cc/media/icml-2022/Slides/16233.pdf,proceedings.mlr.press/v162/zhu22c/zhu22c.pdf,359.pdf
360,360,Uncertainty Modeling in Generative Compressed Sensing,icml.cc/media/icml-2022/Slides/16577.pdf,proceedings.mlr.press/v162/zhang22ai/zhang22ai.pdf,360.pdf
361,361,Going Deeper into Permutation-Sensitive Graph Neural Networks,icml.cc/media/icml-2022/Slides/16659_urBfEKz.pdf,proceedings.mlr.press/v162/huang22l/huang22l.pdf,361.pdf
362,362,Modeling Irregular Time Series with Continuous Recurrent Units,icml.cc/media/icml-2022/Slides/16343.pdf,proceedings.mlr.press/v162/schirmer22a/schirmer22a.pdf,362.pdf
363,363,Approximately Equivariant Networks for Imperfectly Symmetric Dynamics,icml.cc/media/icml-2022/Slides/16949.pdf,proceedings.mlr.press/v162/wang22aa/wang22aa.pdf,363.pdf
364,364,IDYNO: Learning Nonparametric DAGs from Interventional Dynamic Data,icml.cc/media/icml-2022/Slides/17259.pdf,proceedings.mlr.press/v162/gao22a/gao22a.pdf,364.pdf
365,365,GSmooth: Certified Robustness against Semantic Transformations via Generalized Randomized Smoothing,icml.cc/media/icml-2022/Slides/17371.pdf,proceedings.mlr.press/v162/hao22c/hao22c.pdf,365.pdf
366,366,Closed-Form Diffeomorphic Transformations for Time Series Alignment,icml.cc/media/icml-2022/Slides/17697.pdf,proceedings.mlr.press/v162/martinez22a/martinez22a.pdf,366.pdf
367,367,On the Practicality of Deterministic Epistemic Uncertainty,icml.cc/media/icml-2022/Slides/16365.pdf,proceedings.mlr.press/v162/postels22a/postels22a.pdf,367.pdf
368,368,A Difference Standardization Method for Mutual Transfer Learning,icml.cc/media/icml-2022/Slides/17525_K8PmMPr.pdf,proceedings.mlr.press/v162/xu22j/xu22j.pdf,368.pdf
369,369,Generalizing to Evolving Domains with Latent Structure-Aware Sequential Autoencoder,icml.cc/media/icml-2022/Slides/18055.pdf,proceedings.mlr.press/v162/qin22a/qin22a.pdf,369.pdf
370,370,Class-Imbalanced Semi-Supervised Learning with Adaptive Thresholding,icml.cc/media/icml-2022/Slides/16069.pdf,proceedings.mlr.press/v162/guo22e/guo22e.pdf,370.pdf
371,371,Gradient Based Clustering,icml.cc/media/icml-2022/Slides/17663.pdf,proceedings.mlr.press/v162/armacki22a/armacki22a.pdf,371.pdf
372,372,Partial Counterfactual Identification from Observational and Experimental Data,icml.cc/media/icml-2022/Slides/17031_cj3wvZS.pdf,proceedings.mlr.press/v162/zhang22ab/zhang22ab.pdf,372.pdf
373,373,On Measuring Causal Contributions via do-interventions,icml.cc/media/icml-2022/Slides/17033.pdf,proceedings.mlr.press/v162/jung22a/jung22a.pdf,373.pdf
374,374,Instrumental Variable Regression with Confounder Balancing,icml.cc/media/icml-2022/Slides/17635.pdf,proceedings.mlr.press/v162/wu22e/wu22e.pdf,374.pdf
375,375,Causal Transformer for Estimating Counterfactual Outcomes,icml.cc/media/icml-2022/Slides/17693.pdf,proceedings.mlr.press/v162/melnychuk22a/melnychuk22a.pdf,375.pdf
376,376,Matching Learned Causal Effects of Neural Networks with Domain Priors,icml.cc/media/icml-2022/Slides/18299.pdf,proceedings.mlr.press/v162/kancheti22a/kancheti22a.pdf,376.pdf
377,377,Pairwise Conditional Gradients without Swap Steps and Sparser Kernel Herding,icml.cc/media/icml-2022/Slides/17205.pdf,proceedings.mlr.press/v162/tsuji22a/tsuji22a.pdf,377.pdf
378,378,Batch Greenkhorn Algorithm for Entropic-Regularized Multimarginal Optimal Transport: Linear Rate of Convergence and Iteration Complexity,icml.cc/media/icml-2022/Slides/17939_2CW6ltx.pdf,proceedings.mlr.press/v162/kostic22a/kostic22a.pdf,378.pdf
379,379,Solving Stackelberg Prediction Game with Least Squares Loss via Spherically Constrained Least Squares Reformulation,icml.cc/media/icml-2022/Slides/17691.pdf,proceedings.mlr.press/v162/wang22g/wang22g.pdf,379.pdf
380,380,Federated Minimax Optimization: Improved Convergence Analyses and Algorithms,icml.cc/media/icml-2022/Slides/17435.pdf,proceedings.mlr.press/v162/sharma22c/sharma22c.pdf,380.pdf
381,381,Inductive Matrix Completion: No Bad Local Minima and a Fast Algorithm,icml.cc/media/icml-2022/Slides/17495.pdf,proceedings.mlr.press/v162/zilber22a/zilber22a.pdf,381.pdf
382,382,Tackling covariate shift with node-based Bayesian neural networks,icml.cc/media/icml-2022/Slides/17367_Lpvwx6c.pdf,proceedings.mlr.press/v162/trinh22a/trinh22a.pdf,382.pdf
383,383,Fenrir: Physics-Enhanced Regression for Initial Value Problems,icml.cc/media/icml-2022/Slides/17163.pdf,proceedings.mlr.press/v162/tronarp22a/tronarp22a.pdf,383.pdf
384,384,Improved Convergence Rates for Sparse Approximation Methods in Kernel-Based Learning,icml.cc/media/icml-2022/Slides/18031.pdf,proceedings.mlr.press/v162/vakili22a/vakili22a.pdf,384.pdf
385,385,LSB: Local Self-Balancing MCMC in Discrete Spaces,icml.cc/media/icml-2022/Slides/16689.pdf,proceedings.mlr.press/v162/sansone22a/sansone22a.pdf,385.pdf
386,386,Mirror Learning: A Unifying Framework of Policy Optimisation,icml.cc/media/icml-2022/Slides/17441.pdf,proceedings.mlr.press/v162/grudzien22a/grudzien22a.pdf,386.pdf
387,387,DreamerPro: Reconstruction-Free Model-Based Reinforcement Learning with Prototypical Representations,icml.cc/media/icml-2022/Slides/17995.pdf,proceedings.mlr.press/v162/deng22a/deng22a.pdf,387.pdf
388,388,CtrlFormer: Learning Transferable State Representation for Visual Control via Transformer,icml.cc/media/icml-2022/Slides/18045.pdf,proceedings.mlr.press/v162/mu22a/mu22a.pdf,388.pdf
389,389,Regularizing a Model-based Policy Stationary Distribution to Stabilize Offline Reinforcement Learning,icml.cc/media/icml-2022/Slides/18409.pdf,proceedings.mlr.press/v162/yang22b/yang22b.pdf,389.pdf
390,390,Efficient Model-based Multi-agent Reinforcement Learning via Optimistic Equilibrium Computation,icml.cc/media/icml-2022/Slides/17345.pdf,proceedings.mlr.press/v162/sessa22a/sessa22a.pdf,390.pdf
391,391,Greedy when Sure and Conservative when Uncertain about the Opponents,icml.cc/media/icml-2022/Slides/17557.pdf,proceedings.mlr.press/v162/fu22b/fu22b.pdf,391.pdf
392,392,Welfare Maximization in Competitive Equilibrium: Reinforcement Learning for Markov Exchange Economy,icml.cc/media/icml-2022/Slides/18355.pdf,proceedings.mlr.press/v162/liu22l/liu22l.pdf,392.pdf
393,393,Sample and Communication-Efficient Decentralized Actor-Critic Algorithms with Finite-Time Analysis,icml.cc/media/icml-2022/Slides/18417.pdf,proceedings.mlr.press/v162/chen22ah/chen22ah.pdf,393.pdf
394,394,Robin Hood and Matthew Effects: Differential Privacy Has Disparate Impact on Synthetic Data,icml.cc/media/icml-2022/Slides/18247.pdf,proceedings.mlr.press/v162/ganev22a/ganev22a.pdf,394.pdf
395,395,Robust Counterfactual Explanations for Tree-Based Ensembles,icml.cc/media/icml-2022/Slides/16963.pdf,proceedings.mlr.press/v162/dutta22a/dutta22a.pdf,395.pdf
396,396,On the Adversarial Robustness of Causal Algorithmic Recourse,icml.cc/media/icml-2022/Slides/18199.pdf,proceedings.mlr.press/v162/dominguez-olmedo22a/dominguez-olmedo22a.pdf,396.pdf
397,397,Rotting Infinitely Many-Armed Bandits,icml.cc/media/icml-2022/Slides/17823_TNxmD0A.pdf,proceedings.mlr.press/v162/kim22j/kim22j.pdf,397.pdf
398,398,Equivalence Analysis between Counterfactual Regret Minimization and Online Mirror Descent,icml.cc/media/icml-2022/Slides/17863.pdf,proceedings.mlr.press/v162/liu22e/liu22e.pdf,398.pdf
399,399,Power-Law Escape Rate of SGD,icml.cc/media/icml-2022/Slides/16519.pdf,proceedings.mlr.press/v162/mori22a/mori22a.pdf,399.pdf
400,400,Feature selection using e-values,icml.cc/media/icml-2022/Slides/16745.pdf,proceedings.mlr.press/v162/majumdar22a/majumdar22a.pdf,400.pdf
401,401,Policy Gradient Method For Robust Reinforcement Learning,icml.cc/media/icml-2022/Slides/16373.pdf,proceedings.mlr.press/v162/wang22at/wang22at.pdf,401.pdf
402,402,Individual Preference Stability for Clustering,icml.cc/media/icml-2022/Slides/17653.pdf,proceedings.mlr.press/v162/ahmadi22a/ahmadi22a.pdf,402.pdf
403,403,Correlated Quantization for Distributed Mean Estimation and Optimization,icml.cc/media/icml-2022/Slides/17025.pdf,proceedings.mlr.press/v162/suresh22a/suresh22a.pdf,403.pdf
404,404,Multiple-Play Stochastic Bandits with Shareable Finite-Capacity Arms,icml.cc/media/icml-2022/Slides/17289.pdf,proceedings.mlr.press/v162/wang22af/wang22af.pdf,404.pdf
405,405,Steerable 3D Spherical Neurons,icml.cc/media/icml-2022/Slides/18339_Z8e6XuO.pdf,proceedings.mlr.press/v162/melnyk22a/melnyk22a.pdf,405.pdf
406,406,The Teaching Dimension of Regularized Kernel Learners,icml.cc/media/icml-2022/Slides/18039.pdf,proceedings.mlr.press/v162/qian22a/qian22a.pdf,406.pdf
407,407,Refined Convergence Rates for Maximum Likelihood Estimation under Finite Mixture Models,icml.cc/media/icml-2022/Slides/16845.pdf,proceedings.mlr.press/v162/manole22a/manole22a.pdf,407.pdf
408,408,Understanding Gradient Descent on the Edge of Stability in Deep Learning,icml.cc/media/icml-2022/Slides/18395.pdf,proceedings.mlr.press/v162/arora22a/arora22a.pdf,408.pdf
409,409,Boosting Graph Structure Learning with Dummy Nodes,icml.cc/media/icml-2022/Slides/17951_YMFKZIN.pdf,proceedings.mlr.press/v162/liu22d/liu22d.pdf,409.pdf
410,410,A Minimax Learning Approach to Off-Policy Evaluation in Confounded Partially Observable Markov Decision Processes,icml.cc/media/icml-2022/Slides/16360.pdf,proceedings.mlr.press/v162/shi22f/shi22f.pdf,410.pdf
411,411,Adapting to Mixing Time in Stochastic Optimization with Markovian Data,icml.cc/media/icml-2022/Slides/16232_ThmT8Br.pdf,proceedings.mlr.press/v162/dorfman22a/dorfman22a.pdf,411.pdf
412,412,On Numerical Integration in Neural Ordinary Differential Equations,icml.cc/media/icml-2022/Slides/16942.pdf,proceedings.mlr.press/v162/zhu22f/zhu22f.pdf,412.pdf
413,413,Modeling Strong and Human-Like Gameplay with KL-Regularized Search,icml.cc/media/icml-2022/Slides/16682_BRLGuFL.pdf,proceedings.mlr.press/v162/jacob22a/jacob22a.pdf,413.pdf
414,414,Weisfeiler-Lehman Meets Gromov-Wasserstein,icml.cc/media/icml-2022/Slides/16498.pdf,proceedings.mlr.press/v162/chen22o/chen22o.pdf,414.pdf
415,415,Skin Deep Unlearning: Artefact and Instrument Debiasing in the Context of Melanoma Classification,icml.cc/media/icml-2022/Slides/15966_Yd3IR42.pdf,proceedings.mlr.press/v162/bevan22a/bevan22a.pdf,415.pdf
416,416,Interpretable Neural Networks with Frank-Wolfe: Sparse Relevance Maps and Relevance Orderings,icml.cc/media/icml-2022/Slides/16182.pdf,proceedings.mlr.press/v162/macdonald22a/macdonald22a.pdf,416.pdf
417,417,Towards understanding how momentum improves generalization in deep learning,icml.cc/media/icml-2022/Slides/16112.pdf,proceedings.mlr.press/v162/jelassi22a/jelassi22a.pdf,417.pdf
418,418,Learning Domain Adaptive Object Detection with Probabilistic Teacher,icml.cc/media/icml-2022/Slides/16030.pdf,proceedings.mlr.press/v162/chen22b/chen22b.pdf,418.pdf
419,419,What Can Linear Interpolation of Neural Network Loss Landscapes Tell Us?,icml.cc/media/icml-2022/Slides/16392.pdf,proceedings.mlr.press/v162/vlaar22a/vlaar22a.pdf,419.pdf
420,420,Adaptive Data Analysis with Correlated Observations,icml.cc/media/icml-2022/Slides/16034.pdf,proceedings.mlr.press/v162/kontorovich22a/kontorovich22a.pdf,420.pdf
421,421,GenLabel: Mixup Relabeling using Generative Models,icml.cc/media/icml-2022/Slides/16522_zH4tuE4.pdf,proceedings.mlr.press/v162/sohn22a/sohn22a.pdf,421.pdf
422,422,One-Pass Diversified Sampling with Application to Terabyte-Scale Genomic Sequence Streams,icml.cc/media/icml-2022/Slides/16140.pdf,proceedings.mlr.press/v162/coleman22a/coleman22a.pdf,422.pdf
423,423,Showing Your Offline Reinforcement Learning Work: Online Evaluation Budget Matters,icml.cc/media/icml-2022/Slides/17510.pdf,proceedings.mlr.press/v162/kurenkov22a/kurenkov22a.pdf,423.pdf
424,424,Reverse Engineering the Neural Tangent Kernel,icml.cc/media/icml-2022/Slides/17144.pdf,proceedings.mlr.press/v162/simon22a/simon22a.pdf,424.pdf
425,425,Principled Knowledge Extrapolation with GANs,icml.cc/media/icml-2022/Slides/17230.pdf,proceedings.mlr.press/v162/feng22b/feng22b.pdf,425.pdf
426,426,Phasic Self-Imitative Reduction for Sparse-Reward Goal-Conditioned Reinforcement Learning,icml.cc/media/icml-2022/Slides/17644_VZNxptG.pdf,proceedings.mlr.press/v162/li22g/li22g.pdf,426.pdf
427,427,Towards Theoretical Analysis of Transformation Complexity of ReLU DNNs,icml.cc/media/icml-2022/Slides/16188_mEd4gsN.pdf,proceedings.mlr.press/v162/ren22b/ren22b.pdf,427.pdf
428,428,Efficient PAC Learning from the Crowd with Pairwise Comparisons,icml.cc/media/icml-2022/Slides/16116.pdf,proceedings.mlr.press/v162/zeng22b/zeng22b.pdf,428.pdf
429,429,Unsupervised Flow-Aligned Sequence-to-Sequence Learning for Video Restoration,icml.cc/media/icml-2022/Slides/16144_3wGoqXQ.pdf,proceedings.mlr.press/v162/lin22d/lin22d.pdf,429.pdf
430,430,Deep equilibrium networks are sensitive to initialization statistics,icml.cc/media/icml-2022/Slides/16466_oNcdLy9.pdf,proceedings.mlr.press/v162/agarwala22a/agarwala22a.pdf,430.pdf
431,431,ME-GAN: Learning Panoptic Electrocardio Representations for Multi-view ECG Synthesis Conditioned on Heart Diseases,icml.cc/media/icml-2022/Slides/16180_TtqJRUl.pdf,proceedings.mlr.press/v162/chen22n/chen22n.pdf,431.pdf
432,432,A Study of Face Obfuscation in ImageNet,icml.cc/media/icml-2022/Slides/16448_mrBvC6c.pdf,proceedings.mlr.press/v162/yang22q/yang22q.pdf,432.pdf
433,433,"Informed Learning by Wide Neural Networks: Convergence, Generalization and Sampling Complexity",icml.cc/media/icml-2022/Slides/17388_a6InHX0.pdf,proceedings.mlr.press/v162/yang22l/yang22l.pdf,433.pdf
434,434,Scaling-up Diverse Orthogonal Convolutional Networks by a Paraunitary Framework,icml.cc/media/icml-2022/Slides/16576.pdf,proceedings.mlr.press/v162/su22a/su22a.pdf,434.pdf
