,index,title,slide_url,paper_url,filename
0,0,Exact Optimal Accelerated Complexity for Fixed-Point Iterations,icml.cc/media/icml-2022/Slides/17040_tMvH5zY.pdf,proceedings.mlr.press/v162/park22c/park22c.pdf,0.pdf
1,1,Online Learning for Min Sum Set Cover and Pandora’s Box,icml.cc/media/icml-2022/Slides/17418.pdf,proceedings.mlr.press/v162/gergatsouli22a/gergatsouli22a.pdf,1.pdf
2,2,Tackling covariate shift with node-based Bayesian neural networks,icml.cc/media/icml-2022/Slides/17368_nXMQMZ0.pdf,proceedings.mlr.press/v162/trinh22a/trinh22a.pdf,2.pdf
3,3,Dynamic Regret of Online Markov Decision Processes,icml.cc/media/icml-2022/Slides/17646.pdf,proceedings.mlr.press/v162/zhao22c/zhao22c.pdf,3.pdf
4,4,Multi-Task Learning as a Bargaining Game,icml.cc/media/icml-2022/Slides/17114.pdf,proceedings.mlr.press/v162/navon22a/navon22a.pdf,4.pdf
5,5,Exploring and Exploiting Hubness Priors for High-Quality GAN Latent Sampling,icml.cc/media/icml-2022/Slides/16224.pdf,proceedings.mlr.press/v162/liang22b/liang22b.pdf,5.pdf
6,6,Structural Entropy Guided Graph Hierarchical Pooling,icml.cc/media/icml-2022/Slides/15960.pdf,proceedings.mlr.press/v162/wu22b/wu22b.pdf,6.pdf
7,7,On the Impossibility of Learning to Cooperate with Adaptive Partner Strategies in Repeated Games,icml.cc/media/icml-2022/Slides/17014.pdf,proceedings.mlr.press/v162/loftin22a/loftin22a.pdf,7.pdf
8,8,ButterflyFlow: Building Invertible Layers with Butterfly Matrices,icml.cc/media/icml-2022/Slides/16920.pdf,proceedings.mlr.press/v162/meng22a/meng22a.pdf,8.pdf
9,9,Frustratingly Easy Transferability Estimation,icml.cc/media/icml-2022/Slides/17386.pdf,proceedings.mlr.press/v162/huang22d/huang22d.pdf,9.pdf
10,10,Self-Supervised Representation Learning via Latent Graph Prediction,icml.cc/media/icml-2022/Slides/15996.pdf,proceedings.mlr.press/v162/xie22e/xie22e.pdf,10.pdf
11,11,DSTAGNN: Dynamic Spatial-Temporal Aware Graph Neural Network for Traffic Flow Forecasting,icml.cc/media/icml-2022/Slides/16008.pdf,proceedings.mlr.press/v162/lan22a/lan22a.pdf,11.pdf
12,12,Distributional Hamilton-Jacobi-Bellman Equations for Continuous-Time Reinforcement Learning,icml.cc/media/icml-2022/Slides/17076.pdf,proceedings.mlr.press/v162/wiltzer22a/wiltzer22a.pdf,12.pdf
13,13,Transformer Neural Processes: Uncertainty-Aware Meta Learning Via Sequence Modeling,icml.cc/media/icml-2022/Slides/17524_JaSq5IX.pdf,proceedings.mlr.press/v162/nguyen22b/nguyen22b.pdf,13.pdf
14,14,Controlling Conditional Language Models without Catastrophic Forgetting,icml.cc/media/icml-2022/Slides/16288_pIsVCHL.pdf,proceedings.mlr.press/v162/korbak22a/korbak22a.pdf,14.pdf
15,15,Robust Models Are More Interpretable Because Attributions Look Normal,icml.cc/media/icml-2022/Slides/16004.pdf,proceedings.mlr.press/v162/wang22e/wang22e.pdf,15.pdf
16,16,Sequential Covariate Shift Detection Using Classifier Two-Sample Tests,icml.cc/media/icml-2022/Slides/16272_jErbqSA.pdf,proceedings.mlr.press/v162/jang22a/jang22a.pdf,16.pdf
17,17,A Difference Standardization Method for Mutual Transfer Learning,icml.cc/media/icml-2022/Slides/17526.pdf,proceedings.mlr.press/v162/xu22j/xu22j.pdf,17.pdf
18,18,Latent Diffusion Energy-Based Model for Interpretable Text Modelling,icml.cc/media/icml-2022/Slides/17722_UKjsaZy.pdf,proceedings.mlr.press/v162/yu22h/yu22h.pdf,18.pdf
19,19,Coarsening the Granularity: Towards Structurally Sparse Lottery Tickets,icml.cc/media/icml-2022/Slides/16042.pdf,proceedings.mlr.press/v162/chen22a/chen22a.pdf,19.pdf
20,20,Smoothed Adversarial Linear Contextual Bandits with Knapsacks,icml.cc/media/icml-2022/Slides/17424.pdf,proceedings.mlr.press/v162/sivakumar22a/sivakumar22a.pdf,20.pdf
21,21,Fast Convex Optimization for Two-Layer ReLU Networks: Equivalent Model Classes and Cone Decompositions,icml.cc/media/icml-2022/Slides/16550.pdf,proceedings.mlr.press/v162/mishkin22a/mishkin22a.pdf,21.pdf
22,22,ShiftAddNAS: Hardware-Inspired Search for More Accurate and Efficient Neural Networks,icml.cc/media/icml-2022/Slides/16350.pdf,proceedings.mlr.press/v162/you22a/you22a.pdf,22.pdf
23,23,Structure-preserving GANs,icml.cc/media/icml-2022/Slides/16380.pdf,proceedings.mlr.press/v162/birrell22a/birrell22a.pdf,23.pdf
24,24,Omni-Granular Ego-Semantic Propagation for Self-Supervised Graph Representation Learning,icml.cc/media/icml-2022/Slides/16120.pdf,proceedings.mlr.press/v162/yang22d/yang22d.pdf,24.pdf
25,25,UNIREX: A Unified Learning Framework for Language Model Rationale Extraction,icml.cc/media/icml-2022/Slides/17778_aktVoJx.pdf,proceedings.mlr.press/v162/chan22a/chan22a.pdf,25.pdf
26,26,Improving Task-free Continual Learning by Distributionally Robust Memory Evolution,icml.cc/media/icml-2022/Slides/17576.pdf,proceedings.mlr.press/v162/wang22v/wang22v.pdf,26.pdf
27,27,A Completely Tuning-Free and Robust Approach to Sparse Precision Matrix Estimation,icml.cc/media/icml-2022/Slides/17674.pdf,proceedings.mlr.press/v162/tran22b/tran22b.pdf,27.pdf
28,28,Simultaneously Learning Stochastic and Adversarial Bandits with General Graph Feedback,icml.cc/media/icml-2022/Slides/17906.pdf,proceedings.mlr.press/v162/kong22b/kong22b.pdf,28.pdf
29,29,Provably Adversarially Robust Nearest Prototype Classifiers,icml.cc/media/icml-2022/Slides/17804.pdf,proceedings.mlr.press/v162/voracek22a/voracek22a.pdf,29.pdf
30,30,Mirror Learning: A Unifying Framework of Policy Optimisation,icml.cc/media/icml-2022/Slides/17442_cVqa990.pdf,proceedings.mlr.press/v162/grudzien22a/grudzien22a.pdf,30.pdf
31,31,A Multi-objective / Multi-task Learning Framework Induced by Pareto Stationarity,icml.cc/media/icml-2022/Slides/17628_Iinx0p9.pdf,proceedings.mlr.press/v162/momma22a/momma22a.pdf,31.pdf
32,32,Black-Box Tuning for Language-Model-as-a-Service,icml.cc/media/icml-2022/Slides/17784.pdf,proceedings.mlr.press/v162/sun22e/sun22e.pdf,32.pdf
33,33,DeepSpeed-MoE: Advancing Mixture-of-Experts Inference and Training to Power Next-Generation AI Scale,icml.cc/media/icml-2022/Slides/16672.pdf,proceedings.mlr.press/v162/rajbhandari22a/rajbhandari22a.pdf,33.pdf
34,34,Analyzing and Mitigating Interference in Neural Architecture Search,icml.cc/media/icml-2022/Slides/16138_eFyMeov.pdf,proceedings.mlr.press/v162/xu22h/xu22h.pdf,34.pdf
35,35,Improved No-Regret Algorithms for Stochastic Shortest Path with Linear MDP,icml.cc/media/icml-2022/Slides/16970.pdf,proceedings.mlr.press/v162/chen22h/chen22h.pdf,35.pdf
36,36,Certifying Out-of-Domain Generalization for Blackbox Functions,icml.cc/media/icml-2022/Slides/17666_KpyU0JK.pdf,proceedings.mlr.press/v162/weber22a/weber22a.pdf,36.pdf
37,37,Markov Chain Monte Carlo for Continuous-Time Switching Dynamical Systems,icml.cc/media/icml-2022/Slides/18052.pdf,proceedings.mlr.press/v162/kohs22a/kohs22a.pdf,37.pdf
38,38,FedNew: A Communication-Efficient and Privacy-Preserving Newton-Type Method for Federated Learning,icml.cc/media/icml-2022/Slides/16854.pdf,proceedings.mlr.press/v162/elgabli22a/elgabli22a.pdf,38.pdf
39,39,Sparse Invariant Risk Minimization,icml.cc/media/icml-2022/Slides/17748.pdf,proceedings.mlr.press/v162/zhou22e/zhou22e.pdf,39.pdf
40,40,Robust Kernel Density Estimation with Median-of-Means principle,icml.cc/media/icml-2022/Slides/16260_YnZjbbG.pdf,proceedings.mlr.press/v162/humbert22a/humbert22a.pdf,40.pdf
41,41,Estimating the Optimal Covariance with Imperfect Mean in Diffusion Probabilistic Models,icml.cc/media/icml-2022/Slides/16752.pdf,proceedings.mlr.press/v162/bao22d/bao22d.pdf,41.pdf
42,42,Unified Scaling Laws for Routed Language Models,icml.cc/media/icml-2022/Slides/17820.pdf,proceedings.mlr.press/v162/clark22a/clark22a.pdf,42.pdf
43,43,Head2Toe: Utilizing Intermediate Representations for Better Transfer Learning,icml.cc/media/icml-2022/Slides/16680.pdf,proceedings.mlr.press/v162/evci22a/evci22a.pdf,43.pdf
44,44,"Revisiting Online Submodular Minimization: Gap-Dependent Regret Bounds, Best of Both Worlds and Adversarial Robustness",icml.cc/media/icml-2022/Slides/17560.pdf,proceedings.mlr.press/v162/ito22a/ito22a.pdf,44.pdf
45,45,Intriguing Properties of Input-Dependent Randomized Smoothing,icml.cc/media/icml-2022/Slides/17746.pdf,proceedings.mlr.press/v162/sukeni-k22a/sukeni-k22a.pdf,45.pdf
46,46,Unraveling Attention via Convex Duality: Analysis and Interpretations of Vision Transformers,icml.cc/media/icml-2022/Slides/17172.pdf,proceedings.mlr.press/v162/sahiner22a/sahiner22a.pdf,46.pdf
47,47,Tractable Uncertainty for Structure Learning,icml.cc/media/icml-2022/Slides/18118_xfL5Ti2.pdf,proceedings.mlr.press/v162/wang22ad/wang22ad.pdf,47.pdf
48,48,Pairwise Conditional Gradients without Swap Steps and Sparser Kernel Herding,icml.cc/media/icml-2022/Slides/17206.pdf,proceedings.mlr.press/v162/tsuji22a/tsuji22a.pdf,48.pdf
49,49,Rotting Infinitely Many-Armed Bandits,icml.cc/media/icml-2022/Slides/17824_u4bPiPJ.pdf,proceedings.mlr.press/v162/kim22j/kim22j.pdf,49.pdf
50,50,Batched Dueling Bandits,icml.cc/media/icml-2022/Slides/18228.pdf,proceedings.mlr.press/v162/agarwal22a/agarwal22a.pdf,50.pdf
51,51,Continuous-Time Analysis of Accelerated Gradient Methods via Conservation Laws in Dilated Coordinate Systems,icml.cc/media/icml-2022/Slides/17998.pdf,proceedings.mlr.press/v162/suh22a/suh22a.pdf,51.pdf
52,52,Learning Infinite-horizon Average-reward Markov Decision Process with Constraints,icml.cc/media/icml-2022/Slides/17668.pdf,proceedings.mlr.press/v162/chen22i/chen22i.pdf,52.pdf
53,53,Co-training Improves Prompt-based Learning for Large Language Models,icml.cc/media/icml-2022/Slides/17882_zVMYPSH.pdf,proceedings.mlr.press/v162/lang22a/lang22a.pdf,53.pdf
54,54,Forward Operator Estimation in Generative Models with Kernel Transfer Operators,icml.cc/media/icml-2022/Slides/16996.pdf,proceedings.mlr.press/v162/huang22b/huang22b.pdf,54.pdf
55,55,A State-Distribution Matching Approach to Non-Episodic Reinforcement Learning,icml.cc/media/icml-2022/Slides/18114.pdf,proceedings.mlr.press/v162/sharma22a/sharma22a.pdf,55.pdf
56,56,DRAGONN: Distributed Randomized Approximate Gradients of Neural Networks,icml.cc/media/icml-2022/Slides/16702_6Hjt3OS.pdf,proceedings.mlr.press/v162/wang22aj/wang22aj.pdf,56.pdf
57,57,Plug & Play Attacks: Towards Robust and Flexible Model Inversion Attacks,icml.cc/media/icml-2022/Slides/16276_4Abc1R2.pdf,proceedings.mlr.press/v162/struppek22a/struppek22a.pdf,57.pdf
58,58,Evaluating the Adversarial Robustness of Adaptive Test-time Defenses,icml.cc/media/icml-2022/Slides/18042_FEz682J.pdf,proceedings.mlr.press/v162/croce22a/croce22a.pdf,58.pdf
59,59,DNA: Domain Generalization with Diversified Neural Averaging,icml.cc/media/icml-2022/Slides/16944.pdf,proceedings.mlr.press/v162/chu22a/chu22a.pdf,59.pdf
60,60,Langevin Monte Carlo for Contextual Bandits,icml.cc/media/icml-2022/Slides/18146.pdf,proceedings.mlr.press/v162/xu22p/xu22p.pdf,60.pdf
61,61,Balancing Discriminability and Transferability for Source-Free Domain Adaptation,icml.cc/media/icml-2022/Slides/17780.pdf,proceedings.mlr.press/v162/kundu22a/kundu22a.pdf,61.pdf
62,62,Conditional GANs with Auxiliary Discriminative Classifier,icml.cc/media/icml-2022/Slides/17140.pdf,proceedings.mlr.press/v162/hou22a/hou22a.pdf,62.pdf
63,63,StreamingQA: A Benchmark for Adaptation to New Knowledge over Time in Question Answering Models,icml.cc/media/icml-2022/Slides/17994.pdf,proceedings.mlr.press/v162/liska22a/liska22a.pdf,63.pdf
64,64,FriendlyCore: Practical Differentially Private Aggregation,icml.cc/media/icml-2022/Slides/16324.pdf,proceedings.mlr.press/v162/tsfadia22a/tsfadia22a.pdf,64.pdf
65,65,Equivalence Analysis between Counterfactual Regret Minimization and Online Mirror Descent,icml.cc/media/icml-2022/Slides/17864.pdf,proceedings.mlr.press/v162/liu22e/liu22e.pdf,65.pdf
66,66,Unified Fourier-based Kernel and Nonlinearity Design for Equivariant Networks on Homogeneous Spaces,icml.cc/media/icml-2022/Slides/17198.pdf,proceedings.mlr.press/v162/xu22e/xu22e.pdf,66.pdf
67,67,Unsupervised Detection of Contextualized Embedding Bias with Application to Ideology,icml.cc/media/icml-2022/Slides/18024_lpayKCd.pdf,proceedings.mlr.press/v162/hofmann22a/hofmann22a.pdf,67.pdf
68,68,Improved StyleGAN-v2 based Inversion for Out-of-Distribution Images,icml.cc/media/icml-2022/Slides/17162.pdf,proceedings.mlr.press/v162/subramanyam22a/subramanyam22a.pdf,68.pdf
69,69,Model Agnostic Sample Reweighting for Out-of-Distribution Learning,icml.cc/media/icml-2022/Slides/17868_ajInNyw.pdf,proceedings.mlr.press/v162/zhou22d/zhou22d.pdf,69.pdf
70,70,Prompting Decision Transformer for Few-Shot Policy Generalization,icml.cc/media/icml-2022/Slides/18154_yNId7Fo.pdf,proceedings.mlr.press/v162/xu22g/xu22g.pdf,70.pdf
71,71,LyaNet: A Lyapunov Framework for Training Neural ODEs,icml.cc/media/icml-2022/Slides/17060.pdf,proceedings.mlr.press/v162/rodriguez22a/rodriguez22a.pdf,71.pdf
72,72,ViT-NeT: Interpretable Vision Transformers with Neural Tree Decoder,icml.cc/media/icml-2022/Slides/16526.pdf,proceedings.mlr.press/v162/kim22g/kim22g.pdf,72.pdf
73,73,Batch Greenkhorn Algorithm for Entropic-Regularized Multimarginal Optimal Transport: Linear Rate of Convergence and Iteration Complexity,icml.cc/media/icml-2022/Slides/17940.pdf,proceedings.mlr.press/v162/kostic22a/kostic22a.pdf,73.pdf
74,74,Consistent Polyhedral Surrogates for Top-k Classification and Variants,icml.cc/media/icml-2022/Slides/17294_eVljuiL.pdf,proceedings.mlr.press/v162/thilagar22a/thilagar22a.pdf,74.pdf
75,75,Demystifying the Adversarial Robustness of Random Transformation Defenses,icml.cc/media/icml-2022/Slides/18178_KhmTe1z.pdf,proceedings.mlr.press/v162/sitawarin22a/sitawarin22a.pdf,75.pdf
76,76,Generative Cooperative Networks for Natural Language Generation,icml.cc/media/icml-2022/Slides/18132.pdf,proceedings.mlr.press/v162/lamprier22a/lamprier22a.pdf,76.pdf
77,77,Zero-shot AutoML with Pretrained Models,icml.cc/media/icml-2022/Slides/18008.pdf,proceedings.mlr.press/v162/ozturk22a/ozturk22a.pdf,77.pdf
78,78,Fishing for User Data in Large-Batch Federated Learning via Gradient Magnification,icml.cc/media/icml-2022/Slides/16788.pdf,proceedings.mlr.press/v162/wen22a/wen22a.pdf,78.pdf
79,79,Matching Normalizing Flows and Probability Paths on Manifolds,icml.cc/media/icml-2022/Slides/17244.pdf,proceedings.mlr.press/v162/ben-hamu22a/ben-hamu22a.pdf,79.pdf
80,80,Transfer and Marginalize: Explaining Away Label Noise with Privileged Information,icml.cc/media/icml-2022/Slides/17370.pdf,proceedings.mlr.press/v162/collier22a/collier22a.pdf,80.pdf
81,81,Contrastive UCB: Provably Efficient Contrastive Self-Supervised Learning in Online Reinforcement Learning,icml.cc/media/icml-2022/Slides/18338.pdf,proceedings.mlr.press/v162/qiu22c/qiu22c.pdf,81.pdf
82,82,Approximate Frank-Wolfe Algorithms over Graph-structured Support Sets,icml.cc/media/icml-2022/Slides/17938.pdf,proceedings.mlr.press/v162/zhou22i/zhou22i.pdf,82.pdf
83,83,Channel Importance Matters in Few-Shot Image Classification,icml.cc/media/icml-2022/Slides/18348_qvgw7MZ.pdf,proceedings.mlr.press/v162/luo22c/luo22c.pdf,83.pdf
84,84,Double Sampling Randomized Smoothing,icml.cc/media/icml-2022/Slides/18330.pdf,proceedings.mlr.press/v162/li22aa/li22aa.pdf,84.pdf
85,85,What Language Model Architecture and Pretraining Objective Works Best for Zero-Shot Generalization?,icml.cc/media/icml-2022/Slides/18142.pdf,proceedings.mlr.press/v162/wang22u/wang22u.pdf,85.pdf
86,86,Human-in-the-loop: Provably Efficient Preference-based Reinforcement Learning with General Function Approximation,icml.cc/media/icml-2022/Slides/18372.pdf,proceedings.mlr.press/v162/chen22ag/chen22ag.pdf,86.pdf
87,87,On Collective Robustness of Bagging Against Data Poisoning,icml.cc/media/icml-2022/Slides/17412.pdf,proceedings.mlr.press/v162/chen22k/chen22k.pdf,87.pdf
88,88,Marginal Distribution Adaptation for Discrete Sets via Module-Oriented Divergence Minimization,icml.cc/media/icml-2022/Slides/17266.pdf,proceedings.mlr.press/v162/dai22c/dai22c.pdf,88.pdf
89,89,Optimal and Efficient Dynamic Regret Algorithms for Non-Stationary Dueling Bandits,icml.cc/media/icml-2022/Slides/17676.pdf,proceedings.mlr.press/v162/saha22b/saha22b.pdf,89.pdf
90,90,TPC: Transformation-Specific Smoothing for Point Cloud Models,icml.cc/media/icml-2022/Slides/18366.pdf,proceedings.mlr.press/v162/chu22b/chu22b.pdf,90.pdf
91,91,Fishr: Invariant Gradient Variances for Out-of-Distribution Generalization,icml.cc/media/icml-2022/Slides/17214_fxdjvMU.pdf,proceedings.mlr.press/v162/rame22a/rame22a.pdf,91.pdf
92,92,Low-Complexity Deep Convolutional Neural Networks on Fully Homomorphic Encryption Using Multiplexed Parallel Convolutions,icml.cc/media/icml-2022/Slides/17802.pdf,proceedings.mlr.press/v162/lee22e/lee22e.pdf,92.pdf
93,93,Hindering Adversarial Attacks with Implicit Neural Representations,icml.cc/media/icml-2022/Slides/18020.pdf,proceedings.mlr.press/v162/rusu22a/rusu22a.pdf,93.pdf
94,94,Generalizing to Evolving Domains with Latent Structure-Aware Sequential Autoencoder,icml.cc/media/icml-2022/Slides/18056.pdf,proceedings.mlr.press/v162/qin22a/qin22a.pdf,94.pdf
95,95,Branchformer: Parallel MLP-Attention Architectures to Capture Local and Global Context for Speech Recognition and Understanding,icml.cc/media/icml-2022/Slides/18226.pdf,proceedings.mlr.press/v162/peng22a/peng22a.pdf,95.pdf
96,96,Active Sampling for Min-Max Fairness,icml.cc/media/icml-2022/Slides/18332.pdf,proceedings.mlr.press/v162/abernethy22a/abernethy22a.pdf,96.pdf
97,97,Online Nonsubmodular Minimization with Delayed Costs: From Full Information to Bandit Feedback,icml.cc/media/icml-2022/Slides/17752_I8rnBhB.pdf,proceedings.mlr.press/v162/lin22g/lin22g.pdf,97.pdf
98,98,From Noisy Prediction to True Label: Noisy Prediction Calibration via Generative Model,icml.cc/media/icml-2022/Slides/18350_oZIPQgX.pdf,proceedings.mlr.press/v162/bae22a/bae22a.pdf,98.pdf
99,99,Region-Based Semantic Factorization in GANs,icml.cc/media/icml-2022/Slides/18034.pdf,proceedings.mlr.press/v162/zhu22j/zhu22j.pdf,99.pdf
100,100,Robin Hood and Matthew Effects: Differential Privacy Has Disparate Impact on Synthetic Data,icml.cc/media/icml-2022/Slides/18248.pdf,proceedings.mlr.press/v162/ganev22a/ganev22a.pdf,100.pdf
101,101,Partial disentanglement for domain adaptation,icml.cc/media/icml-2022/Slides/18106.pdf,proceedings.mlr.press/v162/kong22a/kong22a.pdf,101.pdf
102,102,ROCK: Causal Inference Principles for Reasoning about Commonsense Causality,icml.cc/media/icml-2022/Slides/16472.pdf,proceedings.mlr.press/v162/zhang22am/zhang22am.pdf,102.pdf
103,103,Topology-Aware Network Pruning using Multi-stage Graph Embedding and Reinforcement Learning,icml.cc/media/icml-2022/Slides/16772.pdf,proceedings.mlr.press/v162/yu22e/yu22e.pdf,103.pdf
104,104,Align-RUDDER: Learning From Few Demonstrations by Reward Redistribution,icml.cc/media/icml-2022/Slides/17808.pdf,proceedings.mlr.press/v162/patil22a/patil22a.pdf,104.pdf
105,105,Robustness Implies Generalization via Data-Dependent Generalization Bounds,icml.cc/media/icml-2022/Slides/16122.pdf,proceedings.mlr.press/v162/kawaguchi22a/kawaguchi22a.pdf,105.pdf
106,106,Learning Mixtures of Linear Dynamical Systems,icml.cc/media/icml-2022/Slides/15994.pdf,proceedings.mlr.press/v162/chen22t/chen22t.pdf,106.pdf
107,107,Meaningfully debugging model mistakes using conceptual counterfactual explanations,icml.cc/media/icml-2022/Slides/16722.pdf,proceedings.mlr.press/v162/abid22a/abid22a.pdf,107.pdf
108,108,Online Continual Learning through Mutual Information Maximization,icml.cc/media/icml-2022/Slides/17488.pdf,proceedings.mlr.press/v162/guo22g/guo22g.pdf,108.pdf
109,109,Robust Group Synchronization via Quadratic Programming,icml.cc/media/icml-2022/Slides/17256.pdf,proceedings.mlr.press/v162/shi22g/shi22g.pdf,109.pdf
110,110,pathGCN: Learning General Graph Spatial Operators from Paths,icml.cc/media/icml-2022/Slides/17146.pdf,proceedings.mlr.press/v162/eliasof22a/eliasof22a.pdf,110.pdf
111,111,An iterative clustering algorithm for the Contextual Stochastic Block Model with optimality guarantees,icml.cc/media/icml-2022/Slides/16028.pdf,proceedings.mlr.press/v162/braun22a/braun22a.pdf,111.pdf
112,112,Additive Gaussian Processes Revisited,icml.cc/media/icml-2022/Slides/16274_xzadjqC.pdf,proceedings.mlr.press/v162/lu22b/lu22b.pdf,112.pdf
113,113,Probabilistic ODE Solutions in Millions of Dimensions,icml.cc/media/icml-2022/Slides/16336.pdf,proceedings.mlr.press/v162/kramer22b/kramer22b.pdf,113.pdf
114,114,Measuring the Effect of Training Data on Deep Learning Predictions via Randomized Experiments,icml.cc/media/icml-2022/Slides/16816_eYnOVfI.pdf,proceedings.mlr.press/v162/lin22h/lin22h.pdf,114.pdf
115,115,UAST: Uncertainty-Aware Siamese Tracking,icml.cc/media/icml-2022/Slides/17464.pdf,proceedings.mlr.press/v162/zhang22g/zhang22g.pdf,115.pdf
116,116,Learning Iterative Reasoning through Energy Minimization,icml.cc/media/icml-2022/Slides/17508_lUEKt9b.pdf,proceedings.mlr.press/v162/du22d/du22d.pdf,116.pdf
117,117,Graph-Coupled Oscillator Networks,icml.cc/media/icml-2022/Slides/17242.pdf,proceedings.mlr.press/v162/rusch22a/rusch22a.pdf,117.pdf
118,118,Smoothed Adaptive Weighting for Imbalanced Semi-Supervised Learning: Improve Reliability Against Unknown Distribution Data,icml.cc/media/icml-2022/Slides/16062.pdf,proceedings.mlr.press/v162/lai22b/lai22b.pdf,118.pdf
119,119,Robust Counterfactual Explanations for Tree-Based Ensembles,icml.cc/media/icml-2022/Slides/16964_HEoCCe8.pdf,proceedings.mlr.press/v162/dutta22a/dutta22a.pdf,119.pdf
120,120,HousE: Knowledge Graph Embedding with Householder Parameterization,icml.cc/media/icml-2022/Slides/17408.pdf,proceedings.mlr.press/v162/li22ab/li22ab.pdf,120.pdf
121,121,DepthShrinker: A New Compression Paradigm Towards Boosting Real-Hardware Efficiency of Compact Neural Networks,icml.cc/media/icml-2022/Slides/17550.pdf,proceedings.mlr.press/v162/fu22c/fu22c.pdf,121.pdf
122,122,Adaptive Gaussian Process Change Point Detection,icml.cc/media/icml-2022/Slides/17218.pdf,proceedings.mlr.press/v162/caldarelli22a/caldarelli22a.pdf,122.pdf
123,123,You Only Cut Once: Boosting Data Augmentation with a Single Cut,icml.cc/media/icml-2022/Slides/17624_k01InFw.pdf,proceedings.mlr.press/v162/han22a/han22a.pdf,123.pdf
124,124,PoF: Post-Training of Feature Extractor for Improving Generalization,icml.cc/media/icml-2022/Slides/17728.pdf,proceedings.mlr.press/v162/sato22a/sato22a.pdf,124.pdf
125,125,Volatility Based Kernels and Moving Average Means for Accurate Forecasting with Gaussian Processes,icml.cc/media/icml-2022/Slides/16874.pdf,proceedings.mlr.press/v162/benton22a/benton22a.pdf,125.pdf
126,126,Interpretable and Generalizable Graph Learning via Stochastic Attention Mechanism,icml.cc/media/icml-2022/Slides/17430.pdf,proceedings.mlr.press/v162/miao22a/miao22a.pdf,126.pdf
127,127,A Rigorous Study of Integrated Gradients Method and Extensions to Internal Neuron Attributions,icml.cc/media/icml-2022/Slides/17262.pdf,proceedings.mlr.press/v162/lundstrom22a/lundstrom22a.pdf,127.pdf
128,128,Generative Modeling for Multi-task Visual Learning,icml.cc/media/icml-2022/Slides/17652.pdf,proceedings.mlr.press/v162/bao22c/bao22c.pdf,128.pdf
129,129,AnyMorph: Learning Transferable Polices By Inferring Agent Morphology,icml.cc/media/icml-2022/Slides/17812_AbHrcuP.pdf,proceedings.mlr.press/v162/trabucco22b/trabucco22b.pdf,129.pdf
130,130,"Learning to Hash Robustly, Guaranteed",icml.cc/media/icml-2022/Slides/15992.pdf,proceedings.mlr.press/v162/andoni22a/andoni22a.pdf,130.pdf
131,131,Stochastic Reweighted Gradient Descent,icml.cc/media/icml-2022/Slides/16118.pdf,proceedings.mlr.press/v162/hanchi22a/hanchi22a.pdf,131.pdf
132,132,Estimating and Penalizing Induced Preference Shifts in Recommender Systems,icml.cc/media/icml-2022/Slides/17366.pdf,proceedings.mlr.press/v162/carroll22a/carroll22a.pdf,132.pdf
133,133,Meta-Learning Hypothesis Spaces for Sequential Decision-making,icml.cc/media/icml-2022/Slides/18152.pdf,proceedings.mlr.press/v162/kassraie22a/kassraie22a.pdf,133.pdf
134,134,ProGCL: Rethinking Hard Negative Mining in Graph Contrastive Learning,icml.cc/media/icml-2022/Slides/17578.pdf,proceedings.mlr.press/v162/xia22b/xia22b.pdf,134.pdf
135,135,Fenrir: Physics-Enhanced Regression for Initial Value Problems,icml.cc/media/icml-2022/Slides/17164.pdf,proceedings.mlr.press/v162/tronarp22a/tronarp22a.pdf,135.pdf
136,136,Improving Ensemble Distillation With Weight Averaging and Diversifying Perturbation,icml.cc/media/icml-2022/Slides/17838.pdf,proceedings.mlr.press/v162/nam22a/nam22a.pdf,136.pdf
137,137,HyperTransformer: Model Generation for Supervised and Semi-Supervised Few-Shot Learning,icml.cc/media/icml-2022/Slides/17688.pdf,proceedings.mlr.press/v162/zhmoginov22a/zhmoginov22a.pdf,137.pdf
138,138,DreamerPro: Reconstruction-Free Model-Based Reinforcement Learning with Prototypical Representations,icml.cc/media/icml-2022/Slides/17996.pdf,proceedings.mlr.press/v162/deng22a/deng22a.pdf,138.pdf
139,139,Sharpened Quasi-Newton Methods: Faster Superlinear Rate and Larger Local Convergence Neighborhood,icml.cc/media/icml-2022/Slides/16724.pdf,proceedings.mlr.press/v162/jin22b/jin22b.pdf,139.pdf
140,140,Residual-Based Sampling for Online Outlier-Robust PCA,icml.cc/media/icml-2022/Slides/16102_ZkCEA6R.pdf,proceedings.mlr.press/v162/zhu22i/zhu22i.pdf,140.pdf
141,141,Policy Gradient Method For Robust Reinforcement Learning,icml.cc/media/icml-2022/Slides/16374.pdf,proceedings.mlr.press/v162/wang22at/wang22at.pdf,141.pdf
142,142,Set Based Stochastic Subsampling,icml.cc/media/icml-2022/Slides/17894_LIlZfer.pdf,proceedings.mlr.press/v162/andreis22a/andreis22a.pdf,142.pdf
143,143,Variational nearest neighbor Gaussian process,icml.cc/media/icml-2022/Slides/17620_XXlnTGd.pdf,proceedings.mlr.press/v162/wu22h/wu22h.pdf,143.pdf
144,144,"A Tighter Analysis of Spectral Clustering, and Beyond",icml.cc/media/icml-2022/Slides/17964.pdf,proceedings.mlr.press/v162/macgregor22a/macgregor22a.pdf,144.pdf
145,145,Parametric Visual Program Induction with Function Modularization,icml.cc/media/icml-2022/Slides/17856.pdf,proceedings.mlr.press/v162/duan22c/duan22c.pdf,145.pdf
