,index,title,slide_url,paper_url,filename
578,578,Test-Time Training Can Close the Natural Distribution Shift Performance Gap in Deep Learning Based Compressed Sensing,icml.cc/media/icml-2022/Slides/17924.pdf,proceedings.mlr.press/v162/darestani22a/darestani22a.pdf,578.pdf
579,579,Active Multi-Task Representation Learning,icml.cc/media/icml-2022/Slides/16864_WCigeua.pdf,proceedings.mlr.press/v162/chen22j/chen22j.pdf,579.pdf
580,580,Adversarial Vulnerability of Randomized Ensembles,icml.cc/media/icml-2022/Slides/16510.pdf,proceedings.mlr.press/v162/dbouk22a/dbouk22a.pdf,580.pdf
581,581,Active fairness auditing,icml.cc/media/icml-2022/Slides/17204_te9uiZ5.pdf,proceedings.mlr.press/v162/yan22c/yan22c.pdf,581.pdf
582,582,Robustness Verification for Contrastive Learning,icml.cc/media/icml-2022/Slides/16762.pdf,proceedings.mlr.press/v162/wang22q/wang22q.pdf,582.pdf
583,583,A Dynamical System Perspective for Lipschitz Neural Networks,icml.cc/media/icml-2022/Slides/17626.pdf,proceedings.mlr.press/v162/meunier22a/meunier22a.pdf,583.pdf
584,584,Generating 3D Molecules for Target Protein Binding,icml.cc/media/icml-2022/Slides/16436_WyAiAzR.pdf,proceedings.mlr.press/v162/liu22m/liu22m.pdf,584.pdf
585,585,Streaming Inference for Infinite Feature Models,icml.cc/media/icml-2022/Slides/17082_Cx9sDXu.pdf,proceedings.mlr.press/v162/schaeffer22a/schaeffer22a.pdf,585.pdf
586,586,Out-of-Distribution Detection with Deep Nearest Neighbors,icml.cc/media/icml-2022/Slides/16494.pdf,proceedings.mlr.press/v162/sun22d/sun22d.pdf,586.pdf
587,587,Stochastic Rising Bandits,icml.cc/media/icml-2022/Slides/16244.pdf,proceedings.mlr.press/v162/metelli22a/metelli22a.pdf,587.pdf
588,588,Differentially Private Maximal Information Coefficients,icml.cc/media/icml-2022/Slides/16620_vHgb1w3.pdf,proceedings.mlr.press/v162/lazarsfeld22a/lazarsfeld22a.pdf,588.pdf
589,589,Optimizing Sequential Experimental Design with Deep Reinforcement Learning,icml.cc/media/icml-2022/Slides/17108.pdf,proceedings.mlr.press/v162/blau22a/blau22a.pdf,589.pdf
590,590,Improved Rates for Differentially Private Stochastic Convex Optimization with Heavy-Tailed Data,icml.cc/media/icml-2022/Slides/16328.pdf,proceedings.mlr.press/v162/kamath22a/kamath22a.pdf,590.pdf
591,591,Function-space Inference with Sparse Implicit Processes,icml.cc/media/icml-2022/Slides/16074.pdf,proceedings.mlr.press/v162/rodri-guez-santana22a/rodri-guez-santana22a.pdf,591.pdf
592,592,Agnostic Learnability of Halfspaces via Logistic Loss,icml.cc/media/icml-2022/Slides/16454.pdf,proceedings.mlr.press/v162/ji22a/ji22a.pdf,592.pdf
593,593,A Temporal-Difference Approach to Policy Gradient Estimation,icml.cc/media/icml-2022/Slides/17450.pdf,proceedings.mlr.press/v162/tosatto22a/tosatto22a.pdf,593.pdf
594,594,3D Infomax improves GNNs for Molecular Property Prediction,icml.cc/media/icml-2022/Slides/17332.pdf,proceedings.mlr.press/v162/stark22a/stark22a.pdf,594.pdf
595,595,Metric-Fair Active Learning,icml.cc/media/icml-2022/Slides/16954.pdf,proceedings.mlr.press/v162/shen22b/shen22b.pdf,595.pdf
596,596,Identification of Linear Non-Gaussian Latent Hierarchical Structure,icml.cc/media/icml-2022/Slides/16844.pdf,proceedings.mlr.press/v162/xie22a/xie22a.pdf,596.pdf
597,597,Sparse Double Descent: Where Network Pruning Aggravates Overfitting,icml.cc/media/icml-2022/Slides/17250_SWdx1qO.pdf,proceedings.mlr.press/v162/he22d/he22d.pdf,597.pdf
598,598,MASER: Multi-Agent Reinforcement Learning with Subgoals Generated from Experience Replay Buffer,icml.cc/media/icml-2022/Slides/17580_z0BSUMY.pdf,proceedings.mlr.press/v162/jeon22a/jeon22a.pdf,598.pdf
599,599,Biological Sequence Design with GFlowNets,icml.cc/media/icml-2022/Slides/17338.pdf,proceedings.mlr.press/v162/jain22a/jain22a.pdf,599.pdf
600,600,COAT: Measuring Object Compositionality in Emergent Representations,icml.cc/media/icml-2022/Slides/16678.pdf,proceedings.mlr.press/v162/xie22b/xie22b.pdf,600.pdf
601,601,Finding Global Homophily in Graph Neural Networks When Meeting Heterophily,icml.cc/media/icml-2022/Slides/16870.pdf,proceedings.mlr.press/v162/li22ad/li22ad.pdf,601.pdf
602,602,Metric-Fair Classifier Derandomization,icml.cc/media/icml-2022/Slides/17056.pdf,proceedings.mlr.press/v162/wu22a/wu22a.pdf,602.pdf
603,603,Neurotoxin: Durable Backdoors in Federated Learning,icml.cc/media/icml-2022/Slides/18208.pdf,proceedings.mlr.press/v162/zhang22w/zhang22w.pdf,603.pdf
604,604,Pocket2Mol: Efficient Molecular Sampling Based on 3D Protein Pockets,icml.cc/media/icml-2022/Slides/17850.pdf,proceedings.mlr.press/v162/peng22b/peng22b.pdf,604.pdf
605,605,On the Difficulty of Defending Self-Supervised Learning against Model Extraction,icml.cc/media/icml-2022/Slides/17054.pdf,proceedings.mlr.press/v162/dziedzic22a/dziedzic22a.pdf,605.pdf
606,606,Variational Inference for Infinitely Deep Neural Networks,icml.cc/media/icml-2022/Slides/17238_jU5byNL.pdf,proceedings.mlr.press/v162/nazaret22a/nazaret22a.pdf,606.pdf
607,607,"Fluctuations, Bias, Variance & Ensemble of Learners: Exact Asymptotics for Convex Losses in High-Dimension",icml.cc/media/icml-2022/Slides/16332.pdf,proceedings.mlr.press/v162/loureiro22a/loureiro22a.pdf,607.pdf
608,608,Actor-Critic based Improper Reinforcement Learning,icml.cc/media/icml-2022/Slides/17602_vHt8qhS.pdf,proceedings.mlr.press/v162/zaki22a/zaki22a.pdf,608.pdf
609,609,Interactively Learning Preference Constraints in Linear Bandits,icml.cc/media/icml-2022/Slides/17120.pdf,proceedings.mlr.press/v162/lindner22a/lindner22a.pdf,609.pdf
610,610,Understanding Robust Generalization in Learning Regular Languages,icml.cc/media/icml-2022/Slides/16928_PYW3edB.pdf,proceedings.mlr.press/v162/dan22a/dan22a.pdf,610.pdf
611,611,Retroformer: Pushing the Limits of End-to-end Retrosynthesis Transformer,icml.cc/media/icml-2022/Slides/18130.pdf,proceedings.mlr.press/v162/wan22a/wan22a.pdf,611.pdf
612,612,Personalized Federated Learning via Variational Bayesian Inference,icml.cc/media/icml-2022/Slides/17302.pdf,proceedings.mlr.press/v162/zhang22o/zhang22o.pdf,612.pdf
613,613,PDE-Based Optimal Strategy for Unconstrained Online Learning,icml.cc/media/icml-2022/Slides/16330.pdf,proceedings.mlr.press/v162/zhang22d/zhang22d.pdf,613.pdf
614,614,Adversarial Attack and Defense for Non-Parametric Two-Sample Tests,icml.cc/media/icml-2022/Slides/17058_EBEjIND.pdf,proceedings.mlr.press/v162/xu22m/xu22m.pdf,614.pdf
615,615,NAFS: A Simple yet Tough-to-beat Baseline for Graph Representation Learning,icml.cc/media/icml-2022/Slides/17248.pdf,proceedings.mlr.press/v162/zhang22y/zhang22y.pdf,615.pdf
616,616,Maximum Likelihood Training for Score-based Diffusion ODEs by High Order Denoising Score Matching,icml.cc/media/icml-2022/Slides/17684.pdf,proceedings.mlr.press/v162/lu22f/lu22f.pdf,616.pdf
617,617,Convergence of Uncertainty Sampling for Active Learning,icml.cc/media/icml-2022/Slides/17186.pdf,proceedings.mlr.press/v162/raj22a/raj22a.pdf,617.pdf
618,618,Improving Robustness against Real-World and Worst-Case Distribution Shifts through Decision Region Quantification,icml.cc/media/icml-2022/Slides/17072.pdf,proceedings.mlr.press/v162/schwinn22a/schwinn22a.pdf,618.pdf
619,619,On the Sample Complexity of Learning Infinite-horizon Discounted Linear Kernel MDPs,icml.cc/media/icml-2022/Slides/17896_clc6CuM.pdf,proceedings.mlr.press/v162/chen22f/chen22f.pdf,619.pdf
620,620,Stochastic smoothing of the top-K calibrated hinge loss for deep imbalanced classification,icml.cc/media/icml-2022/Slides/17930.pdf,proceedings.mlr.press/v162/garcin22a/garcin22a.pdf,620.pdf
621,621,Constrained Optimization with Dynamic Bound-scaling for Effective NLP Backdoor Defense,icml.cc/media/icml-2022/Slides/17166.pdf,proceedings.mlr.press/v162/shen22e/shen22e.pdf,621.pdf
622,622,Provable Acceleration of Heavy Ball beyond Quadratics for a Class of Polyak-Lojasiewicz Functions when the Non-Convexity is Averaged-Out,icml.cc/media/icml-2022/Slides/16518.pdf,proceedings.mlr.press/v162/wang22p/wang22p.pdf,622.pdf
623,623,Certified Adversarial Robustness Under the Bounded Support Set,icml.cc/media/icml-2022/Slides/17478.pdf,proceedings.mlr.press/v162/kou22a/kou22a.pdf,623.pdf
624,624,A Unified Weight Initialization Paradigm for Tensorial Convolutional Neural Networks,icml.cc/media/icml-2022/Slides/18058.pdf,proceedings.mlr.press/v162/pan22b/pan22b.pdf,624.pdf
625,625,Thompson Sampling for Robust Transfer in Multi-Task Bandits,icml.cc/media/icml-2022/Slides/16878.pdf,proceedings.mlr.press/v162/wang22an/wang22an.pdf,625.pdf
626,626,Action-Sufficient State Representation Learning for Control with Structural Constraints,icml.cc/media/icml-2022/Slides/17324.pdf,proceedings.mlr.press/v162/huang22f/huang22f.pdf,626.pdf
627,627,Fast Lossless Neural Compression with Integer-Only Discrete Flows,icml.cc/media/icml-2022/Slides/17734.pdf,proceedings.mlr.press/v162/wang22a/wang22a.pdf,627.pdf
628,628,Path-Aware and Structure-Preserving Generation of Synthetically Accessible Molecules,icml.cc/media/icml-2022/Slides/18316.pdf,proceedings.mlr.press/v162/noh22a/noh22a.pdf,628.pdf
629,629,Predicting Out-of-Distribution Error with the Projection Norm,icml.cc/media/icml-2022/Slides/17656_6Q3N8nr.pdf,proceedings.mlr.press/v162/yu22i/yu22i.pdf,629.pdf
630,630,On Learning Mixture of Linear Regressions in the Non-Realizable Setting,icml.cc/media/icml-2022/Slides/16904_lwoF2bG.pdf,proceedings.mlr.press/v162/pal22b/pal22b.pdf,630.pdf
631,631,A Modern Self-Referential Weight Matrix That Learns to Modify Itself,icml.cc/media/icml-2022/Slides/17700_Qq7FBxu.pdf,proceedings.mlr.press/v162/irie22b/irie22b.pdf,631.pdf
632,632,Constants Matter: The Performance Gains of Active Learning,icml.cc/media/icml-2022/Slides/17610_YXtDzcj.pdf,proceedings.mlr.press/v162/mussmann22a/mussmann22a.pdf,632.pdf
633,633,Denoised MDPs: Learning World Models Better Than the World Itself,icml.cc/media/icml-2022/Slides/17444_20IRPwo.pdf,proceedings.mlr.press/v162/wang22c/wang22c.pdf,633.pdf
634,634,PLATINUM: Semi-Supervised Model Agnostic Meta-Learning using Submodular Mutual Information,icml.cc/media/icml-2022/Slides/18232.pdf,proceedings.mlr.press/v162/li22k/li22k.pdf,634.pdf
635,635,SQ-VAE: Variational Bayes on Discrete Representation with Self-annealed Stochastic Quantization,icml.cc/media/icml-2022/Slides/17788.pdf,proceedings.mlr.press/v162/takida22a/takida22a.pdf,635.pdf
636,636,EquiBind: Geometric Deep Learning for Drug Binding Structure Prediction,icml.cc/media/icml-2022/Slides/18362.pdf,proceedings.mlr.press/v162/stark22b/stark22b.pdf,636.pdf
637,637,Random Forest Density Estimation,icml.cc/media/icml-2022/Slides/17320.pdf,proceedings.mlr.press/v162/wen22c/wen22c.pdf,637.pdf
638,638,Efficient Approximate Inference for Stationary Kernel on Frequency Domain,icml.cc/media/icml-2022/Slides/18382.pdf,proceedings.mlr.press/v162/jung22b/jung22b.pdf,638.pdf
639,639,Adversarially Robust Models may not Transfer Better: Sufficient Conditions for Domain Transferability from the View of Regularization,icml.cc/media/icml-2022/Slides/18194.pdf,proceedings.mlr.press/v162/xu22n/xu22n.pdf,639.pdf
640,640,Short-Term Plasticity Neurons Learning to Learn and Forget,icml.cc/media/icml-2022/Slides/18310.pdf,proceedings.mlr.press/v162/rodriguez22b/rodriguez22b.pdf,640.pdf
641,641,Multicoated Supermasks Enhance Hidden Networks,icml.cc/media/icml-2022/Slides/18246.pdf,proceedings.mlr.press/v162/okoshi22a/okoshi22a.pdf,641.pdf
642,642,A New Perspective on the Effects of Spectrum in Graph Neural Networks,icml.cc/media/icml-2022/Slides/16962.pdf,proceedings.mlr.press/v162/yang22n/yang22n.pdf,642.pdf
643,643,Improved Regret for Differentially Private Exploration in Linear MDP,icml.cc/media/icml-2022/Slides/16760_JJ3AjUG.pdf,proceedings.mlr.press/v162/ngo22a/ngo22a.pdf,643.pdf
644,644,NISPA: Neuro-Inspired Stability-Plasticity Adaptation for Continual Learning in Sparse Networks,icml.cc/media/icml-2022/Slides/16096.pdf,proceedings.mlr.press/v162/gurbuz22a/gurbuz22a.pdf,644.pdf
645,645,Neural Tangent Kernel Beyond the Infinite-Width Limit: Effects of Depth and Initialization,icml.cc/media/icml-2022/Slides/16474.pdf,proceedings.mlr.press/v162/seleznova22a/seleznova22a.pdf,645.pdf
646,646,The Infinite Contextual Graph Markov Model,icml.cc/media/icml-2022/Slides/16216.pdf,proceedings.mlr.press/v162/castellana22a/castellana22a.pdf,646.pdf
647,647,Implicit Regularization in Hierarchical Tensor Factorization and Deep Convolutional Neural Networks,icml.cc/media/icml-2022/Slides/16018_xL30pIS.pdf,proceedings.mlr.press/v162/razin22a/razin22a.pdf,647.pdf
648,648,Matching Structure for Dual Learning,icml.cc/media/icml-2022/Slides/16006.pdf,proceedings.mlr.press/v162/fei22a/fei22a.pdf,648.pdf
649,649,Bayesian Nonparametrics for Offline Skill Discovery,icml.cc/media/icml-2022/Slides/16270.pdf,proceedings.mlr.press/v162/villecroze22a/villecroze22a.pdf,649.pdf
650,650,Equivariant Quantum Graph Circuits,icml.cc/media/icml-2022/Slides/16082.pdf,proceedings.mlr.press/v162/mernyei22a/mernyei22a.pdf,650.pdf
651,651,Differentially Private Community Detection for Stochastic Block Models,icml.cc/media/icml-2022/Slides/16780.pdf,proceedings.mlr.press/v162/mohamed22a/mohamed22a.pdf,651.pdf
652,652,A Tree-based Model Averaging Approach for Personalized Treatment Effect Estimation from Heterogeneous Data Sources,icml.cc/media/icml-2022/Slides/16612.pdf,proceedings.mlr.press/v162/tan22a/tan22a.pdf,652.pdf
653,653,"Synergy and Symmetry in Deep Learning: Interactions between the Data, Model, and Inference Algorithm",icml.cc/media/icml-2022/Slides/16698_ROEGd80.pdf,proceedings.mlr.press/v162/xiao22a/xiao22a.pdf,653.pdf
654,654,Molecular Representation Learning via Heterogeneous Motif Graph Neural Networks,icml.cc/media/icml-2022/Slides/17132.pdf,proceedings.mlr.press/v162/yu22a/yu22a.pdf,654.pdf
655,655,Implicit Bias of Linear Equivariant Networks,icml.cc/media/icml-2022/Slides/16544_Sv109cR.pdf,proceedings.mlr.press/v162/lawrence22a/lawrence22a.pdf,655.pdf
656,656,Understanding Clipping for Federated Learning: Convergence and Client-Level Differential Privacy,icml.cc/media/icml-2022/Slides/16804.pdf,proceedings.mlr.press/v162/zhang22b/zhang22b.pdf,656.pdf
657,657,The State of Sparse Training in Deep Reinforcement Learning,icml.cc/media/icml-2022/Slides/16714.pdf,proceedings.mlr.press/v162/graesser22a/graesser22a.pdf,657.pdf
658,658,Efficient Online ML API Selection for Multi-Label Classification Tasks,icml.cc/media/icml-2022/Slides/16688_ihsMij9.pdf,proceedings.mlr.press/v162/chen22ad/chen22ad.pdf,658.pdf
659,659,Detached Error Feedback for Distributed SGD with Random Sparsification,icml.cc/media/icml-2022/Slides/16508_j2w1OHr.pdf,proceedings.mlr.press/v162/xu22c/xu22c.pdf,659.pdf
660,660,Partial Label Learning via Label Influence Function,icml.cc/media/icml-2022/Slides/15976.pdf,proceedings.mlr.press/v162/gong22c/gong22c.pdf,660.pdf
661,661,Convergence of Policy Gradient for Entropy Regularized MDPs with Neural Network Approximation in the Mean-Field Regime,icml.cc/media/icml-2022/Slides/16286.pdf,proceedings.mlr.press/v162/leahy22a/leahy22a.pdf,661.pdf
662,662,A Theoretical Comparison of Graph Neural Network Extensions,icml.cc/media/icml-2022/Slides/16098.pdf,proceedings.mlr.press/v162/papp22a/papp22a.pdf,662.pdf
663,663,Estimation in Rotationally Invariant Generalized Linear Models via Approximate Message Passing,icml.cc/media/icml-2022/Slides/16164.pdf,proceedings.mlr.press/v162/venkataramanan22a/venkataramanan22a.pdf,663.pdf
664,664,Auxiliary Learning with Joint Task and Data Scheduling,icml.cc/media/icml-2022/Slides/17292_xchL02y.pdf,proceedings.mlr.press/v162/chen22y/chen22y.pdf,664.pdf
665,665,Curriculum Reinforcement Learning via Constrained Optimal Transport,icml.cc/media/icml-2022/Slides/16304.pdf,proceedings.mlr.press/v162/klink22a/klink22a.pdf,665.pdf
666,666,Minimax Classification under Concept Drift with Multidimensional Adaptation and Performance Guarantees,icml.cc/media/icml-2022/Slides/16094_xLRQJz7.pdf,proceedings.mlr.press/v162/alvarez22a/alvarez22a.pdf,666.pdf
667,667,YourTTS: Towards Zero-Shot Multi-Speaker TTS and Zero-Shot Voice Conversion for Everyone,icml.cc/media/icml-2022/Slides/16092_np5fq8L.pdf,proceedings.mlr.press/v162/casanova22a/casanova22a.pdf,667.pdf
668,668,Variational On-the-Fly Personalization,icml.cc/media/icml-2022/Slides/16110.pdf,proceedings.mlr.press/v162/kim22e/kim22e.pdf,668.pdf
669,669,Large-scale Stochastic Optimization of NDCG Surrogates for Deep Learning with Provable Convergence,icml.cc/media/icml-2022/Slides/17312_PtSvs8w.pdf,proceedings.mlr.press/v162/qiu22a/qiu22a.pdf,669.pdf
670,670,Hermite Polynomial Features for Private Data Generation,icml.cc/media/icml-2022/Slides/16814.pdf,proceedings.mlr.press/v162/vinaroz22a/vinaroz22a.pdf,670.pdf
671,671,Training OOD Detectors in their Natural Habitats,icml.cc/media/icml-2022/Slides/16530.pdf,proceedings.mlr.press/v162/katz-samuels22a/katz-samuels22a.pdf,671.pdf
672,672,Set Norm and Equivariant Skip Connections: Putting the Deep in Deep Sets,icml.cc/media/icml-2022/Slides/16894_i8cQdgw.pdf,proceedings.mlr.press/v162/zhang22ac/zhang22ac.pdf,672.pdf
673,673,Entropic Causal Inference: Graph Identifiability,icml.cc/media/icml-2022/Slides/16754_FlhU41Q.pdf,proceedings.mlr.press/v162/compton22a/compton22a.pdf,673.pdf
674,674,Architecture Agnostic Federated Learning for Neural Networks,icml.cc/media/icml-2022/Slides/16926.pdf,proceedings.mlr.press/v162/makhija22a/makhija22a.pdf,674.pdf
675,675,How to Steer Your Adversary: Targeted and Efficient Model Stealing Defenses with Gradient Redirection,icml.cc/media/icml-2022/Slides/16922_Qlem1nL.pdf,proceedings.mlr.press/v162/mazeika22a/mazeika22a.pdf,675.pdf
676,676,Datamodels: Understanding Predictions with Data and Data with Predictions,icml.cc/media/icml-2022/Slides/16972.pdf,proceedings.mlr.press/v162/ilyas22a/ilyas22a.pdf,676.pdf
677,677,Gating Dropout: Communication-efficient Regularization for Sparsely Activated Transformers,icml.cc/media/icml-2022/Slides/17416.pdf,proceedings.mlr.press/v162/liu22g/liu22g.pdf,677.pdf
678,678,Constrained Gradient Descent: A Powerful and Principled Evasion Attack Against Neural Networks,icml.cc/media/icml-2022/Slides/16716.pdf,proceedings.mlr.press/v162/lin22e/lin22e.pdf,678.pdf
679,679,Deep symbolic regression for recurrence prediction,icml.cc/media/icml-2022/Slides/16220_1gIXRPd.pdf,proceedings.mlr.press/v162/d-ascoli22a/d-ascoli22a.pdf,679.pdf
680,680,Regret Bounds for Stochastic Shortest Path Problems with Linear Function Approximation,icml.cc/media/icml-2022/Slides/16386.pdf,proceedings.mlr.press/v162/vial22a/vial22a.pdf,680.pdf
681,681,Recurrent Model-Free RL Can Be a Strong Baseline for Many POMDPs,icml.cc/media/icml-2022/Slides/16432.pdf,proceedings.mlr.press/v162/ni22a/ni22a.pdf,681.pdf
682,682,Understanding Robust Overfitting of Adversarial Training and Beyond,icml.cc/media/icml-2022/Slides/16154.pdf,proceedings.mlr.press/v162/yu22b/yu22b.pdf,682.pdf
683,683,Universal Joint Approximation of Manifolds and Densities by Simple Injective Flows,icml.cc/media/icml-2022/Slides/16428.pdf,proceedings.mlr.press/v162/puthawala22a/puthawala22a.pdf,683.pdf
684,684,Geometric Multimodal Contrastive Representation Learning,icml.cc/media/icml-2022/Slides/16228.pdf,proceedings.mlr.press/v162/poklukar22a/poklukar22a.pdf,684.pdf
685,685,Generalizing Gaussian Smoothing for Random Search,icml.cc/media/icml-2022/Slides/16434.pdf,proceedings.mlr.press/v162/gao22f/gao22f.pdf,685.pdf
686,686,Deduplicating Training Data Mitigates Privacy Risks in Language Models,icml.cc/media/icml-2022/Slides/17280_YD8oR2N.pdf,proceedings.mlr.press/v162/kandpal22a/kandpal22a.pdf,686.pdf
687,687,Revisiting and Advancing Fast Adversarial Training Through The Lens of Bi-Level Optimization,icml.cc/media/icml-2022/Slides/17272_MRQSpN2.pdf,proceedings.mlr.press/v162/zhang22ak/zhang22ak.pdf,687.pdf
688,688,SDQ: Stochastic Differentiable Quantization with Mixed Precision,icml.cc/media/icml-2022/Slides/16258.pdf,proceedings.mlr.press/v162/huang22h/huang22h.pdf,688.pdf
689,689,Neural Tangent Kernel Empowered Federated Learning,icml.cc/media/icml-2022/Slides/16732.pdf,proceedings.mlr.press/v162/yue22a/yue22a.pdf,689.pdf
690,690,Conformal Prediction Sets with Limited False Positives,icml.cc/media/icml-2022/Slides/17300.pdf,proceedings.mlr.press/v162/fisch22a/fisch22a.pdf,690.pdf
691,691,Hierarchical Shrinkage: Improving the accuracy and interpretability of tree-based models.,icml.cc/media/icml-2022/Slides/16830_sRTAhDI.pdf,proceedings.mlr.press/v162/agarwal22b/agarwal22b.pdf,691.pdf
692,692,A General Recipe for Likelihood-free Bayesian Optimization,icml.cc/media/icml-2022/Slides/16468.pdf,proceedings.mlr.press/v162/song22b/song22b.pdf,692.pdf
693,693,"IGLUE: A Benchmark for Transfer Learning across Modalities, Tasks, and Languages",icml.cc/media/icml-2022/Slides/16296.pdf,proceedings.mlr.press/v162/bugliarello22a/bugliarello22a.pdf,693.pdf
694,694,Scalable Computation of Causal Bounds,icml.cc/media/icml-2022/Slides/16298.pdf,proceedings.mlr.press/v162/shridharan22a/shridharan22a.pdf,694.pdf
695,695,Universality of Winning Tickets: A Renormalization Group Perspective,icml.cc/media/icml-2022/Slides/16284.pdf,proceedings.mlr.press/v162/redman22a/redman22a.pdf,695.pdf
696,696,Constrained Offline Policy Optimization,icml.cc/media/icml-2022/Slides/16570_YortKS6.pdf,proceedings.mlr.press/v162/polosky22a/polosky22a.pdf,696.pdf
697,697,Deep Causal Metric Learning,icml.cc/media/icml-2022/Slides/17252.pdf,proceedings.mlr.press/v162/deng22c/deng22c.pdf,697.pdf
698,698,Private frequency estimation via projective geometry,icml.cc/media/icml-2022/Slides/17330.pdf,proceedings.mlr.press/v162/feldman22a/feldman22a.pdf,698.pdf
699,699,The Poisson Binomial Mechanism for Unbiased Federated Learning with Secure Aggregation,icml.cc/media/icml-2022/Slides/17922_u8B84RF.pdf,proceedings.mlr.press/v162/chen22s/chen22s.pdf,699.pdf
700,700,Partial and Asymmetric Contrastive Learning for Out-of-Distribution Detection in Long-Tailed Recognition,icml.cc/media/icml-2022/Slides/16860_9OpKZdg.pdf,proceedings.mlr.press/v162/wang22aq/wang22aq.pdf,700.pdf
701,701,LIDL: Local Intrinsic Dimension Estimation Using Approximate Likelihood,icml.cc/media/icml-2022/Slides/18216.pdf,proceedings.mlr.press/v162/tempczyk22a/tempczyk22a.pdf,701.pdf
702,702,Causal Dynamics Learning for Task-Independent State Abstraction,icml.cc/media/icml-2022/Slides/16840_2CvH90r.pdf,proceedings.mlr.press/v162/wang22ae/wang22ae.pdf,702.pdf
703,703,Last Iterate Risk Bounds of SGD with Decaying Stepsize for Overparameterized Linear Regression,icml.cc/media/icml-2022/Slides/17038_RVAKqjT.pdf,proceedings.mlr.press/v162/wu22p/wu22p.pdf,703.pdf
704,704,Not All Poisons are Created Equal: Robust Training against Data Poisoning,icml.cc/media/icml-2022/Slides/17154.pdf,proceedings.mlr.press/v162/yang22j/yang22j.pdf,704.pdf
705,705,Supervised Learning with General Risk Functionals,icml.cc/media/icml-2022/Slides/16766_m7vWuQN.pdf,proceedings.mlr.press/v162/leqi22a/leqi22a.pdf,705.pdf
706,706,Feature Space Particle Inference for Neural Network Ensembles,icml.cc/media/icml-2022/Slides/16980_15Vidoa.pdf,proceedings.mlr.press/v162/yashima22a/yashima22a.pdf,706.pdf
707,707,Faster Privacy Accounting via Evolving Discretization,icml.cc/media/icml-2022/Slides/17466.pdf,proceedings.mlr.press/v162/ghazi22a/ghazi22a.pdf,707.pdf
708,708,Leveraging Approximate Symbolic Models for Reinforcement Learning via Skill Diversity,icml.cc/media/icml-2022/Slides/17382.pdf,proceedings.mlr.press/v162/guan22c/guan22c.pdf,708.pdf
709,709,Locally Sparse Neural Networks for Tabular Biomedical Data,icml.cc/media/icml-2022/Slides/16810.pdf,proceedings.mlr.press/v162/yang22i/yang22i.pdf,709.pdf
710,710,Learning Symmetric Embeddings for Equivariant World Models,icml.cc/media/icml-2022/Slides/17396.pdf,proceedings.mlr.press/v162/park22a/park22a.pdf,710.pdf
711,711,Risk-Averse No-Regret Learning in Online Convex Games,icml.cc/media/icml-2022/Slides/16588.pdf,proceedings.mlr.press/v162/wang22w/wang22w.pdf,711.pdf
712,712,Learning Pseudometric-based Action Representations for Offline Reinforcement Learning,icml.cc/media/icml-2022/Slides/17586.pdf,proceedings.mlr.press/v162/gu22b/gu22b.pdf,712.pdf
713,713,Loss Function Learning for Domain Generalization by Implicit Gradient,icml.cc/media/icml-2022/Slides/16426.pdf,proceedings.mlr.press/v162/gao22b/gao22b.pdf,713.pdf
714,714,A Statistical Manifold Framework for Point Cloud Data,icml.cc/media/icml-2022/Slides/17932.pdf,proceedings.mlr.press/v162/lee22d/lee22d.pdf,714.pdf
715,715,Efficient Learning of CNNs using Patch Based Features,icml.cc/media/icml-2022/Slides/17342.pdf,proceedings.mlr.press/v162/brutzkus22a/brutzkus22a.pdf,715.pdf
716,716,Dual Perspective of Label-Specific Feature Learning for Multi-Label Classification,icml.cc/media/icml-2022/Slides/16632.pdf,proceedings.mlr.press/v162/hang22a/hang22a.pdf,716.pdf
717,717,Reinforcement Learning with Action-Free Pre-Training from Videos,icml.cc/media/icml-2022/Slides/17410_VtDtB4a.pdf,proceedings.mlr.press/v162/seo22a/seo22a.pdf,717.pdf
718,718,Improve Single-Point Zeroth-Order Optimization Using High-Pass and Low-Pass Filters,icml.cc/media/icml-2022/Slides/16792_AYFN4Xs.pdf,proceedings.mlr.press/v162/chen22w/chen22w.pdf,718.pdf
719,719,A Study on the Ramanujan Graph Property of Winning Lottery Tickets,icml.cc/media/icml-2022/Slides/16786.pdf,proceedings.mlr.press/v162/pal22a/pal22a.pdf,719.pdf
720,720,Robust alignment of cross-session recordings of neural population activity by behaviour via unsupervised domain adaptation,icml.cc/media/icml-2022/Slides/16482.pdf,proceedings.mlr.press/v162/jude22a/jude22a.pdf,720.pdf
721,721,Accelerated Federated Learning with Decoupled Adaptive Optimization,icml.cc/media/icml-2022/Slides/17540.pdf,proceedings.mlr.press/v162/jin22e/jin22e.pdf,721.pdf
722,722,GraphFM: Improving Large-Scale GNN Training via Feature Momentum,icml.cc/media/icml-2022/Slides/16580.pdf,proceedings.mlr.press/v162/yu22g/yu22g.pdf,722.pdf
