,index,title,slide_url,paper_url,filename
864,864,Winning the Lottery Ahead of Time: Efficient Early Network Pruning,icml.cc/media/icml-2022/Slides/17710.pdf,proceedings.mlr.press/v162/rachwan22a/rachwan22a.pdf,864.pdf
865,865,Fourier Learning with Cyclical Data,icml.cc/media/icml-2022/Slides/16604.pdf,proceedings.mlr.press/v162/yang22o/yang22o.pdf,865.pdf
866,866,Parsimonious Learning-Augmented Caching,icml.cc/media/icml-2022/Slides/16574.pdf,proceedings.mlr.press/v162/im22a/im22a.pdf,866.pdf
867,867,Linearity Grafting: Relaxed Neuron Pruning Helps Certifiable Robustness,icml.cc/media/icml-2022/Slides/17554.pdf,proceedings.mlr.press/v162/chen22af/chen22af.pdf,867.pdf
868,868,Antibody-Antigen Docking and Design via Hierarchical Structure Refinement,icml.cc/media/icml-2022/Slides/16626_LX1FRzx.pdf,proceedings.mlr.press/v162/jin22a/jin22a.pdf,868.pdf
869,869,Entropic Gromov-Wasserstein between Gaussian Distributions,icml.cc/media/icml-2022/Slides/16670.pdf,proceedings.mlr.press/v162/le22a/le22a.pdf,869.pdf
870,870,"Generic Coreset for Scalable Learning of Monotonic Kernels: Logistic Regression, Sigmoid and more",icml.cc/media/icml-2022/Slides/16170.pdf,proceedings.mlr.press/v162/tolochinksy22a/tolochinksy22a.pdf,870.pdf
871,871,Pure Noise to the Rescue of Insufficient Data: Improving Imbalanced Classification by Training on Random Noise Images,icml.cc/media/icml-2022/Slides/16420_cnkaEx7.pdf,proceedings.mlr.press/v162/zada22a/zada22a.pdf,871.pdf
872,872,A Hierarchical Transitive-Aligned Graph Kernel for Un-attributed Graphs,icml.cc/media/icml-2022/Slides/16246.pdf,proceedings.mlr.press/v162/bai22a/bai22a.pdf,872.pdf
873,873,Active Learning on a Budget: Opposite Strategies Suit High and Low Budgets,icml.cc/media/icml-2022/Slides/17720_U5ukEb1.pdf,proceedings.mlr.press/v162/hacohen22a/hacohen22a.pdf,873.pdf
874,874,Linear Adversarial Concept Erasure,icml.cc/media/icml-2022/Slides/17322_kM5p3Fz.pdf,proceedings.mlr.press/v162/ravfogel22a/ravfogel22a.pdf,874.pdf
875,875,Diffusion Models for Adversarial Purification,icml.cc/media/icml-2022/Slides/16708.pdf,proceedings.mlr.press/v162/nie22a/nie22a.pdf,875.pdf
876,876,GACT: Activation Compressed Training for Generic Network Architectures,icml.cc/media/icml-2022/Slides/17190.pdf,proceedings.mlr.press/v162/liu22v/liu22v.pdf,876.pdf
877,877,RUMs from Head-to-Head Contests,icml.cc/media/icml-2022/Slides/16896.pdf,proceedings.mlr.press/v162/almanza22a/almanza22a.pdf,877.pdf
878,878,Score Matching Enables Causal Discovery of Nonlinear Additive Noise Models,icml.cc/media/icml-2022/Slides/16280.pdf,proceedings.mlr.press/v162/rolland22a/rolland22a.pdf,878.pdf
879,879,Shuffle Private Linear Contextual Bandits,icml.cc/media/icml-2022/Slides/16282_xO2PE7A.pdf,proceedings.mlr.press/v162/chowdhury22a/chowdhury22a.pdf,879.pdf
880,880,No-Regret Learning in Partially-Informed Auctions,icml.cc/media/icml-2022/Slides/16798.pdf,proceedings.mlr.press/v162/guo22b/guo22b.pdf,880.pdf
881,881,Optimally Controllable Perceptual Lossy Compression,icml.cc/media/icml-2022/Slides/16876.pdf,proceedings.mlr.press/v162/yan22b/yan22b.pdf,881.pdf
882,882,Leverage Score Sampling for Tensor Product Matrices in Input Sparsity Time,icml.cc/media/icml-2022/Slides/16936.pdf,proceedings.mlr.press/v162/woodruff22a/woodruff22a.pdf,882.pdf
883,883,AutoSNN: Towards Energy-Efficient Spiking Neural Networks,icml.cc/media/icml-2022/Slides/17756.pdf,proceedings.mlr.press/v162/na22a/na22a.pdf,883.pdf
884,884,Quant-BnB: A Scalable Branch-and-Bound Method for Optimal Decision Trees with Continuous Features,icml.cc/media/icml-2022/Slides/17100.pdf,proceedings.mlr.press/v162/mazumder22a/mazumder22a.pdf,884.pdf
885,885,Gaussian Mixture Variational Autoencoder with Contrastive Learning for Multi-Label Classification,icml.cc/media/icml-2022/Slides/16866.pdf,proceedings.mlr.press/v162/bai22c/bai22c.pdf,885.pdf
886,886,Fast Finite Width Neural Tangent Kernel,icml.cc/media/icml-2022/Slides/17194_H2K9e75.pdf,proceedings.mlr.press/v162/novak22a/novak22a.pdf,886.pdf
887,887,G-Mixup: Graph Data Augmentation for Graph Classification,icml.cc/media/icml-2022/Slides/16666_Gu6Yot2.pdf,proceedings.mlr.press/v162/han22c/han22c.pdf,887.pdf
888,888,Overcoming Oscillations in Quantization-Aware Training,icml.cc/media/icml-2022/Slides/17840.pdf,proceedings.mlr.press/v162/nagel22a/nagel22a.pdf,888.pdf
889,889,Random Gegenbauer Features for Scalable Kernel Methods,icml.cc/media/icml-2022/Slides/16736.pdf,proceedings.mlr.press/v162/han22g/han22g.pdf,889.pdf
890,890,On Last-Iterate Convergence Beyond Zero-Sum Games,icml.cc/media/icml-2022/Slides/17012_nHLUvts.pdf,proceedings.mlr.press/v162/anagnostides22a/anagnostides22a.pdf,890.pdf
891,891,Pessimistic Q-Learning for Offline Reinforcement Learning: Towards Optimal Sample Complexity,icml.cc/media/icml-2022/Slides/16130.pdf,proceedings.mlr.press/v162/shi22c/shi22c.pdf,891.pdf
892,892,Learning to Solve PDE-constrained Inverse Problems with Graph Networks,icml.cc/media/icml-2022/Slides/16566.pdf,proceedings.mlr.press/v162/zhao22d/zhao22d.pdf,892.pdf
893,893,VarScene: A Deep Generative Model for Realistic Scene Graph Synthesis,icml.cc/media/icml-2022/Slides/16892.pdf,proceedings.mlr.press/v162/verma22b/verma22b.pdf,893.pdf
894,894,Robustness in Multi-Objective Submodular Optimization: a Quantile Approach,icml.cc/media/icml-2022/Slides/17168.pdf,proceedings.mlr.press/v162/malherbe22a/malherbe22a.pdf,894.pdf
895,895,The Unsurprising Effectiveness of Pre-Trained Vision Models for Control,icml.cc/media/icml-2022/Slides/17348.pdf,proceedings.mlr.press/v162/parisi22a/parisi22a.pdf,895.pdf
896,896,Kernelized Multiplicative Weights for 0/1-Polyhedral Games: Bridging the Gap Between Learning in Extensive-Form and Normal-Form Games,icml.cc/media/icml-2022/Slides/17180.pdf,proceedings.mlr.press/v162/farina22a/farina22a.pdf,896.pdf
897,897,Balancing Sample Efficiency and Suboptimality in Inverse Reinforcement Learning,icml.cc/media/icml-2022/Slides/16362.pdf,proceedings.mlr.press/v162/damiani22a/damiani22a.pdf,897.pdf
898,898,Reward-Free RL is No Harder Than Reward-Aware RL in Linear Markov Decision Processes,icml.cc/media/icml-2022/Slides/16446.pdf,proceedings.mlr.press/v162/wagenmaker22b/wagenmaker22b.pdf,898.pdf
899,899,Label Ranking through Nonparametric Regression,icml.cc/media/icml-2022/Slides/16450.pdf,proceedings.mlr.press/v162/fotakis22a/fotakis22a.pdf,899.pdf
900,900,Towards Uniformly Superhuman Autonomy via Subdominance Minimization,icml.cc/media/icml-2022/Slides/16906.pdf,proceedings.mlr.press/v162/ziebart22a/ziebart22a.pdf,900.pdf
901,901,Fictitious Play and Best-Response Dynamics in Identical Interest and Zero-Sum Stochastic Games,icml.cc/media/icml-2022/Slides/17364.pdf,proceedings.mlr.press/v162/baudin22a/baudin22a.pdf,901.pdf
902,902,Causal Imitation Learning under Temporally Correlated Noise,icml.cc/media/icml-2022/Slides/18070.pdf,proceedings.mlr.press/v162/swamy22a/swamy22a.pdf,902.pdf
903,903,On the Convergence of Inexact Predictor-Corrector Methods for Linear Programming,icml.cc/media/icml-2022/Slides/16320.pdf,proceedings.mlr.press/v162/dexter22a/dexter22a.pdf,903.pdf
904,904,Provable Domain Generalization via Invariant-Feature Subspace Recovery,icml.cc/media/icml-2022/Slides/17766.pdf,proceedings.mlr.press/v162/wang22x/wang22x.pdf,904.pdf
905,905,Robust Meta-learning with Sampling Noise and Label Noise via Eigen-Reptile,icml.cc/media/icml-2022/Slides/17030.pdf,proceedings.mlr.press/v162/chen22aa/chen22aa.pdf,905.pdf
906,906,Universal Hopfield Networks: A General Framework for Single-Shot Associative Memory Models,icml.cc/media/icml-2022/Slides/17308.pdf,proceedings.mlr.press/v162/millidge22a/millidge22a.pdf,906.pdf
907,907,Subspace Learning for Effective Meta-Learning,icml.cc/media/icml-2022/Slides/18138_rkx7QT7.pdf,proceedings.mlr.press/v162/jiang22b/jiang22b.pdf,907.pdf
908,908,Dataset Condensation via Efficient Synthetic-Data Parameterization,icml.cc/media/icml-2022/Slides/17928.pdf,proceedings.mlr.press/v162/kim22c/kim22c.pdf,908.pdf
909,909,Unsupervised Image Representation Learning with Deep Latent Particles,icml.cc/media/icml-2022/Slides/17268.pdf,proceedings.mlr.press/v162/daniel22a/daniel22a.pdf,909.pdf
910,910,Continual Learning via Sequential Function-Space Variational Inference,icml.cc/media/icml-2022/Slides/18270_tM3tgD8.pdf,proceedings.mlr.press/v162/rudner22a/rudner22a.pdf,910.pdf
911,911,Learning to Estimate and Refine Fluid Motion with Physical Dynamics,icml.cc/media/icml-2022/Slides/17520.pdf,proceedings.mlr.press/v162/zhang22ad/zhang22ad.pdf,911.pdf
912,912,Searching for BurgerFormer with Micro-Meso-Macro Space Design,icml.cc/media/icml-2022/Slides/17980.pdf,proceedings.mlr.press/v162/yang22f/yang22f.pdf,912.pdf
913,913,COLA: Consistent Learning with Opponent-Learning Awareness,icml.cc/media/icml-2022/Slides/16412.pdf,proceedings.mlr.press/v162/willi22a/willi22a.pdf,913.pdf
914,914,Tractable Dendritic RNNs for Reconstructing Nonlinear Dynamical Systems,icml.cc/media/icml-2022/Slides/17352.pdf,proceedings.mlr.press/v162/brenner22a/brenner22a.pdf,914.pdf
915,915,Multi-scale Feature Learning Dynamics: Insights for Double Descent,icml.cc/media/icml-2022/Slides/18086.pdf,proceedings.mlr.press/v162/pezeshki22a/pezeshki22a.pdf,915.pdf
916,916,Measuring dissimilarity with diffeomorphism invariance,icml.cc/media/icml-2022/Slides/17588_MqtuoR9.pdf,proceedings.mlr.press/v162/cantelobre22a/cantelobre22a.pdf,916.pdf
917,917,Continual Learning with Guarantees via Weight Interval Constraints,icml.cc/media/icml-2022/Slides/17640.pdf,proceedings.mlr.press/v162/wolczyk22a/wolczyk22a.pdf,917.pdf
918,918,Efficient Test-Time Model Adaptation without Forgetting,icml.cc/media/icml-2022/Slides/18324.pdf,proceedings.mlr.press/v162/niu22a/niu22a.pdf,918.pdf
919,919,Learning Efficient and Robust Ordinary Differential Equations via Invertible Neural Networks,icml.cc/media/icml-2022/Slides/17278.pdf,proceedings.mlr.press/v162/zhi22a/zhi22a.pdf,919.pdf
920,920,Interactive Inverse Reinforcement Learning for Cooperative Games,icml.cc/media/icml-2022/Slides/17298_Dk2CUu1.pdf,proceedings.mlr.press/v162/buning22a/buning22a.pdf,920.pdf
921,921,A Simple Unified Framework for High Dimensional Bandit Problems,icml.cc/media/icml-2022/Slides/16794.pdf,proceedings.mlr.press/v162/li22a/li22a.pdf,921.pdf
922,922,Nested Bandits,icml.cc/media/icml-2022/Slides/17440.pdf,proceedings.mlr.press/v162/martin22a/martin22a.pdf,922.pdf
923,923,An Intriguing Property of Geophysics Inversion,icml.cc/media/icml-2022/Slides/17776.pdf,proceedings.mlr.press/v162/feng22a/feng22a.pdf,923.pdf
924,924,Dataset Condensation with Contrastive Signals,icml.cc/media/icml-2022/Slides/18196.pdf,proceedings.mlr.press/v162/lee22b/lee22b.pdf,924.pdf
925,925,A Framework for Learning to Request Rich and Contextually Useful Information from Humans,icml.cc/media/icml-2022/Slides/16820_KGlCTBV.pdf,proceedings.mlr.press/v162/nguyen22a/nguyen22a.pdf,925.pdf
926,926,Neuro-Symbolic Hierarchical Rule Induction,icml.cc/media/icml-2022/Slides/17188.pdf,proceedings.mlr.press/v162/glanois22a/glanois22a.pdf,926.pdf
927,927,Faster Fundamental Graph Algorithms via Learned Predictions,icml.cc/media/icml-2022/Slides/16398_S6GTloV.pdf,proceedings.mlr.press/v162/chen22v/chen22v.pdf,927.pdf
928,928,Gaussian Process Uniform Error Bounds with Unknown Hyperparameters for Safety-Critical Applications,icml.cc/media/icml-2022/Slides/16024.pdf,proceedings.mlr.press/v162/capone22a/capone22a.pdf,928.pdf
929,929,Information Discrepancy in Strategic Learning,icml.cc/media/icml-2022/Slides/16480.pdf,proceedings.mlr.press/v162/bechavod22a/bechavod22a.pdf,929.pdf
930,930,A Reduction from Linear Contextual Bandits Lower Bounds to Estimations Lower Bounds,icml.cc/media/icml-2022/Slides/17008.pdf,proceedings.mlr.press/v162/he22e/he22e.pdf,930.pdf
931,931,A Hierarchical Bayesian Approach to Inverse Reinforcement Learning with Symbolic Reward Machines,icml.cc/media/icml-2022/Slides/17422_JMgSKcE.pdf,proceedings.mlr.press/v162/zhou22b/zhou22b.pdf,931.pdf
932,932,Learning Stochastic Shortest Path with Linear Function Approximation,icml.cc/media/icml-2022/Slides/16868.pdf,proceedings.mlr.press/v162/min22a/min22a.pdf,932.pdf
933,933,Practical Almost-Linear-Time Approximation Algorithms for Hybrid and Overlapping Graph Clustering,icml.cc/media/icml-2022/Slides/16880_M2pKLQk.pdf,proceedings.mlr.press/v162/orecchia22a/orecchia22a.pdf,933.pdf
934,934,"General-purpose, long-context autoregressive modeling with Perceiver AR",icml.cc/media/icml-2022/Slides/17886.pdf,proceedings.mlr.press/v162/hawthorne22a/hawthorne22a.pdf,934.pdf
935,935,An Asymptotic Test for Conditional Independence using Analytic Kernel Embeddings,icml.cc/media/icml-2022/Slides/17724.pdf,proceedings.mlr.press/v162/scetbon22a/scetbon22a.pdf,935.pdf
936,936,Particle Transformer for Jet Tagging,icml.cc/media/icml-2022/Slides/17990.pdf,proceedings.mlr.press/v162/qu22b/qu22b.pdf,936.pdf
937,937,Input Dependent Sparse Gaussian Processes,icml.cc/media/icml-2022/Slides/16064.pdf,proceedings.mlr.press/v162/jafrasteh22a/jafrasteh22a.pdf,937.pdf
938,938,Branching Reinforcement Learning,icml.cc/media/icml-2022/Slides/17088.pdf,proceedings.mlr.press/v162/du22a/du22a.pdf,938.pdf
939,939,Robust Imitation Learning against Variations in Environment Dynamics,icml.cc/media/icml-2022/Slides/17564_vsGshLP.pdf,proceedings.mlr.press/v162/chae22a/chae22a.pdf,939.pdf
940,940,A Psychological Theory of Explainability,icml.cc/media/icml-2022/Slides/16250.pdf,proceedings.mlr.press/v162/yang22c/yang22c.pdf,940.pdf
941,941,AutoIP: A United Framework to Integrate Physics into Gaussian Processes,icml.cc/media/icml-2022/Slides/16202_4quYt4k.pdf,proceedings.mlr.press/v162/long22a/long22a.pdf,941.pdf
942,942,Difference Advantage Estimation for Multi-Agent Policy Gradients,icml.cc/media/icml-2022/Slides/16126.pdf,proceedings.mlr.press/v162/li22w/li22w.pdf,942.pdf
943,943,Fair and Fast k-Center Clustering for Data Summarization,icml.cc/media/icml-2022/Slides/17570.pdf,proceedings.mlr.press/v162/angelidakis22a/angelidakis22a.pdf,943.pdf
944,944,Marginal Tail-Adaptive Normalizing Flows,icml.cc/media/icml-2022/Slides/18186.pdf,proceedings.mlr.press/v162/laszkiewicz22a/laszkiewicz22a.pdf,944.pdf
945,945,Injecting Logical Constraints into Neural Networks via Straight-Through Estimators,icml.cc/media/icml-2022/Slides/18336_1RutBq4.pdf,proceedings.mlr.press/v162/yang22h/yang22h.pdf,945.pdf
946,946,Nyström Kernel Mean Embeddings,icml.cc/media/icml-2022/Slides/17772.pdf,proceedings.mlr.press/v162/chatalic22a/chatalic22a.pdf,946.pdf
947,947,Fast rates for noisy interpolation require rethinking the effect of inductive bias,icml.cc/media/icml-2022/Slides/17650_HeXoOxI.pdf,proceedings.mlr.press/v162/donhauser22a/donhauser22a.pdf,947.pdf
948,948,Discriminator-Weighted Offline Imitation Learning from Suboptimal Demonstrations,icml.cc/media/icml-2022/Slides/17686.pdf,proceedings.mlr.press/v162/xu22l/xu22l.pdf,948.pdf
949,949,Task-aware Privacy Preservation for Multi-dimensional Data,icml.cc/media/icml-2022/Slides/16590_uyf9q9u.pdf,proceedings.mlr.press/v162/cheng22a/cheng22a.pdf,949.pdf
950,950,Online and Consistent Correlation Clustering,icml.cc/media/icml-2022/Slides/17638.pdf,proceedings.mlr.press/v162/cohen-addad22a/cohen-addad22a.pdf,950.pdf
951,951,"Prioritized Training on Points that are Learnable, Worth Learning, and not yet Learnt",icml.cc/media/icml-2022/Slides/18420.pdf,proceedings.mlr.press/v162/mindermann22a/mindermann22a.pdf,951.pdf
952,952,Plan Better Amid Conservatism: Offline Multi-Agent Reinforcement Learning with Actor Rectification,icml.cc/media/icml-2022/Slides/17592.pdf,proceedings.mlr.press/v162/pan22a/pan22a.pdf,952.pdf
953,953,Distribution Regression with Sliced Wasserstein Kernels,icml.cc/media/icml-2022/Slides/17914.pdf,proceedings.mlr.press/v162/meunier22b/meunier22b.pdf,953.pdf
954,954,SkexGen: Autoregressive Generation of CAD Construction Sequences with Disentangled Codebooks,icml.cc/media/icml-2022/Slides/18218.pdf,proceedings.mlr.press/v162/xu22k/xu22k.pdf,954.pdf
955,955,Learning from Demonstration: Provably Efficient Adversarial Policy Imitation with Linear Function Approximation,icml.cc/media/icml-2022/Slides/17216_pcbAtw2.pdf,proceedings.mlr.press/v162/liu22u/liu22u.pdf,955.pdf
956,956,Strategic Representation,icml.cc/media/icml-2022/Slides/17612_lESPoeg.pdf,proceedings.mlr.press/v162/nair22a/nair22a.pdf,956.pdf
957,957,Near-Optimal Algorithms for Autonomous Exploration and Multi-Goal Stochastic Shortest Path,icml.cc/media/icml-2022/Slides/18096.pdf,proceedings.mlr.press/v162/cai22a/cai22a.pdf,957.pdf
958,958,On Distribution Shift in Learning-based Bug Detectors,icml.cc/media/icml-2022/Slides/18392.pdf,proceedings.mlr.press/v162/he22a/he22a.pdf,958.pdf
959,959,NeuroFluid: Fluid Dynamics Grounding with Particle-Driven Neural Radiance Fields,icml.cc/media/icml-2022/Slides/18386.pdf,proceedings.mlr.press/v162/guan22a/guan22a.pdf,959.pdf
960,960,Generalized Leverage Scores: Geometric Interpretation and Applications,icml.cc/media/icml-2022/Slides/17978.pdf,proceedings.mlr.press/v162/ordozgoiti22a/ordozgoiti22a.pdf,960.pdf
961,961,Streaming Algorithm for Monotone k-Submodular Maximization with Cardinality Constraints,icml.cc/media/icml-2022/Slides/16614.pdf,proceedings.mlr.press/v162/ene22a/ene22a.pdf,961.pdf
962,962,UnderGrad: A Universal Black-Box Optimization Method with Almost Dimension-Free Convergence Rate Guarantees,icml.cc/media/icml-2022/Slides/17904.pdf,proceedings.mlr.press/v162/antonakopoulos22b/antonakopoulos22b.pdf,962.pdf
963,963,Generalised Policy Improvement with Geometric Policy Composition,icml.cc/media/icml-2022/Slides/17512.pdf,proceedings.mlr.press/v162/thakoor22a/thakoor22a.pdf,963.pdf
964,964,Stochastic Deep Networks with Linear Competing Units for Model-Agnostic Meta-Learning,icml.cc/media/icml-2022/Slides/15956.pdf,proceedings.mlr.press/v162/kalais22a/kalais22a.pdf,964.pdf
965,965,Learning Bellman Complete Representations for Offline Policy Evaluation,icml.cc/media/icml-2022/Slides/16802.pdf,proceedings.mlr.press/v162/chang22b/chang22b.pdf,965.pdf
966,966,A Context-Integrated Transformer-Based Neural Network for Auction Design,icml.cc/media/icml-2022/Slides/17744.pdf,proceedings.mlr.press/v162/duan22a/duan22a.pdf,966.pdf
967,967,Dynamic Topic Models for Temporal Document Networks,icml.cc/media/icml-2022/Slides/16124.pdf,proceedings.mlr.press/v162/zhang22n/zhang22n.pdf,967.pdf
968,968,Ripple Attention for Visual Perception with Sub-quadratic Complexity,icml.cc/media/icml-2022/Slides/16150.pdf,proceedings.mlr.press/v162/zheng22a/zheng22a.pdf,968.pdf
969,969,Provable Stochastic Optimization for Global Contrastive Learning: Small Batch Does Not Harm Performance,icml.cc/media/icml-2022/Slides/16562_kHxy7uV.pdf,proceedings.mlr.press/v162/yuan22b/yuan22b.pdf,969.pdf
970,970,A Functional Information Perspective on Model Interpretation,icml.cc/media/icml-2022/Slides/17196.pdf,proceedings.mlr.press/v162/gat22a/gat22a.pdf,970.pdf
971,971,Domain Adaptation for Time Series Forecasting via Attention Sharing,icml.cc/media/icml-2022/Slides/16938.pdf,proceedings.mlr.press/v162/jin22d/jin22d.pdf,971.pdf
972,972,Data-Efficient Double-Win Lottery Tickets from Robust Pre-training,icml.cc/media/icml-2022/Slides/16056.pdf,proceedings.mlr.press/v162/chen22ae/chen22ae.pdf,972.pdf
973,973,Be Like Water: Adaptive Floating Point for Machine Learning,icml.cc/media/icml-2022/Slides/17288.pdf,proceedings.mlr.press/v162/yeh22a/yeh22a.pdf,973.pdf
974,974,Continuous-Time Modeling of Counterfactual Outcomes Using Neural Controlled Differential Equations,icml.cc/media/icml-2022/Slides/17112.pdf,proceedings.mlr.press/v162/seedat22b/seedat22b.pdf,974.pdf
975,975,"OFA: Unifying Architectures, Tasks, and Modalities Through a Simple Sequence-to-Sequence Learning Framework",icml.cc/media/icml-2022/Slides/17836.pdf,proceedings.mlr.press/v162/wang22al/wang22al.pdf,975.pdf
976,976,Attentional Meta-learners for Few-shot Polythetic Classification,icml.cc/media/icml-2022/Slides/16068.pdf,proceedings.mlr.press/v162/day22a/day22a.pdf,976.pdf
977,977,Plug-In Inversion: Model-Agnostic Inversion for Vision with Data Augmentations,icml.cc/media/icml-2022/Slides/16376.pdf,proceedings.mlr.press/v162/ghiasi22a/ghiasi22a.pdf,977.pdf
978,978,In defense of dual-encoders for neural ranking,icml.cc/media/icml-2022/Slides/16410.pdf,proceedings.mlr.press/v162/menon22a/menon22a.pdf,978.pdf
979,979,Multirate Training of Neural Networks,icml.cc/media/icml-2022/Slides/16706.pdf,proceedings.mlr.press/v162/vlaar22b/vlaar22b.pdf,979.pdf
980,980,Lie Point Symmetry Data Augmentation for Neural PDE Solvers,icml.cc/media/icml-2022/Slides/17314.pdf,proceedings.mlr.press/v162/brandstetter22a/brandstetter22a.pdf,980.pdf
981,981,Disentangling Disease-related Representation from Obscure for Disease Prediction,icml.cc/media/icml-2022/Slides/17212.pdf,proceedings.mlr.press/v162/wang22f/wang22f.pdf,981.pdf
982,982,Offline Meta-Reinforcement Learning with Online Self-Supervision,icml.cc/media/icml-2022/Slides/16152.pdf,proceedings.mlr.press/v162/pong22a/pong22a.pdf,982.pdf
983,983,Safe Learning in Tree-Form Sequential Decision Making: Handling Hard and Soft Constraints,icml.cc/media/icml-2022/Slides/17522.pdf,proceedings.mlr.press/v162/bernasconi22a/bernasconi22a.pdf,983.pdf
984,984,Nonparametric Factor Trajectory Learning for Dynamic Tensor Decomposition,icml.cc/media/icml-2022/Slides/16046.pdf,proceedings.mlr.press/v162/wang22ar/wang22ar.pdf,984.pdf
985,985,Doubly Robust Distributionally Robust Off-Policy Evaluation and Learning,icml.cc/media/icml-2022/Slides/16750_xJaPVAO.pdf,proceedings.mlr.press/v162/kallus22a/kallus22a.pdf,985.pdf
986,986,Fast Provably Robust Decision Trees and Boosting,icml.cc/media/icml-2022/Slides/16128.pdf,proceedings.mlr.press/v162/guo22h/guo22h.pdf,986.pdf
987,987,Design-Bench: Benchmarks for Data-Driven Offline Model-Based Optimization,icml.cc/media/icml-2022/Slides/17232.pdf,proceedings.mlr.press/v162/trabucco22a/trabucco22a.pdf,987.pdf
988,988,Variational Wasserstein gradient flow,icml.cc/media/icml-2022/Slides/16824.pdf,proceedings.mlr.press/v162/fan22d/fan22d.pdf,988.pdf
989,989,From block-Toeplitz matrices to differential equations on graphs: towards a general theory for scalable masked Transformers,icml.cc/media/icml-2022/Slides/16582.pdf,proceedings.mlr.press/v162/choromanski22a/choromanski22a.pdf,989.pdf
990,990,Adaptive Second Order Coresets for Data-efficient Machine Learning,icml.cc/media/icml-2022/Slides/16584.pdf,proceedings.mlr.press/v162/pooladzandi22a/pooladzandi22a.pdf,990.pdf
991,991,"A Marriage between Adversarial Team Games and 2-player Games: Enabling Abstractions, No-regret Learning, and Subgame Solving",icml.cc/media/icml-2022/Slides/17642_SuXXWzo.pdf,proceedings.mlr.press/v162/carminati22a/carminati22a.pdf,991.pdf
992,992,Nonparametric Embeddings of Sparse High-Order Interaction Events,icml.cc/media/icml-2022/Slides/16050.pdf,proceedings.mlr.press/v162/wang22ah/wang22ah.pdf,992.pdf
993,993,Kernel Methods for Radial Transformed Compositional Data with Many Zeros,icml.cc/media/icml-2022/Slides/16214_oySemB3.pdf,proceedings.mlr.press/v162/park22d/park22d.pdf,993.pdf
994,994,Order Constraints in Optimal Transport,icml.cc/media/icml-2022/Slides/16076_e9VzqhL.pdf,proceedings.mlr.press/v162/lim22b/lim22b.pdf,994.pdf
995,995,Building Robust Ensembles via Margin Boosting,icml.cc/media/icml-2022/Slides/17006_1iZmz0H.pdf,proceedings.mlr.press/v162/zhang22aj/zhang22aj.pdf,995.pdf
996,996,Linear Complexity Randomized Self-attention Mechanism,icml.cc/media/icml-2022/Slides/16978.pdf,proceedings.mlr.press/v162/zheng22b/zheng22b.pdf,996.pdf
997,997,Sublinear-Time Clustering Oracle for Signed Graphs,icml.cc/media/icml-2022/Slides/16038.pdf,proceedings.mlr.press/v162/neumann22a/neumann22a.pdf,997.pdf
998,998,Understanding Policy Gradient Algorithms: A Sensitivity-Based Approach,icml.cc/media/icml-2022/Slides/16060.pdf,proceedings.mlr.press/v162/wu22i/wu22i.pdf,998.pdf
999,999,Nesterov Accelerated Shuffling Gradient Method for Convex Optimization,icml.cc/media/icml-2022/Slides/16394.pdf,proceedings.mlr.press/v162/tran22a/tran22a.pdf,999.pdf
1000,1000,Exact Learning of Preference Structure: Single-peaked Preferences and Beyond,icml.cc/media/icml-2022/Slides/17950.pdf,proceedings.mlr.press/v162/kraiczy22a/kraiczy22a.pdf,1000.pdf
1001,1001,Adapting the Linearised Laplace Model Evidence for Modern Deep Learning,icml.cc/media/icml-2022/Slides/18290.pdf,proceedings.mlr.press/v162/antoran22a/antoran22a.pdf,1001.pdf
1002,1002,Versatile Offline Imitation from Observations and Examples via Regularized State-Occupancy Matching,icml.cc/media/icml-2022/Slides/16598.pdf,proceedings.mlr.press/v162/ma22a/ma22a.pdf,1002.pdf
1003,1003,Learning of Cluster-based Feature Importance for Electronic Health Record Time-series,icml.cc/media/icml-2022/Slides/17712.pdf,proceedings.mlr.press/v162/aguiar22a/aguiar22a.pdf,1003.pdf
1004,1004,Efficient Representation Learning via Adaptive Context Pooling,icml.cc/media/icml-2022/Slides/17010.pdf,proceedings.mlr.press/v162/huang22j/huang22j.pdf,1004.pdf
1005,1005,Robust Task Representations for Offline Meta-Reinforcement Learning via Contrastive Learning,icml.cc/media/icml-2022/Slides/16240_K4BQpKc.pdf,proceedings.mlr.press/v162/yuan22a/yuan22a.pdf,1005.pdf
1006,1006,"Connect, Not Collapse: Explaining Contrastive Learning for Unsupervised Domain Adaptation",icml.cc/media/icml-2022/Slides/18406_Uh53VaG.pdf,proceedings.mlr.press/v162/shen22d/shen22d.pdf,1006.pdf
1007,1007,Causal Conceptions of Fairness and their Consequences,icml.cc/media/icml-2022/Slides/17122_eHjIkLG.pdf,proceedings.mlr.press/v162/nilforoshan22a/nilforoshan22a.pdf,1007.pdf
1008,1008,Do Differentiable Simulators Give Better Policy Gradients?,icml.cc/media/icml-2022/Slides/16770_9rTdCsb.pdf,proceedings.mlr.press/v162/suh22b/suh22b.pdf,1008.pdf
