uuid,title,slide_url,paper_url
7002c1cc-f63c-4d70-8694-b15495c20b5c,Learning Temporally Causal Latent Processes from General Temporal Data,iclr.cc/media/iclr-2022/Slides/6675.pdf,openreview.net/pdf?id=RDlLMjLJXdq
5e2a2db4-0af6-43cb-9d9d-323a1f426cd7,Dropout Q-Functions for Doubly Efficient Reinforcement Learning,iclr.cc/media/iclr-2022/Slides/6233.pdf,openreview.net/pdf?id=xCVJMsPv3RT
cfcf9599-578d-45d5-80a0-d0e82f614bd5,"Learning Fast, Learning Slow: A General Continual Learning Method based on Complementary Learning System",iclr.cc/media/iclr-2022/Slides/6559.pdf,openreview.net/pdf?id=uxxFrDwrE7Y
17fb5413-ac04-4ea9-a94b-0b44a32118e1,Generalisation in Lifelong Reinforcement Learning through Logical Composition ,iclr.cc/media/iclr-2022/Slides/6562.pdf,openreview.net/pdf?id=ZOcX-eybqoL
590c3636-4123-4f00-b199-1e2703919ba7,Bootstrapping Semantic Segmentation with Regional Contrast,iclr.cc/media/iclr-2022/Slides/6375.pdf,openreview.net/pdf?id=6u6N8WWwYSM
62f711bd-ec6b-4582-a85c-0baa49f50099,Who Is Your Right Mixup Partner in Positive and Unlabeled Learning,iclr.cc/media/iclr-2022/Slides/5904.pdf,openreview.net/pdf?id=NH29920YEmj
dfb6d08e-59d5-426d-aff7-fcfb4bd0e42e,Constrained Policy Optimization via Bayesian World Models,iclr.cc/media/iclr-2022/Slides/6499.pdf,openreview.net/pdf?id=PRZoSmCinhf
94f7a931-35d7-46b5-9e01-63af493055f0,PriorGrad: Improving Conditional Denoising Diffusion Models with Data-Dependent Adaptive Prior,iclr.cc/media/iclr-2022/Slides/6445.pdf,openreview.net/pdf?id=_BNiN4IjC5
9aef3810-e166-45e2-8678-6eb650cd0d6a,The Role of Permutation Invariance in Linear Mode Connectivity of Neural Networks,iclr.cc/media/iclr-2022/Slides/6604.pdf,openreview.net/pdf?id=dNigytemkL
b31874ae-3464-4f3d-8b0d-d32a6e2e431b,Scale Mixtures of Neural Network Gaussian Processes,iclr.cc/media/iclr-2022/Slides/6289.pdf,openreview.net/pdf?id=YVPBh4k78iZ
ec6fd80d-8854-43dd-be7b-8c8e51639671,Understanding and Improving Graph Injection Attack by Promoting Unnoticeability,iclr.cc/media/iclr-2022/Slides/6046.pdf,openreview.net/pdf?id=wkMG8cdvh7-
f2a2a9cd-b94c-428a-b148-c526a4ad10cc,MetaShift: A Dataset of Datasets for Evaluating Contextual Distribution Shifts and Training Conflicts,iclr.cc/media/iclr-2022/Slides/6433.pdf,openreview.net/pdf?id=MTex8qKavoS
a03c9719-e98f-48cc-8e59-09d642096316,Training Structured Neural Networks Through Manifold Identification and Variance Reduction,iclr.cc/media/iclr-2022/Slides/6536.pdf,openreview.net/pdf?id=mdUYT5QV0O
44566257-82c6-4910-b500-983cc6f72e45,Expressivity of Emergent Languages is a Trade-off between Contextual Complexity and Unpredictability,iclr.cc/media/iclr-2022/Slides/6566.pdf,openreview.net/pdf?id=WxuE_JWxjkW
6ca5ddf5-83bb-4897-b821-2124f5548b71,Evidential Turing Processes ,iclr.cc/media/iclr-2022/Slides/6361_iP6MRmx.pdf,openreview.net/pdf?id=84NMXTHYe-
02744de2-3da7-417c-8df3-83c5ec493a08,PF-GNN: Differentiable particle filtering based approximation of universal graph representations,iclr.cc/media/iclr-2022/Slides/5982.pdf,openreview.net/pdf?id=oh4TirnfSem
0862c5aa-6737-42c8-8eed-b6fd55f0e095,Task Affinity with Maximum Bipartite Matching in Few-Shot Learning,iclr.cc/media/iclr-2022/Slides/6214.pdf,openreview.net/pdf?id=u2GZOiUTbt
e57b6a87-f33c-49ba-801c-0ed2df5efb58,A Generalized Weighted Optimization Method for Computational Learning and Inversion,iclr.cc/media/iclr-2022/Slides/7110.pdf,openreview.net/pdf?id=14F3fI6MGxX
d61f5e72-f524-4c4e-81c7-6be73cd1a87a,Understanding Intrinsic Robustness Using Label Uncertainty,iclr.cc/media/iclr-2022/Slides/6167.pdf,openreview.net/pdf?id=6ET9SzlgNX
b34de51d-b8c1-4e4e-b6c6-5ef660283c9d,Learning Transferable Reward for Query Object Localization with Policy Adaptation,iclr.cc/media/iclr-2022/Slides/6128.pdf,openreview.net/pdf?id=92tYQiil17
bad49f68-9594-4be0-8533-b053476d6aac,PAC Prediction Sets Under Covariate Shift,iclr.cc/media/iclr-2022/Slides/6314.pdf,openreview.net/pdf?id=DhP9L8vIyLc
07ba9be1-6838-4973-bb43-77dfd6493862,Hybrid Memoised Wake-Sleep: Approximate Inference at the Discrete-Continuous Interface,iclr.cc/media/iclr-2022/Slides/6869.pdf,openreview.net/pdf?id=auOPcdAcoy
29dd0fea-16e0-46cd-89eb-bd52c012e4bb,Critical Points in Quantum Generative Models,iclr.cc/media/iclr-2022/Slides/6777.pdf,openreview.net/pdf?id=2f1z55GVQN
4821a0b2-a7e8-4b92-a81c-8bc66beb00be,Efficient Self-supervised Vision Transformers for Representation Learning,iclr.cc/media/iclr-2022/Slides/6312.pdf,openreview.net/pdf?id=fVu3o-YUGQK
fa14a1f1-ecc8-4f98-8528-f3ee2b023a2c,How unlabeled data improve generalization in self-training? A one-hidden-layer theoretical analysis,iclr.cc/media/iclr-2022/Slides/6549_78U53AQ.pdf,openreview.net/pdf?id=qiMXBIf4NfB
7f59330b-0a3b-46d9-929a-601af819c064,The Spectral Bias of Polynomial Neural Networks,iclr.cc/media/iclr-2022/Slides/6710_4fjvscZ.pdf,openreview.net/pdf?id=P7FLfMLTSEX
6422cca2-fd23-42b7-8d82-cb95e89c1f62,Gradient Importance Learning for Incomplete Observations,iclr.cc/media/iclr-2022/Slides/6859.pdf,openreview.net/pdf?id=fXHl76nO2AZ
adc8d99d-901e-4f85-8178-271ebc8212c6,Learning to Guide and to be Guided in the Architect-Builder Problem,iclr.cc/media/iclr-2022/Slides/6532.pdf,openreview.net/pdf?id=swiyAeGzFhQ
632f623a-7306-4a1d-bc4c-0062c19bfaa3,"Learn Locally, Correct Globally: A Distributed Algorithm for Training Graph Neural Networks",iclr.cc/media/iclr-2022/Slides/7152.pdf,openreview.net/pdf?id=FndDxSz3LxQ
27560ae8-ec1f-407b-aebd-d857819f0a66,Eliminating Sharp Minima from SGD with Truncated Heavy-tailed Noise,iclr.cc/media/iclr-2022/Slides/6392.pdf,openreview.net/pdf?id=B3Nde6lvab
fae624fd-dcd3-4ef6-9cbf-d33f755eb253,Open-vocabulary Object Detection via Vision and Language Knowledge Distillation,iclr.cc/media/iclr-2022/Slides/6372.pdf,openreview.net/pdf?id=lL3lnMbR4WU
e90d3327-c8e1-473f-9534-dbcd30cf6309,DISSECT: Disentangled Simultaneous Explanations via Concept Traversals,iclr.cc/media/iclr-2022/Slides/6367.pdf,openreview.net/pdf?id=qY79G8jGsep
37e6cb5f-1bec-4630-a7fa-e74507fea779,Fast Model Editing at Scale,iclr.cc/media/iclr-2022/Slides/6846.pdf,openreview.net/pdf?id=0DcZxeWfOPt
8b037780-ed64-4b59-94b6-aa1060945138,GNN is a Counter? Revisiting GNN for Question Answering,iclr.cc/media/iclr-2022/Slides/6194.pdf,openreview.net/pdf?id=hzmQ4wOnSb
e184c14a-ff05-4645-a112-dc5d7b6c15a6,Path Integral Sampler: A Stochastic Control Approach For Sampling,iclr.cc/media/iclr-2022/Slides/7195.pdf,openreview.net/pdf?id=_uCb2ynRu7Y
7c36caf5-b5ff-49d7-9097-a588964bff63,Generative Models as a Data Source for Multiview Representation Learning,iclr.cc/media/iclr-2022/Slides/6339.pdf,openreview.net/pdf?id=qhAeZjs7dCL
ee9dab06-94bb-4b92-a4eb-d8785871ef91,MoReL: Multi-omics Relational Learning,iclr.cc/media/iclr-2022/Slides/7199.pdf,openreview.net/pdf?id=DnG75_KyHjX
877d9b82-d763-47e4-b295-ff6b6cdc9186,Neural Processes with Stochastic Attention: Paying more attention to the context dataset,iclr.cc/media/iclr-2022/Slides/6815_iycPvE8.pdf,openreview.net/pdf?id=JPkQwEdYn8
5ad9f012-e6e7-46b5-832f-9281ff53d1e2,Demystifying Batch Normalization in ReLU Networks: Equivalent Convex Optimization Models and Implicit Regularization,iclr.cc/media/iclr-2022/Slides/7099.pdf,openreview.net/pdf?id=6XGgutacQ0B
36661cf2-4539-4179-aa3f-d7df8331925c,Iterated Reasoning with Mutual Information in Cooperative and Byzantine Decentralized Teaming,iclr.cc/media/iclr-2022/Slides/6808_BKkBmVC.pdf,openreview.net/pdf?id=giBFoa-uS12
1cd567de-8cba-4ef6-9f2c-30c47ed613bc,Equivariant Transformers for Neural Network based Molecular Potentials,iclr.cc/media/iclr-2022/Slides/6416.pdf,openreview.net/pdf?id=zNHzqZ9wrRB
36996609-4758-4167-ba93-bff5d8146569,BiBERT: Accurate Fully Binarized BERT,iclr.cc/media/iclr-2022/Slides/6006.pdf,openreview.net/pdf?id=5xEgrl_5FAJ
3b567e81-e3ee-4cc5-9cb2-b4345e56103b,Geometric Transformers for Protein Interface Contact Prediction,iclr.cc/media/iclr-2022/Slides/6202.pdf,openreview.net/pdf?id=CS4463zx6Hi
79a89223-a513-4bcf-b607-acfeda186850,Task Relatedness-Based Generalization Bounds for Meta Learning,iclr.cc/media/iclr-2022/Slides/6485.pdf,openreview.net/pdf?id=A3HHaEdqAJL
417bdf29-a592-4d8d-8adf-15d408f124bf,Reinforcement Learning with Sparse Rewards using Guidance from Offline Demonstration,iclr.cc/media/iclr-2022/Slides/6479.pdf,openreview.net/pdf?id=YJ1WzgMVsMt
225e2c6b-84cd-45f0-8467-acc23c219df9,Focus on the Common Good: Group Distributional Robustness Follows,iclr.cc/media/iclr-2022/Slides/6216.pdf,openreview.net/pdf?id=irARV_2VFs4
527b16b5-8343-4109-9f05-e55413124830,Effective Model Sparsification by Scheduled Grow-and-Prune Methods,iclr.cc/media/iclr-2022/Slides/6315.pdf,openreview.net/pdf?id=xa6otUDdP2W
a99654cd-3a24-47d4-b48e-afbc24c187ed,Towards Deepening Graph Neural Networks: A GNTK-based Optimization Perspective,iclr.cc/media/iclr-2022/Slides/6585.pdf,openreview.net/pdf?id=tT9t_ZctZRL
18250c86-27fd-4136-91f6-9a338c5d83bd,Generalized Decision Transformer for Offline Hindsight Information Matching,iclr.cc/media/iclr-2022/Slides/6141.pdf,openreview.net/pdf?id=CAjxVodl_v
c6d6c8d2-9368-496b-b922-df7af0c71ec8,L0-Sparse Canonical Correlation Analysis,iclr.cc/media/iclr-2022/Slides/6814.pdf,openreview.net/pdf?id=KntaNRo6R48
f58c46a2-489d-4cc7-bda9-b9745345e796,DeSKO: Stability-Assured Robust Control with a Deep Stochastic Koopman Operator,iclr.cc/media/iclr-2022/Slides/7057.pdf,openreview.net/pdf?id=hniLRD_XCA
e6ec795e-ebd5-4418-a03d-078e94150646,A generalization of the randomized singular value decomposition,iclr.cc/media/iclr-2022/Slides/7116.pdf,openreview.net/pdf?id=hgKtwSb4S2
68c4faec-1229-4ba6-89c4-8129220db394,Learning Optimal Conformal Classifiers,iclr.cc/media/iclr-2022/Slides/6836.pdf,openreview.net/pdf?id=t8O-4LKFVx
47756adf-d6fb-49db-8251-1709dce6a1a9,Neural Variational Dropout Processes,iclr.cc/media/iclr-2022/Slides/6082.pdf,openreview.net/pdf?id=lyLVzukXi08
ff90705a-65f8-48d4-a835-696db80e60f1,On the Connection between Local Attention and Dynamic Depth-wise Convolution,iclr.cc/media/iclr-2022/Slides/6438.pdf,openreview.net/pdf?id=L3_SsSNMmy
b5511235-1fd6-415e-9709-062e8a91d770,Learning meta-features for AutoML,iclr.cc/media/iclr-2022/Slides/6788.pdf,openreview.net/pdf?id=DTkEfj0Ygb8
8c598b83-5fee-474d-b428-e87f636e9643,Large-Scale Representation Learning on Graphs via Bootstrapping,iclr.cc/media/iclr-2022/Slides/6390.pdf,openreview.net/pdf?id=0UXT6PpRpW
d5966716-a4c5-495c-a122-36fbc74918a5,Trust Region Policy Optimisation in Multi-Agent Reinforcement Learning,iclr.cc/media/iclr-2022/Slides/6244.pdf,openreview.net/pdf?id=EcGGFkNTxdJ
5a0d47bd-452a-4540-8251-c5a8a13ae21f,Sound Adversarial Audio-Visual Navigation,iclr.cc/media/iclr-2022/Slides/6057.pdf,openreview.net/pdf?id=NkZq4OEYN-
9d3ae0dd-9a9b-4a82-bb7e-3129a5bd2c1a,PiCO: Contrastive Label Disambiguation for Partial Label Learning,iclr.cc/media/iclr-2022/Slides/6038.pdf,openreview.net/pdf?id=EhYjZy6e1gJ
ac2fc456-c15a-49e8-9126-c9d828b7006e,Explainable GNN-Based Models over Knowledge Graphs,iclr.cc/media/iclr-2022/Slides/5985.pdf,openreview.net/pdf?id=CrCvGNHAIrz
c13c2c64-298a-4149-9de6-4d899b206278,Divergence-aware Federated Self-Supervised Learning,iclr.cc/media/iclr-2022/Slides/5908.pdf,openreview.net/pdf?id=oVE1z8NlNe
27cfbcb5-dacc-4e98-8eda-527355ee228c,Zero Pixel Directional Boundary by Vector Transform,iclr.cc/media/iclr-2022/Slides/6022.pdf,openreview.net/pdf?id=nxcABL7jbQh
9d4745ed-85fa-4f9e-a288-266cbabc6894,Measuring CLEVRness: Black-box Testing of Visual Reasoning Models,iclr.cc/media/iclr-2022/Slides/6011.pdf,openreview.net/pdf?id=UtGtoS4CYU
5bc6ec20-0273-4f79-a80b-98d75c0fbd48,Wisdom of Committees: An Overlooked Approach To Faster and More Accurate Models,iclr.cc/media/iclr-2022/Slides/6397.pdf,openreview.net/pdf?id=MvO2t0vbs4-
fdaf6d11-54c7-4198-9a27-c27502212e89,Know Your Action Set: Learning Action Relations for Reinforcement Learning,iclr.cc/media/iclr-2022/Slides/6594.pdf,openreview.net/pdf?id=MljXVdp4A3N
1d4a85b7-0774-4a9a-9bcc-be1e1f7a3ba1,ZeroFL: Efficient On-Device Training for  Federated Learning with Local Sparsity,iclr.cc/media/iclr-2022/Slides/6036.pdf,openreview.net/pdf?id=2sDQwC_hmnM
7bb09da6-3a7f-4c93-932e-e707a0a69f23,Post-Training Detection of Backdoor Attacks for Two-Class and Multi-Attack Scenarios,iclr.cc/media/iclr-2022/Slides/7149.pdf,openreview.net/pdf?id=MSgB8D4Hy51
6700e24f-3e03-49e2-bf4e-e4a6223c8b06,Optimizing Neural Networks with Gradient Lexicase Selection,iclr.cc/media/iclr-2022/Slides/5996.pdf,openreview.net/pdf?id=J_2xNmVcY4
1df4f2cf-c657-49bf-af00-1770118bbd95,Efficient Computation of Deep Nonlinear Infinite-Width Neural Networks that Learn Features,iclr.cc/media/iclr-2022/Slides/5924.pdf,openreview.net/pdf?id=tUMr0Iox8XW
4085bc1d-0682-454d-8df6-46a26ae047fa,Label Encoding for Regression Networks,iclr.cc/media/iclr-2022/Slides/6164_X6IaBUu.pdf,openreview.net/pdf?id=8WawVDdKqlL
754a4867-92bb-4a4c-979c-85f0cc5430b5,You are AllSet: A Multiset Function Framework for Hypergraph Neural Networks,iclr.cc/media/iclr-2022/Slides/6302.pdf,openreview.net/pdf?id=hpBTIv2uy_E
8794a125-3875-4bbf-9a35-1e50ffac0782,Interpretable Unsupervised Diversity Denoising and Artefact Removal,iclr.cc/media/iclr-2022/Slides/5977.pdf,openreview.net/pdf?id=DfMqlB0PXjM
130b7b70-7cb5-49d5-a1b4-8b25d19a40f5,Improving Mutual Information Estimation with Annealed and Energy-Based Bounds,iclr.cc/media/iclr-2022/Slides/6176.pdf,openreview.net/pdf?id=T0B9AoM_bFg
412e2777-e898-4caf-9a68-00f1ce828ec3,Actor-Critic Policy Optimization in a Large-Scale Imperfect-Information Game,iclr.cc/media/iclr-2022/Slides/6627.pdf,openreview.net/pdf?id=DTXZqTNV5nW
2daab1af-65ac-41d5-b0e1-94341b899348,Learning to Remember Patterns: Pattern Matching Memory Networks for Traffic Forecasting,iclr.cc/media/iclr-2022/Slides/6957.pdf,openreview.net/pdf?id=wwDg3bbYBIq
e48fa948-0f5d-41ba-9b73-ee664d6731ce,Causal Contextual Bandits with Targeted Interventions,iclr.cc/media/iclr-2022/Slides/6917.pdf,openreview.net/pdf?id=F5Em8ASCosV
32e231ee-9656-411c-93d3-775af16c6b60,TAPEX: Table Pre-training via Learning a Neural SQL Executor,iclr.cc/media/iclr-2022/Slides/6280.pdf,openreview.net/pdf?id=O50443AsCP
4ae8acdc-f024-40b8-a82c-60fb1796f1dd,Recycling Model Updates in Federated Learning: Are Gradient Subspaces Low-Rank?,iclr.cc/media/iclr-2022/Slides/6546.pdf,openreview.net/pdf?id=B7ZbqNLDn-_
d6e1b356-703b-434f-8d01-3949651076b5,Fine-Tuning can Distort Pretrained Features and Underperform Out-of-Distribution,iclr.cc/media/iclr-2022/Slides/5945.pdf,openreview.net/pdf?id=UYneFzXSJWh
ba0cd0de-ca6b-44e7-999d-a5209ef19d63,Learning Towards The Largest Margins,iclr.cc/media/iclr-2022/Slides/5901.pdf,openreview.net/pdf?id=hqkhcFHOeKD
801e2272-3b90-439f-ad67-6cbd5a8a6a60,X-model: Improving Data Efficiency in Deep Learning with A Minimax Model,iclr.cc/media/iclr-2022/Slides/6998.pdf,openreview.net/pdf?id=P3Bh01hBYTH
4244c8fb-8645-4646-ad11-4de787e8efc9,Sampling with Mirrored Stein Operators,iclr.cc/media/iclr-2022/Slides/6304.pdf,openreview.net/pdf?id=eMudnJsb1T5
6c387e6f-110b-4d0d-80fd-4f0fc0a0b53f,Representing Mixtures of Word Embeddings with Mixtures of Topic Embeddings,iclr.cc/media/iclr-2022/Slides/6840.pdf,openreview.net/pdf?id=IYMuTbGzjFU
8fee21c5-5538-4505-b645-f34b1f14fad7,Towards Understanding the Data Dependency of Mixup-style Training,iclr.cc/media/iclr-2022/Slides/6526.pdf,openreview.net/pdf?id=ieNJYujcGDO
c4b789ca-9bdc-4819-ad4b-9a43f36fbb61,Multi-Mode Deep Matrix and Tensor Factorization,iclr.cc/media/iclr-2022/Slides/6972_1BKKe0y.pdf,openreview.net/pdf?id=6YVIk0sAkF_
94001638-b7e0-4c3c-9789-27f35c1fa32c,SHINE: SHaring the INverse Estimate from the forward pass for bi-level optimization and implicit models,iclr.cc/media/iclr-2022/Slides/6363.pdf,openreview.net/pdf?id=-ApAkox5mp
9c577bf1-0a45-4703-a057-5a8b435788d3,On the Optimal Memorization Power of ReLU Neural Networks,iclr.cc/media/iclr-2022/Slides/7214.pdf,openreview.net/pdf?id=MkTPtnjeYTV
97c71a03-c482-4200-9e77-3d6f5a8d3ce1,Filling the G_ap_s: Multivariate Time Series Imputation by Graph Neural Networks,iclr.cc/media/iclr-2022/Slides/5891.pdf,openreview.net/pdf?id=kOu3-S3wJ7
153550a8-a549-445b-88d1-dabbc9899af8,Mapping conditional distributions for domain adaptation under generalized target shift,iclr.cc/media/iclr-2022/Slides/6951.pdf,openreview.net/pdf?id=sPfB2PI87BZ
4c60f132-4ecf-4382-9eef-bacc87957605,Deep Attentive Variational Inference,iclr.cc/media/iclr-2022/Slides/5923_VZ1HWQv.pdf,openreview.net/pdf?id=T4-65DNlDij
a2d03c1e-3794-42b3-b94e-17beb6366168,Rethinking Goal-Conditioned Supervised Learning and Its Connection to Offline RL,iclr.cc/media/iclr-2022/Slides/6583.pdf,openreview.net/pdf?id=KJztlfGPdwW
8864c28b-a7f9-4cf3-9b16-99735e888f59,Normalization of Language Embeddings for Cross-Lingual Alignment,iclr.cc/media/iclr-2022/Slides/6548.pdf,openreview.net/pdf?id=Nh7CtbyoqV5
d359ab2e-fa28-404a-ac58-cbbe968236e2,Model Agnostic Interpretability for Multiple Instance Learning,iclr.cc/media/iclr-2022/Slides/6786.pdf,openreview.net/pdf?id=KSSfF5lMIAg
7cd2e512-3784-4690-85ac-1acb565c1e2c,The Neural Data Router: Adaptive Control Flow in Transformers Improves Systematic Generalization,iclr.cc/media/iclr-2022/Slides/6053.pdf,openreview.net/pdf?id=KBQP4A_J1K
96f11d55-0875-4e4d-831d-990f2459f35d,Complete Verification via Multi-Neuron Relaxation Guided Branch-and-Bound,iclr.cc/media/iclr-2022/Slides/6097_dDuksc1.pdf,openreview.net/pdf?id=l_amHf1oaK
f18ceafb-ed33-483c-bc32-893093f5cc02,On Redundancy and Diversity in Cell-based Neural Architecture Search,iclr.cc/media/iclr-2022/Slides/6911.pdf,openreview.net/pdf?id=rFJWoYoxrDB
fdf30afe-547f-4a40-acb8-1b0fa591a6b3,Generative Planning for Temporally Coordinated Exploration in Reinforcement Learning,iclr.cc/media/iclr-2022/Slides/6673.pdf,openreview.net/pdf?id=YZHES8wIdE
0c8434b0-5cb4-4028-9a68-244f618a91b3,How Attentive are Graph Attention Networks? ,iclr.cc/media/iclr-2022/Slides/6366.pdf,openreview.net/pdf?id=F72ximsx7C1
36ec6b22-3e72-4589-8a0d-7f37969dbad3,Graph-Relational Domain Adaptation,iclr.cc/media/iclr-2022/Slides/7145.pdf,openreview.net/pdf?id=kcwyXtt7yDJ
a2a5e775-1513-44b6-91fc-ce19a4716b62,Heteroscedastic Temporal Variational Autoencoder For Irregularly Sampled Time Series,iclr.cc/media/iclr-2022/Slides/6271.pdf,openreview.net/pdf?id=Az7opqbQE-3
8aaca602-acfe-4fad-a93e-acd891756ce7,Multimeasurement Generative Models,iclr.cc/media/iclr-2022/Slides/7044.pdf,openreview.net/pdf?id=QRX0nCX_gk
ec1e93e3-1829-45e0-abce-fe854ac366fb,Adversarial Unlearning of Backdoors via Implicit Hypergradient,iclr.cc/media/iclr-2022/Slides/6180.pdf,openreview.net/pdf?id=MeeQkFYVbzW
828f024e-0d2b-4ff5-be9b-3a42f600d24e,Variational autoencoders in the presence of low-dimensional data: landscape and implicit bias,iclr.cc/media/iclr-2022/Slides/6885_gEJqslr.pdf,openreview.net/pdf?id=y_op4lLLaWL
4a47d865-0beb-4b92-ae04-5715074a8f4b,Learning Fast Samplers for Diffusion Models by Differentiating Through Sample Quality,iclr.cc/media/iclr-2022/Slides/6174.pdf,openreview.net/pdf?id=VFBjuF8HEp
0ac4b229-84b2-4918-9fdf-efb0c48f6453,ARTEMIS: Attention-based Retrieval with Text-Explicit Matching and Implicit Similarity,iclr.cc/media/iclr-2022/Slides/6121.pdf,openreview.net/pdf?id=CVfLvQq9gLo
9bdebf84-0853-4ac2-844d-c3b611bb8de4,Auto-scaling Vision Transformers without Training,iclr.cc/media/iclr-2022/Slides/5995.pdf,openreview.net/pdf?id=H94a1_Pyr-6
d4bdb797-8696-4f51-bb7b-ebe2276a5342,Assessing Generalization of SGD via Disagreement,iclr.cc/media/iclr-2022/Slides/6300.pdf,openreview.net/pdf?id=WvOGCEAQhxl
212dee3c-0132-42c3-8e2c-d36e2a89c9f6,Linking Emergent and Natural Languages via Corpus Transfer,iclr.cc/media/iclr-2022/Slides/6044.pdf,openreview.net/pdf?id=49A1Y6tRhaq
9b3ea5c6-d361-49ac-905a-18f85a112af4,Supervision Exists Everywhere: A Data Efficient Contrastive Language-Image  Pre-training Paradigm,iclr.cc/media/iclr-2022/Slides/6406.pdf,openreview.net/pdf?id=zq1iJkNk3uN
fe747bb9-32a4-4437-8405-6af499fd73a7,Value Function Spaces: Skill-Centric State Abstractions for Long-Horizon Reasoning,iclr.cc/media/iclr-2022/Slides/6739.pdf,openreview.net/pdf?id=vgqS1vkkCbE
2a2bbbee-68b5-48bd-bcc2-36d4f157894f,Topologically Regularized Data Embeddings,iclr.cc/media/iclr-2022/Slides/6844.pdf,openreview.net/pdf?id=P1QUVhOtEFP
2a793eaa-9808-441c-97df-5ff9c14b4214,A Comparison of Hamming Errors of Representative Variable Selection Methods,iclr.cc/media/iclr-2022/Slides/6651.pdf,openreview.net/pdf?id=nhN-fqxmNGx
67bec824-a86b-4544-a469-3d35cb394f77,Neural Methods for Logical Reasoning over Knowledge Graphs,iclr.cc/media/iclr-2022/Slides/5976.pdf,openreview.net/pdf?id=tgcAoUVHRIB
38ab769f-e622-4a5c-8170-3edf937cac5a,How to Robustify Black-Box ML Models? A Zeroth-Order Optimization Perspective,iclr.cc/media/iclr-2022/Slides/6612.pdf,openreview.net/pdf?id=W9G_ImpHlQd
cf8f7e13-202f-4bbf-bcc4-69e63efd344a,Bridging Recommendation and Marketing via Recurrent Intensity Modeling,iclr.cc/media/iclr-2022/Slides/6924.pdf,openreview.net/pdf?id=TZeArecH2Nf
c2684b81-b139-4b1b-ad1c-79897377802f,Know Thyself: Transferable Visual Control Policies Through Robot-Awareness,iclr.cc/media/iclr-2022/Slides/6041.pdf,openreview.net/pdf?id=o0ehFykKVtr
a7ef884d-86a3-43ae-87ad-6415be41f224,RelViT: Concept-guided Vision Transformer for Visual Relational Reasoning,iclr.cc/media/iclr-2022/Slides/6087.pdf,openreview.net/pdf?id=afoV8W3-IYp
fbfd9679-ac26-40b8-9e3a-90da5bb351a0,EViT: Expediting Vision Transformers via Token Reorganizations,iclr.cc/media/iclr-2022/Slides/6168.pdf,openreview.net/pdf?id=BjyvwnXXVn_
9d4f2a0a-fc8e-47b5-b38c-d4f623844f52,Node Feature Extraction by Self-Supervised Multi-scale Neighborhood Prediction,iclr.cc/media/iclr-2022/Slides/7187.pdf,openreview.net/pdf?id=KJggliHbs8
b7bf98bd-7526-4fd1-9230-149b87e75119,Online Hyperparameter Meta-Learning with Hypergradient Distillation,iclr.cc/media/iclr-2022/Slides/6204.pdf,openreview.net/pdf?id=01AMRlen9wJ
77986ae9-d109-4f72-90e5-12829e5a329f,Deep Point Cloud Reconstruction,iclr.cc/media/iclr-2022/Slides/6776_rDvARmW.pdf,openreview.net/pdf?id=mKDtUtxIGJ
386ed241-dce1-4706-814e-2cc805c47ac9,How Do Vision Transformers Work?,iclr.cc/media/iclr-2022/Slides/6017.pdf,openreview.net/pdf?id=D78Go4hVcxO
087c957d-57a6-47fa-bae6-663da8c47696,A Deep Variational Approach to Clustering Survival Data,iclr.cc/media/iclr-2022/Slides/6333.pdf,openreview.net/pdf?id=RQ428ZptQfU
16bdbe39-13a1-4150-a43d-eb0f7f4050bc,Policy improvement by planning with Gumbel,iclr.cc/media/iclr-2022/Slides/6418.pdf,openreview.net/pdf?id=bERaNdoegnO
3a28569f-9e16-4c1d-bd81-2eb93b900088,DISCOVERING AND EXPLAINING THE REPRESENTATION BOTTLENECK OF DNNS,iclr.cc/media/iclr-2022/Slides/6622.pdf,openreview.net/pdf?id=iRCUlgmdfHJ
9e33bf25-871a-480b-9ca9-8e984a7786b6,Learning to Extend Molecular Scaffolds with Structural Motifs,iclr.cc/media/iclr-2022/Slides/7209.pdf,openreview.net/pdf?id=ZTsoE8G3GG
7cfc0d66-af12-4999-9b6c-912c6d608377,FlexConv: Continuous Kernel Convolutions With Differentiable Kernel Sizes,iclr.cc/media/iclr-2022/Slides/6763.pdf,openreview.net/pdf?id=3jooF27-0Wy
a925d49b-8347-4d7d-9809-b7202908f5a8,CURVATURE-GUIDED DYNAMIC SCALE NETWORKS FOR MULTI-VIEW  STEREO,iclr.cc/media/iclr-2022/Slides/6520.pdf,openreview.net/pdf?id=_Wzj0J2xs2D
b0a5ec09-a590-4f3e-9991-535f260468ac,Unraveling Model-Agnostic Meta-Learning via The Adaptation Learning Rate,iclr.cc/media/iclr-2022/Slides/6474_9IX5Ooq.pdf,openreview.net/pdf?id=3rULBvOJ8D2
6ab833ef-27b6-4152-b44a-5f949ad616ec,GNN-LM: Language Modeling based on Global Contexts via GNN,iclr.cc/media/iclr-2022/Slides/6501.pdf,openreview.net/pdf?id=BS49l-B5Bql
b625d653-9bee-4f32-bb32-0056f1a3cc01,Efficient Split-Mix Federated Learning for On-Demand and In-Situ Customization,iclr.cc/media/iclr-2022/Slides/6081.pdf,openreview.net/pdf?id=_QLmakITKg
03a0af4c-de43-4fad-9b18-82c49be794cb,Non-Linear Operator Approximations for Initial Value Problems,iclr.cc/media/iclr-2022/Slides/7107.pdf,openreview.net/pdf?id=d2TT6gK9qZn
597e9a20-c545-4b6b-8f52-f5dde88cbb7f,Bag of Instances Aggregation Boosts Self-supervised Distillation,iclr.cc/media/iclr-2022/Slides/5909.pdf,openreview.net/pdf?id=N0uJGWDw21d
17fe4a32-fa0a-46ec-b5fb-18da6692ecc5,Geometric and Physical Quantities improve E(3) Equivariant Message Passing,iclr.cc/media/iclr-2022/Slides/6225.pdf,openreview.net/pdf?id=_xwr8gOBeV1
1020d5fe-0866-4a95-b498-ecffb1dd568c,Unsupervised Learning of Full-Waveform Inversion: Connecting CNN and Partial Differential Equation in a Loop,iclr.cc/media/iclr-2022/Slides/6618.pdf,openreview.net/pdf?id=izvwgBic9q
e5e5e4a3-633c-4062-99b4-7cbb14941149,Energy-Inspired Molecular Conformation Optimization,iclr.cc/media/iclr-2022/Slides/6692.pdf,openreview.net/pdf?id=7QfLW-XZTl
9e771eba-6463-4576-afa5-873201684fdc,Multi-Stage Episodic Control for Strategic Exploration in Text Games,iclr.cc/media/iclr-2022/Slides/6725.pdf,openreview.net/pdf?id=Ek7PSN7Y77z
246aacca-7cfd-4316-a1cd-597c1f0bbf9c,Fine-grained Differentiable Physics: A Yarn-level Model for Fabrics,iclr.cc/media/iclr-2022/Slides/7205.pdf,openreview.net/pdf?id=KPEFXR1HdIo
7a4c68e8-31d7-489a-b2fa-8533fd2b8e77,Message Passing Neural PDE Solvers,iclr.cc/media/iclr-2022/Slides/7134_K2f1MN8.pdf,openreview.net/pdf?id=vSix3HPYKSU
92f34b72-da18-4f1f-8ca4-b67c2a2536aa,TRAIL: Near-Optimal Imitation Learning with Suboptimal Data,iclr.cc/media/iclr-2022/Slides/6774.pdf,openreview.net/pdf?id=6q_2b6u0BnJ
0cc2a653-4757-463b-b6e8-6ebe623fdbd3,Learning Curves for Gaussian Process Regression with Power-Law Priors and Targets,iclr.cc/media/iclr-2022/Slides/6668.pdf,openreview.net/pdf?id=KeI9E-gsoB
6d4a9cf6-3b0f-42af-96ab-177278ae802d,Parallel Training of GRU Networks with a Multi-Grid Solver for Long Sequences,iclr.cc/media/iclr-2022/Slides/6016.pdf,openreview.net/pdf?id=N1WI0vJLER
44fa790e-06fb-46d0-9473-57e7da579909,"Machine Learning For Elliptic PDEs: Fast Rate Generalization Bound, Neural Scaling Law and Minimax Optimality",iclr.cc/media/iclr-2022/Slides/6547.pdf,openreview.net/pdf?id=mhYUBYNoGz
