uuid,title,slide_url,paper_url
f6fa44e7-5609-493a-8443-4d9008d1ec3c,Discriminative Similarity for Data Clustering,iclr.cc/media/iclr-2022/Slides/6248.pdf,openreview.net/pdf?id=kj0_45Y4r9i
b3043431-043c-4171-aea4-3d0099ec5ba5,Surrogate Gap Minimization Improves Sharpness-Aware Training,iclr.cc/media/iclr-2022/Slides/6070.pdf,openreview.net/pdf?id=edONMAnhLu-
a7b73d9f-a117-4dda-8d7f-8ec7469e4bd5,Sparse DETR: Efficient End-to-End Object Detection with Learnable Sparsity,iclr.cc/media/iclr-2022/Slides/7017.pdf,openreview.net/pdf?id=RRGVCN8kjim
2c956f12-0732-4056-9d61-0410c8b178b6,Neural Parameter Allocation Search,iclr.cc/media/iclr-2022/Slides/6399.pdf,openreview.net/pdf?id=srtIXtySfT4
5c02c361-6155-4735-a539-42c14d463392,Extending the WILDS Benchmark for Unsupervised Adaptation,iclr.cc/media/iclr-2022/Slides/6963.pdf,openreview.net/pdf?id=z7p2V6KROOV
3eaf8e89-c5b3-4857-95b3-183f3ee013f5,On the benefits of maximum likelihood estimation for Regression and Forecasting,iclr.cc/media/iclr-2022/Slides/7096.pdf,openreview.net/pdf?id=zrW-LVXj2k1
64b9d8a1-b099-4984-9540-d9e2c9cd6562,Hybrid Random Features,iclr.cc/media/iclr-2022/Slides/6410.pdf,openreview.net/pdf?id=EMigfE6ZeS
