,titles,slides,papers
0,Learning Temporally Causal Latent Processes from General Temporal Data,iclr.cc/media/iclr-2022/Slides/6675.pdf,openreview.net/pdf?id=RDlLMjLJXdq
1,Dropout Q-Functions for Doubly Efficient Reinforcement Learning,iclr.cc/media/iclr-2022/Slides/6233.pdf,openreview.net/pdf?id=xCVJMsPv3RT
2,"Learning Fast, Learning Slow: A General Continual Learning Method based on Complementary Learning System",iclr.cc/media/iclr-2022/Slides/6559.pdf,openreview.net/pdf?id=uxxFrDwrE7Y
3,Generalisation in Lifelong Reinforcement Learning through Logical Composition ,iclr.cc/media/iclr-2022/Slides/6562.pdf,openreview.net/pdf?id=ZOcX-eybqoL
4,Bootstrapping Semantic Segmentation with Regional Contrast,iclr.cc/media/iclr-2022/Slides/6375.pdf,openreview.net/pdf?id=6u6N8WWwYSM
5,Who Is Your Right Mixup Partner in Positive and Unlabeled Learning,iclr.cc/media/iclr-2022/Slides/5904.pdf,openreview.net/pdf?id=NH29920YEmj
6,Constrained Policy Optimization via Bayesian World Models,iclr.cc/media/iclr-2022/Slides/6499.pdf,openreview.net/pdf?id=PRZoSmCinhf
7,PriorGrad: Improving Conditional Denoising Diffusion Models with Data-Dependent Adaptive Prior,iclr.cc/media/iclr-2022/Slides/6445.pdf,openreview.net/pdf?id=_BNiN4IjC5
8,The Role of Permutation Invariance in Linear Mode Connectivity of Neural Networks,iclr.cc/media/iclr-2022/Slides/6604.pdf,openreview.net/pdf?id=dNigytemkL
9,Scale Mixtures of Neural Network Gaussian Processes,iclr.cc/media/iclr-2022/Slides/6289.pdf,openreview.net/pdf?id=YVPBh4k78iZ
10,Understanding and Improving Graph Injection Attack by Promoting Unnoticeability,iclr.cc/media/iclr-2022/Slides/6046.pdf,openreview.net/pdf?id=wkMG8cdvh7-
11,MetaShift: A Dataset of Datasets for Evaluating Contextual Distribution Shifts and Training Conflicts,iclr.cc/media/iclr-2022/Slides/6433.pdf,openreview.net/pdf?id=MTex8qKavoS
12,Training Structured Neural Networks Through Manifold Identification and Variance Reduction,iclr.cc/media/iclr-2022/Slides/6536.pdf,openreview.net/pdf?id=mdUYT5QV0O
13,Expressivity of Emergent Languages is a Trade-off between Contextual Complexity and Unpredictability,iclr.cc/media/iclr-2022/Slides/6566.pdf,openreview.net/pdf?id=WxuE_JWxjkW
14,Evidential Turing Processes ,iclr.cc/media/iclr-2022/Slides/6361_iP6MRmx.pdf,openreview.net/pdf?id=84NMXTHYe-
15,PF-GNN: Differentiable particle filtering based approximation of universal graph representations,iclr.cc/media/iclr-2022/Slides/5982.pdf,openreview.net/pdf?id=oh4TirnfSem
16,Task Affinity with Maximum Bipartite Matching in Few-Shot Learning,iclr.cc/media/iclr-2022/Slides/6214.pdf,openreview.net/pdf?id=u2GZOiUTbt
17,A Generalized Weighted Optimization Method for Computational Learning and Inversion,iclr.cc/media/iclr-2022/Slides/7110.pdf,openreview.net/pdf?id=14F3fI6MGxX
18,Understanding Intrinsic Robustness Using Label Uncertainty,iclr.cc/media/iclr-2022/Slides/6167.pdf,openreview.net/pdf?id=6ET9SzlgNX
19,Learning Transferable Reward for Query Object Localization with Policy Adaptation,iclr.cc/media/iclr-2022/Slides/6128.pdf,openreview.net/pdf?id=92tYQiil17
20,PAC Prediction Sets Under Covariate Shift,iclr.cc/media/iclr-2022/Slides/6314.pdf,openreview.net/pdf?id=DhP9L8vIyLc
21,Hybrid Memoised Wake-Sleep: Approximate Inference at the Discrete-Continuous Interface,iclr.cc/media/iclr-2022/Slides/6869.pdf,openreview.net/pdf?id=auOPcdAcoy
22,Critical Points in Quantum Generative Models,iclr.cc/media/iclr-2022/Slides/6777.pdf,openreview.net/pdf?id=2f1z55GVQN
23,Efficient Self-supervised Vision Transformers for Representation Learning,iclr.cc/media/iclr-2022/Slides/6312.pdf,openreview.net/pdf?id=fVu3o-YUGQK
24,How unlabeled data improve generalization in self-training? A one-hidden-layer theoretical analysis,iclr.cc/media/iclr-2022/Slides/6549_78U53AQ.pdf,openreview.net/pdf?id=qiMXBIf4NfB
25,The Spectral Bias of Polynomial Neural Networks,iclr.cc/media/iclr-2022/Slides/6710_4fjvscZ.pdf,openreview.net/pdf?id=P7FLfMLTSEX
26,Gradient Importance Learning for Incomplete Observations,iclr.cc/media/iclr-2022/Slides/6859.pdf,openreview.net/pdf?id=fXHl76nO2AZ
27,Learning to Guide and to be Guided in the Architect-Builder Problem,iclr.cc/media/iclr-2022/Slides/6532.pdf,openreview.net/pdf?id=swiyAeGzFhQ
28,"Learn Locally, Correct Globally: A Distributed Algorithm for Training Graph Neural Networks",iclr.cc/media/iclr-2022/Slides/7152.pdf,openreview.net/pdf?id=FndDxSz3LxQ
29,Eliminating Sharp Minima from SGD with Truncated Heavy-tailed Noise,iclr.cc/media/iclr-2022/Slides/6392.pdf,openreview.net/pdf?id=B3Nde6lvab
30,Open-vocabulary Object Detection via Vision and Language Knowledge Distillation,iclr.cc/media/iclr-2022/Slides/6372.pdf,openreview.net/pdf?id=lL3lnMbR4WU
31,DISSECT: Disentangled Simultaneous Explanations via Concept Traversals,iclr.cc/media/iclr-2022/Slides/6367.pdf,openreview.net/pdf?id=qY79G8jGsep
32,Fast Model Editing at Scale,iclr.cc/media/iclr-2022/Slides/6846.pdf,openreview.net/pdf?id=0DcZxeWfOPt
33,GNN is a Counter? Revisiting GNN for Question Answering,iclr.cc/media/iclr-2022/Slides/6194.pdf,openreview.net/pdf?id=hzmQ4wOnSb
34,Path Integral Sampler: A Stochastic Control Approach For Sampling,iclr.cc/media/iclr-2022/Slides/7195.pdf,openreview.net/pdf?id=_uCb2ynRu7Y
35,Generative Models as a Data Source for Multiview Representation Learning,iclr.cc/media/iclr-2022/Slides/6339.pdf,openreview.net/pdf?id=qhAeZjs7dCL
36,MoReL: Multi-omics Relational Learning,iclr.cc/media/iclr-2022/Slides/7199.pdf,openreview.net/pdf?id=DnG75_KyHjX
37,Neural Processes with Stochastic Attention: Paying more attention to the context dataset,iclr.cc/media/iclr-2022/Slides/6815_iycPvE8.pdf,openreview.net/pdf?id=JPkQwEdYn8
38,Demystifying Batch Normalization in ReLU Networks: Equivalent Convex Optimization Models and Implicit Regularization,iclr.cc/media/iclr-2022/Slides/7099.pdf,openreview.net/pdf?id=6XGgutacQ0B
39,Iterated Reasoning with Mutual Information in Cooperative and Byzantine Decentralized Teaming,iclr.cc/media/iclr-2022/Slides/6808_BKkBmVC.pdf,openreview.net/pdf?id=giBFoa-uS12
40,Equivariant Transformers for Neural Network based Molecular Potentials,iclr.cc/media/iclr-2022/Slides/6416.pdf,openreview.net/pdf?id=zNHzqZ9wrRB
41,BiBERT: Accurate Fully Binarized BERT,iclr.cc/media/iclr-2022/Slides/6006.pdf,openreview.net/pdf?id=5xEgrl_5FAJ
42,Geometric Transformers for Protein Interface Contact Prediction,iclr.cc/media/iclr-2022/Slides/6202.pdf,openreview.net/pdf?id=CS4463zx6Hi
43,Task Relatedness-Based Generalization Bounds for Meta Learning,iclr.cc/media/iclr-2022/Slides/6485.pdf,openreview.net/pdf?id=A3HHaEdqAJL
44,Reinforcement Learning with Sparse Rewards using Guidance from Offline Demonstration,iclr.cc/media/iclr-2022/Slides/6479.pdf,openreview.net/pdf?id=YJ1WzgMVsMt
45,Focus on the Common Good: Group Distributional Robustness Follows,iclr.cc/media/iclr-2022/Slides/6216.pdf,openreview.net/pdf?id=irARV_2VFs4
46,Effective Model Sparsification by Scheduled Grow-and-Prune Methods,iclr.cc/media/iclr-2022/Slides/6315.pdf,openreview.net/pdf?id=xa6otUDdP2W
47,Towards Deepening Graph Neural Networks: A GNTK-based Optimization Perspective,iclr.cc/media/iclr-2022/Slides/6585.pdf,openreview.net/pdf?id=tT9t_ZctZRL
48,Generalized Decision Transformer for Offline Hindsight Information Matching,iclr.cc/media/iclr-2022/Slides/6141.pdf,openreview.net/pdf?id=CAjxVodl_v
49,L0-Sparse Canonical Correlation Analysis,iclr.cc/media/iclr-2022/Slides/6814.pdf,openreview.net/pdf?id=KntaNRo6R48
50,Self-ensemble Adversarial Training for Improved Robustness,iclr.cc/media/iclr-2022/Slides/6997.pdf,openreview.net/pdf?id=oU3aTsmeRQV
51,DeSKO: Stability-Assured Robust Control with a Deep Stochastic Koopman Operator,iclr.cc/media/iclr-2022/Slides/7057.pdf,openreview.net/pdf?id=hniLRD_XCA
52,A generalization of the randomized singular value decomposition,iclr.cc/media/iclr-2022/Slides/7116.pdf,openreview.net/pdf?id=hgKtwSb4S2
53,NeuPL: Neural Population Learning,iclr.cc/media/iclr-2022/Slides/6950.pdf,openreview.net/pdf?id=MIX3fJkl_1
54,Learning Optimal Conformal Classifiers,iclr.cc/media/iclr-2022/Slides/6836.pdf,openreview.net/pdf?id=t8O-4LKFVx
55,Neural Variational Dropout Processes,iclr.cc/media/iclr-2022/Slides/6082.pdf,openreview.net/pdf?id=lyLVzukXi08
56,On the Connection between Local Attention and Dynamic Depth-wise Convolution,iclr.cc/media/iclr-2022/Slides/6438.pdf,openreview.net/pdf?id=L3_SsSNMmy
57,Learning meta-features for AutoML,iclr.cc/media/iclr-2022/Slides/6788.pdf,openreview.net/pdf?id=DTkEfj0Ygb8
58,Large-Scale Representation Learning on Graphs via Bootstrapping,iclr.cc/media/iclr-2022/Slides/6390.pdf,openreview.net/pdf?id=0UXT6PpRpW
59,Trust Region Policy Optimisation in Multi-Agent Reinforcement Learning,iclr.cc/media/iclr-2022/Slides/6244.pdf,openreview.net/pdf?id=EcGGFkNTxdJ
60,Sound Adversarial Audio-Visual Navigation,iclr.cc/media/iclr-2022/Slides/6057.pdf,openreview.net/pdf?id=NkZq4OEYN-
61,PiCO: Contrastive Label Disambiguation for Partial Label Learning,iclr.cc/media/iclr-2022/Slides/6038.pdf,openreview.net/pdf?id=EhYjZy6e1gJ
62,Explainable GNN-Based Models over Knowledge Graphs,iclr.cc/media/iclr-2022/Slides/5985.pdf,openreview.net/pdf?id=CrCvGNHAIrz
63,Divergence-aware Federated Self-Supervised Learning,iclr.cc/media/iclr-2022/Slides/5908.pdf,openreview.net/pdf?id=oVE1z8NlNe
64,Zero Pixel Directional Boundary by Vector Transform,iclr.cc/media/iclr-2022/Slides/6022.pdf,openreview.net/pdf?id=nxcABL7jbQh
65,Measuring CLEVRness: Black-box Testing of Visual Reasoning Models,iclr.cc/media/iclr-2022/Slides/6011.pdf,openreview.net/pdf?id=UtGtoS4CYU
66,Wisdom of Committees: An Overlooked Approach To Faster and More Accurate Models,iclr.cc/media/iclr-2022/Slides/6397.pdf,openreview.net/pdf?id=MvO2t0vbs4-
67,Know Your Action Set: Learning Action Relations for Reinforcement Learning,iclr.cc/media/iclr-2022/Slides/6594.pdf,openreview.net/pdf?id=MljXVdp4A3N
68,ZeroFL: Efficient On-Device Training for  Federated Learning with Local Sparsity,iclr.cc/media/iclr-2022/Slides/6036.pdf,openreview.net/pdf?id=2sDQwC_hmnM
69,Post-Training Detection of Backdoor Attacks for Two-Class and Multi-Attack Scenarios,iclr.cc/media/iclr-2022/Slides/7149.pdf,openreview.net/pdf?id=MSgB8D4Hy51
70,Optimizing Neural Networks with Gradient Lexicase Selection,iclr.cc/media/iclr-2022/Slides/5996.pdf,openreview.net/pdf?id=J_2xNmVcY4
71,Efficient Computation of Deep Nonlinear Infinite-Width Neural Networks that Learn Features,iclr.cc/media/iclr-2022/Slides/5924.pdf,openreview.net/pdf?id=tUMr0Iox8XW
72,Label Encoding for Regression Networks,iclr.cc/media/iclr-2022/Slides/6164_X6IaBUu.pdf,openreview.net/pdf?id=8WawVDdKqlL
73,You are AllSet: A Multiset Function Framework for Hypergraph Neural Networks,iclr.cc/media/iclr-2022/Slides/6302.pdf,openreview.net/pdf?id=hpBTIv2uy_E
74,Interpretable Unsupervised Diversity Denoising and Artefact Removal,iclr.cc/media/iclr-2022/Slides/5977.pdf,openreview.net/pdf?id=DfMqlB0PXjM
75,Improving Mutual Information Estimation with Annealed and Energy-Based Bounds,iclr.cc/media/iclr-2022/Slides/6176.pdf,openreview.net/pdf?id=T0B9AoM_bFg
76,Actor-Critic Policy Optimization in a Large-Scale Imperfect-Information Game,iclr.cc/media/iclr-2022/Slides/6627.pdf,openreview.net/pdf?id=DTXZqTNV5nW
77,Learning to Remember Patterns: Pattern Matching Memory Networks for Traffic Forecasting,iclr.cc/media/iclr-2022/Slides/6957.pdf,openreview.net/pdf?id=wwDg3bbYBIq
78,Causal Contextual Bandits with Targeted Interventions,iclr.cc/media/iclr-2022/Slides/6917.pdf,openreview.net/pdf?id=F5Em8ASCosV
79,TAPEX: Table Pre-training via Learning a Neural SQL Executor,iclr.cc/media/iclr-2022/Slides/6280.pdf,openreview.net/pdf?id=O50443AsCP
80,Recycling Model Updates in Federated Learning: Are Gradient Subspaces Low-Rank?,iclr.cc/media/iclr-2022/Slides/6546.pdf,openreview.net/pdf?id=B7ZbqNLDn-_
81,Fine-Tuning can Distort Pretrained Features and Underperform Out-of-Distribution,iclr.cc/media/iclr-2022/Slides/5945.pdf,openreview.net/pdf?id=UYneFzXSJWh
82,Learning Towards The Largest Margins,iclr.cc/media/iclr-2022/Slides/5901.pdf,openreview.net/pdf?id=hqkhcFHOeKD
83,X-model: Improving Data Efficiency in Deep Learning with A Minimax Model,iclr.cc/media/iclr-2022/Slides/6998.pdf,openreview.net/pdf?id=P3Bh01hBYTH
84,Sampling with Mirrored Stein Operators,iclr.cc/media/iclr-2022/Slides/6304.pdf,openreview.net/pdf?id=eMudnJsb1T5
85,Representing Mixtures of Word Embeddings with Mixtures of Topic Embeddings,iclr.cc/media/iclr-2022/Slides/6840.pdf,openreview.net/pdf?id=IYMuTbGzjFU
86,Towards Understanding the Data Dependency of Mixup-style Training,iclr.cc/media/iclr-2022/Slides/6526.pdf,openreview.net/pdf?id=ieNJYujcGDO
87,Multi-Mode Deep Matrix and Tensor Factorization,iclr.cc/media/iclr-2022/Slides/6972_1BKKe0y.pdf,openreview.net/pdf?id=6YVIk0sAkF_
88,SHINE: SHaring the INverse Estimate from the forward pass for bi-level optimization and implicit models,iclr.cc/media/iclr-2022/Slides/6363.pdf,openreview.net/pdf?id=-ApAkox5mp
89,On the Optimal Memorization Power of ReLU Neural Networks,iclr.cc/media/iclr-2022/Slides/7214.pdf,openreview.net/pdf?id=MkTPtnjeYTV
90,Filling the G_ap_s: Multivariate Time Series Imputation by Graph Neural Networks,iclr.cc/media/iclr-2022/Slides/5891.pdf,openreview.net/pdf?id=kOu3-S3wJ7
91,Mapping conditional distributions for domain adaptation under generalized target shift,iclr.cc/media/iclr-2022/Slides/6951.pdf,openreview.net/pdf?id=sPfB2PI87BZ
92,Deep Attentive Variational Inference,iclr.cc/media/iclr-2022/Slides/5923_VZ1HWQv.pdf,openreview.net/pdf?id=T4-65DNlDij
93,Rethinking Goal-Conditioned Supervised Learning and Its Connection to Offline RL,iclr.cc/media/iclr-2022/Slides/6583.pdf,openreview.net/pdf?id=KJztlfGPdwW
94,Normalization of Language Embeddings for Cross-Lingual Alignment,iclr.cc/media/iclr-2022/Slides/6548.pdf,openreview.net/pdf?id=Nh7CtbyoqV5
95,Model Agnostic Interpretability for Multiple Instance Learning,iclr.cc/media/iclr-2022/Slides/6786.pdf,openreview.net/pdf?id=KSSfF5lMIAg
96,The Neural Data Router: Adaptive Control Flow in Transformers Improves Systematic Generalization,iclr.cc/media/iclr-2022/Slides/6053.pdf,openreview.net/pdf?id=KBQP4A_J1K
97,Complete Verification via Multi-Neuron Relaxation Guided Branch-and-Bound,iclr.cc/media/iclr-2022/Slides/6097_dDuksc1.pdf,openreview.net/pdf?id=l_amHf1oaK
98,On Redundancy and Diversity in Cell-based Neural Architecture Search,iclr.cc/media/iclr-2022/Slides/6911.pdf,openreview.net/pdf?id=rFJWoYoxrDB
99,Generative Planning for Temporally Coordinated Exploration in Reinforcement Learning,iclr.cc/media/iclr-2022/Slides/6673.pdf,openreview.net/pdf?id=YZHES8wIdE
100,How Attentive are Graph Attention Networks? ,iclr.cc/media/iclr-2022/Slides/6366.pdf,openreview.net/pdf?id=F72ximsx7C1
101,Graph-Relational Domain Adaptation,iclr.cc/media/iclr-2022/Slides/7145.pdf,openreview.net/pdf?id=kcwyXtt7yDJ
102,Heteroscedastic Temporal Variational Autoencoder For Irregularly Sampled Time Series,iclr.cc/media/iclr-2022/Slides/6271.pdf,openreview.net/pdf?id=Az7opqbQE-3
103,Multimeasurement Generative Models,iclr.cc/media/iclr-2022/Slides/7044.pdf,openreview.net/pdf?id=QRX0nCX_gk
104,Adversarial Unlearning of Backdoors via Implicit Hypergradient,iclr.cc/media/iclr-2022/Slides/6180.pdf,openreview.net/pdf?id=MeeQkFYVbzW
105,Variational autoencoders in the presence of low-dimensional data: landscape and implicit bias,iclr.cc/media/iclr-2022/Slides/6885_gEJqslr.pdf,openreview.net/pdf?id=y_op4lLLaWL
106,Learning Fast Samplers for Diffusion Models by Differentiating Through Sample Quality,iclr.cc/media/iclr-2022/Slides/6174.pdf,openreview.net/pdf?id=VFBjuF8HEp
107,ARTEMIS: Attention-based Retrieval with Text-Explicit Matching and Implicit Similarity,iclr.cc/media/iclr-2022/Slides/6121.pdf,openreview.net/pdf?id=CVfLvQq9gLo
108,Auto-scaling Vision Transformers without Training,iclr.cc/media/iclr-2022/Slides/5995.pdf,openreview.net/pdf?id=H94a1_Pyr-6
109,Assessing Generalization of SGD via Disagreement,iclr.cc/media/iclr-2022/Slides/6300.pdf,openreview.net/pdf?id=WvOGCEAQhxl
110,Linking Emergent and Natural Languages via Corpus Transfer,iclr.cc/media/iclr-2022/Slides/6044.pdf,openreview.net/pdf?id=49A1Y6tRhaq
111,Supervision Exists Everywhere: A Data Efficient Contrastive Language-Image  Pre-training Paradigm,iclr.cc/media/iclr-2022/Slides/6406.pdf,openreview.net/pdf?id=zq1iJkNk3uN
112,Value Function Spaces: Skill-Centric State Abstractions for Long-Horizon Reasoning,iclr.cc/media/iclr-2022/Slides/6739.pdf,openreview.net/pdf?id=vgqS1vkkCbE
113,Topologically Regularized Data Embeddings,iclr.cc/media/iclr-2022/Slides/6844.pdf,openreview.net/pdf?id=P1QUVhOtEFP
114,A Comparison of Hamming Errors of Representative Variable Selection Methods,iclr.cc/media/iclr-2022/Slides/6651.pdf,openreview.net/pdf?id=nhN-fqxmNGx
115,Neural Methods for Logical Reasoning over Knowledge Graphs,iclr.cc/media/iclr-2022/Slides/5976.pdf,openreview.net/pdf?id=tgcAoUVHRIB
116,How to Robustify Black-Box ML Models? A Zeroth-Order Optimization Perspective,iclr.cc/media/iclr-2022/Slides/6612.pdf,openreview.net/pdf?id=W9G_ImpHlQd
117,Bridging Recommendation and Marketing via Recurrent Intensity Modeling,iclr.cc/media/iclr-2022/Slides/6924.pdf,openreview.net/pdf?id=TZeArecH2Nf
118,Know Thyself: Transferable Visual Control Policies Through Robot-Awareness,iclr.cc/media/iclr-2022/Slides/6041.pdf,openreview.net/pdf?id=o0ehFykKVtr
119,RelViT: Concept-guided Vision Transformer for Visual Relational Reasoning,iclr.cc/media/iclr-2022/Slides/6087.pdf,openreview.net/pdf?id=afoV8W3-IYp
120,EViT: Expediting Vision Transformers via Token Reorganizations,iclr.cc/media/iclr-2022/Slides/6168.pdf,openreview.net/pdf?id=BjyvwnXXVn_
121,Node Feature Extraction by Self-Supervised Multi-scale Neighborhood Prediction,iclr.cc/media/iclr-2022/Slides/7187.pdf,openreview.net/pdf?id=KJggliHbs8
122,Online Hyperparameter Meta-Learning with Hypergradient Distillation,iclr.cc/media/iclr-2022/Slides/6204.pdf,openreview.net/pdf?id=01AMRlen9wJ
123,Deep Point Cloud Reconstruction,iclr.cc/media/iclr-2022/Slides/6776_rDvARmW.pdf,openreview.net/pdf?id=mKDtUtxIGJ
124,How Do Vision Transformers Work?,iclr.cc/media/iclr-2022/Slides/6017.pdf,openreview.net/pdf?id=D78Go4hVcxO
125,A Deep Variational Approach to Clustering Survival Data,iclr.cc/media/iclr-2022/Slides/6333.pdf,openreview.net/pdf?id=RQ428ZptQfU
126,Policy improvement by planning with Gumbel,iclr.cc/media/iclr-2022/Slides/6418.pdf,openreview.net/pdf?id=bERaNdoegnO
127,DISCOVERING AND EXPLAINING THE REPRESENTATION BOTTLENECK OF DNNS,iclr.cc/media/iclr-2022/Slides/6622.pdf,openreview.net/pdf?id=iRCUlgmdfHJ
128,Learning to Extend Molecular Scaffolds with Structural Motifs,iclr.cc/media/iclr-2022/Slides/7209.pdf,openreview.net/pdf?id=ZTsoE8G3GG
129,FlexConv: Continuous Kernel Convolutions With Differentiable Kernel Sizes,iclr.cc/media/iclr-2022/Slides/6763.pdf,openreview.net/pdf?id=3jooF27-0Wy
130,CURVATURE-GUIDED DYNAMIC SCALE NETWORKS FOR MULTI-VIEW  STEREO,iclr.cc/media/iclr-2022/Slides/6520.pdf,openreview.net/pdf?id=_Wzj0J2xs2D
131,Unraveling Model-Agnostic Meta-Learning via The Adaptation Learning Rate,iclr.cc/media/iclr-2022/Slides/6474_9IX5Ooq.pdf,openreview.net/pdf?id=3rULBvOJ8D2
132,GNN-LM: Language Modeling based on Global Contexts via GNN,iclr.cc/media/iclr-2022/Slides/6501.pdf,openreview.net/pdf?id=BS49l-B5Bql
133,Efficient Split-Mix Federated Learning for On-Demand and In-Situ Customization,iclr.cc/media/iclr-2022/Slides/6081.pdf,openreview.net/pdf?id=_QLmakITKg
134,Non-Linear Operator Approximations for Initial Value Problems,iclr.cc/media/iclr-2022/Slides/7107.pdf,openreview.net/pdf?id=d2TT6gK9qZn
135,Bag of Instances Aggregation Boosts Self-supervised Distillation,iclr.cc/media/iclr-2022/Slides/5909.pdf,openreview.net/pdf?id=N0uJGWDw21d
136,Geometric and Physical Quantities improve E(3) Equivariant Message Passing,iclr.cc/media/iclr-2022/Slides/6225.pdf,openreview.net/pdf?id=_xwr8gOBeV1
137,Unsupervised Learning of Full-Waveform Inversion: Connecting CNN and Partial Differential Equation in a Loop,iclr.cc/media/iclr-2022/Slides/6618.pdf,openreview.net/pdf?id=izvwgBic9q
138,Energy-Inspired Molecular Conformation Optimization,iclr.cc/media/iclr-2022/Slides/6692.pdf,openreview.net/pdf?id=7QfLW-XZTl
139,Multi-Stage Episodic Control for Strategic Exploration in Text Games,iclr.cc/media/iclr-2022/Slides/6725.pdf,openreview.net/pdf?id=Ek7PSN7Y77z
140,Fine-grained Differentiable Physics: A Yarn-level Model for Fabrics,iclr.cc/media/iclr-2022/Slides/7205.pdf,openreview.net/pdf?id=KPEFXR1HdIo
141,Message Passing Neural PDE Solvers,iclr.cc/media/iclr-2022/Slides/7134_K2f1MN8.pdf,openreview.net/pdf?id=vSix3HPYKSU
142,TRAIL: Near-Optimal Imitation Learning with Suboptimal Data,iclr.cc/media/iclr-2022/Slides/6774.pdf,openreview.net/pdf?id=6q_2b6u0BnJ
143,Learning Curves for Gaussian Process Regression with Power-Law Priors and Targets,iclr.cc/media/iclr-2022/Slides/6668.pdf,openreview.net/pdf?id=KeI9E-gsoB
144,Parallel Training of GRU Networks with a Multi-Grid Solver for Long Sequences,iclr.cc/media/iclr-2022/Slides/6016.pdf,openreview.net/pdf?id=N1WI0vJLER
145,"Machine Learning For Elliptic PDEs: Fast Rate Generalization Bound, Neural Scaling Law and Minimax Optimality",iclr.cc/media/iclr-2022/Slides/6547.pdf,openreview.net/pdf?id=mhYUBYNoGz
146,Discriminative Similarity for Data Clustering,iclr.cc/media/iclr-2022/Slides/6248.pdf,openreview.net/pdf?id=kj0_45Y4r9i
147,Surrogate Gap Minimization Improves Sharpness-Aware Training,iclr.cc/media/iclr-2022/Slides/6070.pdf,openreview.net/pdf?id=edONMAnhLu-
148,Sparse DETR: Efficient End-to-End Object Detection with Learnable Sparsity,iclr.cc/media/iclr-2022/Slides/7017.pdf,openreview.net/pdf?id=RRGVCN8kjim
149,Neural Parameter Allocation Search,iclr.cc/media/iclr-2022/Slides/6399.pdf,openreview.net/pdf?id=srtIXtySfT4
150,Extending the WILDS Benchmark for Unsupervised Adaptation,iclr.cc/media/iclr-2022/Slides/6963.pdf,openreview.net/pdf?id=z7p2V6KROOV
151,On the benefits of maximum likelihood estimation for Regression and Forecasting,iclr.cc/media/iclr-2022/Slides/7096.pdf,openreview.net/pdf?id=zrW-LVXj2k1
152,Hybrid Random Features,iclr.cc/media/iclr-2022/Slides/6410.pdf,openreview.net/pdf?id=EMigfE6ZeS
