,titles,slides,papers
0,Exact Optimal Accelerated Complexity for Fixed-Point Iterations,icml.cc/media/icml-2022/Slides/17040_tMvH5zY.pdf,proceedings.mlr.press/v162/park22c/park22c.pdf
1,Online Learning for Min Sum Set Cover and Pandora’s Box,icml.cc/media/icml-2022/Slides/17418.pdf,proceedings.mlr.press/v162/gergatsouli22a/gergatsouli22a.pdf
2,Tackling covariate shift with node-based Bayesian neural networks,icml.cc/media/icml-2022/Slides/17368_nXMQMZ0.pdf,proceedings.mlr.press/v162/trinh22a/trinh22a.pdf
3,Dynamic Regret of Online Markov Decision Processes,icml.cc/media/icml-2022/Slides/17646.pdf,proceedings.mlr.press/v162/zhao22c/zhao22c.pdf
4,Multi-Task Learning as a Bargaining Game,icml.cc/media/icml-2022/Slides/17114.pdf,proceedings.mlr.press/v162/navon22a/navon22a.pdf
5,Exploring and Exploiting Hubness Priors for High-Quality GAN Latent Sampling,icml.cc/media/icml-2022/Slides/16224.pdf,proceedings.mlr.press/v162/liang22b/liang22b.pdf
6,Structural Entropy Guided Graph Hierarchical Pooling,icml.cc/media/icml-2022/Slides/15960.pdf,proceedings.mlr.press/v162/wu22b/wu22b.pdf
7,On the Impossibility of Learning to Cooperate with Adaptive Partner Strategies in Repeated Games,icml.cc/media/icml-2022/Slides/17014.pdf,proceedings.mlr.press/v162/loftin22a/loftin22a.pdf
8,ButterflyFlow: Building Invertible Layers with Butterfly Matrices,icml.cc/media/icml-2022/Slides/16920.pdf,proceedings.mlr.press/v162/meng22a/meng22a.pdf
9,Frustratingly Easy Transferability Estimation,icml.cc/media/icml-2022/Slides/17386.pdf,proceedings.mlr.press/v162/huang22d/huang22d.pdf
10,Self-Supervised Representation Learning via Latent Graph Prediction,icml.cc/media/icml-2022/Slides/15996.pdf,proceedings.mlr.press/v162/xie22e/xie22e.pdf
11,DSTAGNN: Dynamic Spatial-Temporal Aware Graph Neural Network for Traffic Flow Forecasting,icml.cc/media/icml-2022/Slides/16008.pdf,proceedings.mlr.press/v162/lan22a/lan22a.pdf
12,Distributional Hamilton-Jacobi-Bellman Equations for Continuous-Time Reinforcement Learning,icml.cc/media/icml-2022/Slides/17076.pdf,proceedings.mlr.press/v162/wiltzer22a/wiltzer22a.pdf
13,Transformer Neural Processes: Uncertainty-Aware Meta Learning Via Sequence Modeling,icml.cc/media/icml-2022/Slides/17524_JaSq5IX.pdf,proceedings.mlr.press/v162/nguyen22b/nguyen22b.pdf
14,Controlling Conditional Language Models without Catastrophic Forgetting,icml.cc/media/icml-2022/Slides/16288_pIsVCHL.pdf,proceedings.mlr.press/v162/korbak22a/korbak22a.pdf
15,Robust Models Are More Interpretable Because Attributions Look Normal,icml.cc/media/icml-2022/Slides/16004.pdf,proceedings.mlr.press/v162/wang22e/wang22e.pdf
16,Sequential Covariate Shift Detection Using Classifier Two-Sample Tests,icml.cc/media/icml-2022/Slides/16272_jErbqSA.pdf,proceedings.mlr.press/v162/jang22a/jang22a.pdf
17,A Difference Standardization Method for Mutual Transfer Learning,icml.cc/media/icml-2022/Slides/17526.pdf,proceedings.mlr.press/v162/xu22j/xu22j.pdf
18,Latent Diffusion Energy-Based Model for Interpretable Text Modelling,icml.cc/media/icml-2022/Slides/17722_UKjsaZy.pdf,proceedings.mlr.press/v162/yu22h/yu22h.pdf
19,Coarsening the Granularity: Towards Structurally Sparse Lottery Tickets,icml.cc/media/icml-2022/Slides/16042.pdf,proceedings.mlr.press/v162/chen22a/chen22a.pdf
20,Smoothed Adversarial Linear Contextual Bandits with Knapsacks,icml.cc/media/icml-2022/Slides/17424.pdf,proceedings.mlr.press/v162/sivakumar22a/sivakumar22a.pdf
21,Fast Convex Optimization for Two-Layer ReLU Networks: Equivalent Model Classes and Cone Decompositions,icml.cc/media/icml-2022/Slides/16550.pdf,proceedings.mlr.press/v162/mishkin22a/mishkin22a.pdf
22,ShiftAddNAS: Hardware-Inspired Search for More Accurate and Efficient Neural Networks,icml.cc/media/icml-2022/Slides/16350.pdf,proceedings.mlr.press/v162/you22a/you22a.pdf
23,Structure-preserving GANs,icml.cc/media/icml-2022/Slides/16380.pdf,proceedings.mlr.press/v162/birrell22a/birrell22a.pdf
24,Omni-Granular Ego-Semantic Propagation for Self-Supervised Graph Representation Learning,icml.cc/media/icml-2022/Slides/16120.pdf,proceedings.mlr.press/v162/yang22d/yang22d.pdf
25,UNIREX: A Unified Learning Framework for Language Model Rationale Extraction,icml.cc/media/icml-2022/Slides/17778_aktVoJx.pdf,proceedings.mlr.press/v162/chan22a/chan22a.pdf
26,Improving Task-free Continual Learning by Distributionally Robust Memory Evolution,icml.cc/media/icml-2022/Slides/17576.pdf,proceedings.mlr.press/v162/wang22v/wang22v.pdf
27,A Completely Tuning-Free and Robust Approach to Sparse Precision Matrix Estimation,icml.cc/media/icml-2022/Slides/17674.pdf,proceedings.mlr.press/v162/tran22b/tran22b.pdf
28,Simultaneously Learning Stochastic and Adversarial Bandits with General Graph Feedback,icml.cc/media/icml-2022/Slides/17906.pdf,proceedings.mlr.press/v162/kong22b/kong22b.pdf
29,Provably Adversarially Robust Nearest Prototype Classifiers,icml.cc/media/icml-2022/Slides/17804.pdf,proceedings.mlr.press/v162/voracek22a/voracek22a.pdf
30,Mirror Learning: A Unifying Framework of Policy Optimisation,icml.cc/media/icml-2022/Slides/17442_cVqa990.pdf,proceedings.mlr.press/v162/grudzien22a/grudzien22a.pdf
31,A Multi-objective / Multi-task Learning Framework Induced by Pareto Stationarity,icml.cc/media/icml-2022/Slides/17628_Iinx0p9.pdf,proceedings.mlr.press/v162/momma22a/momma22a.pdf
32,Black-Box Tuning for Language-Model-as-a-Service,icml.cc/media/icml-2022/Slides/17784.pdf,proceedings.mlr.press/v162/sun22e/sun22e.pdf
33,DeepSpeed-MoE: Advancing Mixture-of-Experts Inference and Training to Power Next-Generation AI Scale,icml.cc/media/icml-2022/Slides/16672.pdf,proceedings.mlr.press/v162/rajbhandari22a/rajbhandari22a.pdf
34,Analyzing and Mitigating Interference in Neural Architecture Search,icml.cc/media/icml-2022/Slides/16138_eFyMeov.pdf,proceedings.mlr.press/v162/xu22h/xu22h.pdf
35,Improved No-Regret Algorithms for Stochastic Shortest Path with Linear MDP,icml.cc/media/icml-2022/Slides/16970.pdf,proceedings.mlr.press/v162/chen22h/chen22h.pdf
36,Certifying Out-of-Domain Generalization for Blackbox Functions,icml.cc/media/icml-2022/Slides/17666_KpyU0JK.pdf,proceedings.mlr.press/v162/weber22a/weber22a.pdf
37,Markov Chain Monte Carlo for Continuous-Time Switching Dynamical Systems,icml.cc/media/icml-2022/Slides/18052.pdf,proceedings.mlr.press/v162/kohs22a/kohs22a.pdf
38,FedNew: A Communication-Efficient and Privacy-Preserving Newton-Type Method for Federated Learning,icml.cc/media/icml-2022/Slides/16854.pdf,proceedings.mlr.press/v162/elgabli22a/elgabli22a.pdf
39,Sparse Invariant Risk Minimization,icml.cc/media/icml-2022/Slides/17748.pdf,proceedings.mlr.press/v162/zhou22e/zhou22e.pdf
40,Robust Kernel Density Estimation with Median-of-Means principle,icml.cc/media/icml-2022/Slides/16260_YnZjbbG.pdf,proceedings.mlr.press/v162/humbert22a/humbert22a.pdf
41,Estimating the Optimal Covariance with Imperfect Mean in Diffusion Probabilistic Models,icml.cc/media/icml-2022/Slides/16752.pdf,proceedings.mlr.press/v162/bao22d/bao22d.pdf
42,Unified Scaling Laws for Routed Language Models,icml.cc/media/icml-2022/Slides/17820.pdf,proceedings.mlr.press/v162/clark22a/clark22a.pdf
43,Head2Toe: Utilizing Intermediate Representations for Better Transfer Learning,icml.cc/media/icml-2022/Slides/16680.pdf,proceedings.mlr.press/v162/evci22a/evci22a.pdf
44,"Revisiting Online Submodular Minimization: Gap-Dependent Regret Bounds, Best of Both Worlds and Adversarial Robustness",icml.cc/media/icml-2022/Slides/17560.pdf,proceedings.mlr.press/v162/ito22a/ito22a.pdf
45,Intriguing Properties of Input-Dependent Randomized Smoothing,icml.cc/media/icml-2022/Slides/17746.pdf,proceedings.mlr.press/v162/sukeni-k22a/sukeni-k22a.pdf
46,Unraveling Attention via Convex Duality: Analysis and Interpretations of Vision Transformers,icml.cc/media/icml-2022/Slides/17172.pdf,proceedings.mlr.press/v162/sahiner22a/sahiner22a.pdf
47,Tractable Uncertainty for Structure Learning,icml.cc/media/icml-2022/Slides/18118_xfL5Ti2.pdf,proceedings.mlr.press/v162/wang22ad/wang22ad.pdf
48,Pairwise Conditional Gradients without Swap Steps and Sparser Kernel Herding,icml.cc/media/icml-2022/Slides/17206.pdf,proceedings.mlr.press/v162/tsuji22a/tsuji22a.pdf
49,Rotting Infinitely Many-Armed Bandits,icml.cc/media/icml-2022/Slides/17824_u4bPiPJ.pdf,proceedings.mlr.press/v162/kim22j/kim22j.pdf
50,Batched Dueling Bandits,icml.cc/media/icml-2022/Slides/18228.pdf,proceedings.mlr.press/v162/agarwal22a/agarwal22a.pdf
51,Continuous-Time Analysis of Accelerated Gradient Methods via Conservation Laws in Dilated Coordinate Systems,icml.cc/media/icml-2022/Slides/17998.pdf,proceedings.mlr.press/v162/suh22a/suh22a.pdf
52,Learning Infinite-horizon Average-reward Markov Decision Process with Constraints,icml.cc/media/icml-2022/Slides/17668.pdf,proceedings.mlr.press/v162/chen22i/chen22i.pdf
53,Co-training Improves Prompt-based Learning for Large Language Models,icml.cc/media/icml-2022/Slides/17882_zVMYPSH.pdf,proceedings.mlr.press/v162/lang22a/lang22a.pdf
54,Forward Operator Estimation in Generative Models with Kernel Transfer Operators,icml.cc/media/icml-2022/Slides/16996.pdf,proceedings.mlr.press/v162/huang22b/huang22b.pdf
55,A State-Distribution Matching Approach to Non-Episodic Reinforcement Learning,icml.cc/media/icml-2022/Slides/18114.pdf,proceedings.mlr.press/v162/sharma22a/sharma22a.pdf
56,DRAGONN: Distributed Randomized Approximate Gradients of Neural Networks,icml.cc/media/icml-2022/Slides/16702_6Hjt3OS.pdf,proceedings.mlr.press/v162/wang22aj/wang22aj.pdf
57,Plug & Play Attacks: Towards Robust and Flexible Model Inversion Attacks,icml.cc/media/icml-2022/Slides/16276_4Abc1R2.pdf,proceedings.mlr.press/v162/struppek22a/struppek22a.pdf
58,Evaluating the Adversarial Robustness of Adaptive Test-time Defenses,icml.cc/media/icml-2022/Slides/18042_FEz682J.pdf,proceedings.mlr.press/v162/croce22a/croce22a.pdf
59,DNA: Domain Generalization with Diversified Neural Averaging,icml.cc/media/icml-2022/Slides/16944.pdf,proceedings.mlr.press/v162/chu22a/chu22a.pdf
60,Langevin Monte Carlo for Contextual Bandits,icml.cc/media/icml-2022/Slides/18146.pdf,proceedings.mlr.press/v162/xu22p/xu22p.pdf
61,Balancing Discriminability and Transferability for Source-Free Domain Adaptation,icml.cc/media/icml-2022/Slides/17780.pdf,proceedings.mlr.press/v162/kundu22a/kundu22a.pdf
62,Conditional GANs with Auxiliary Discriminative Classifier,icml.cc/media/icml-2022/Slides/17140.pdf,proceedings.mlr.press/v162/hou22a/hou22a.pdf
63,StreamingQA: A Benchmark for Adaptation to New Knowledge over Time in Question Answering Models,icml.cc/media/icml-2022/Slides/17994.pdf,proceedings.mlr.press/v162/liska22a/liska22a.pdf
64,FriendlyCore: Practical Differentially Private Aggregation,icml.cc/media/icml-2022/Slides/16324.pdf,proceedings.mlr.press/v162/tsfadia22a/tsfadia22a.pdf
65,Equivalence Analysis between Counterfactual Regret Minimization and Online Mirror Descent,icml.cc/media/icml-2022/Slides/17864.pdf,proceedings.mlr.press/v162/liu22e/liu22e.pdf
66,Unified Fourier-based Kernel and Nonlinearity Design for Equivariant Networks on Homogeneous Spaces,icml.cc/media/icml-2022/Slides/17198.pdf,proceedings.mlr.press/v162/xu22e/xu22e.pdf
67,Unsupervised Detection of Contextualized Embedding Bias with Application to Ideology,icml.cc/media/icml-2022/Slides/18024_lpayKCd.pdf,proceedings.mlr.press/v162/hofmann22a/hofmann22a.pdf
68,Improved StyleGAN-v2 based Inversion for Out-of-Distribution Images,icml.cc/media/icml-2022/Slides/17162.pdf,proceedings.mlr.press/v162/subramanyam22a/subramanyam22a.pdf
69,Model Agnostic Sample Reweighting for Out-of-Distribution Learning,icml.cc/media/icml-2022/Slides/17868_ajInNyw.pdf,proceedings.mlr.press/v162/zhou22d/zhou22d.pdf
70,Prompting Decision Transformer for Few-Shot Policy Generalization,icml.cc/media/icml-2022/Slides/18154_yNId7Fo.pdf,proceedings.mlr.press/v162/xu22g/xu22g.pdf
71,LyaNet: A Lyapunov Framework for Training Neural ODEs,icml.cc/media/icml-2022/Slides/17060.pdf,proceedings.mlr.press/v162/rodriguez22a/rodriguez22a.pdf
72,ViT-NeT: Interpretable Vision Transformers with Neural Tree Decoder,icml.cc/media/icml-2022/Slides/16526.pdf,proceedings.mlr.press/v162/kim22g/kim22g.pdf
73,Batch Greenkhorn Algorithm for Entropic-Regularized Multimarginal Optimal Transport: Linear Rate of Convergence and Iteration Complexity,icml.cc/media/icml-2022/Slides/17940.pdf,proceedings.mlr.press/v162/kostic22a/kostic22a.pdf
74,Consistent Polyhedral Surrogates for Top-k Classification and Variants,icml.cc/media/icml-2022/Slides/17294_eVljuiL.pdf,proceedings.mlr.press/v162/thilagar22a/thilagar22a.pdf
75,Demystifying the Adversarial Robustness of Random Transformation Defenses,icml.cc/media/icml-2022/Slides/18178_KhmTe1z.pdf,proceedings.mlr.press/v162/sitawarin22a/sitawarin22a.pdf
76,Generative Cooperative Networks for Natural Language Generation,icml.cc/media/icml-2022/Slides/18132.pdf,proceedings.mlr.press/v162/lamprier22a/lamprier22a.pdf
77,Zero-shot AutoML with Pretrained Models,icml.cc/media/icml-2022/Slides/18008.pdf,proceedings.mlr.press/v162/ozturk22a/ozturk22a.pdf
78,Fishing for User Data in Large-Batch Federated Learning via Gradient Magnification,icml.cc/media/icml-2022/Slides/16788.pdf,proceedings.mlr.press/v162/wen22a/wen22a.pdf
79,Matching Normalizing Flows and Probability Paths on Manifolds,icml.cc/media/icml-2022/Slides/17244.pdf,proceedings.mlr.press/v162/ben-hamu22a/ben-hamu22a.pdf
80,Transfer and Marginalize: Explaining Away Label Noise with Privileged Information,icml.cc/media/icml-2022/Slides/17370.pdf,proceedings.mlr.press/v162/collier22a/collier22a.pdf
81,Contrastive UCB: Provably Efficient Contrastive Self-Supervised Learning in Online Reinforcement Learning,icml.cc/media/icml-2022/Slides/18338.pdf,proceedings.mlr.press/v162/qiu22c/qiu22c.pdf
82,Approximate Frank-Wolfe Algorithms over Graph-structured Support Sets,icml.cc/media/icml-2022/Slides/17938.pdf,proceedings.mlr.press/v162/zhou22i/zhou22i.pdf
83,Channel Importance Matters in Few-Shot Image Classification,icml.cc/media/icml-2022/Slides/18348_qvgw7MZ.pdf,proceedings.mlr.press/v162/luo22c/luo22c.pdf
84,Double Sampling Randomized Smoothing,icml.cc/media/icml-2022/Slides/18330.pdf,proceedings.mlr.press/v162/li22aa/li22aa.pdf
85,What Language Model Architecture and Pretraining Objective Works Best for Zero-Shot Generalization?,icml.cc/media/icml-2022/Slides/18142.pdf,proceedings.mlr.press/v162/wang22u/wang22u.pdf
86,Human-in-the-loop: Provably Efficient Preference-based Reinforcement Learning with General Function Approximation,icml.cc/media/icml-2022/Slides/18372.pdf,proceedings.mlr.press/v162/chen22ag/chen22ag.pdf
87,On Collective Robustness of Bagging Against Data Poisoning,icml.cc/media/icml-2022/Slides/17412.pdf,proceedings.mlr.press/v162/chen22k/chen22k.pdf
88,Marginal Distribution Adaptation for Discrete Sets via Module-Oriented Divergence Minimization,icml.cc/media/icml-2022/Slides/17266.pdf,proceedings.mlr.press/v162/dai22c/dai22c.pdf
89,Optimal and Efficient Dynamic Regret Algorithms for Non-Stationary Dueling Bandits,icml.cc/media/icml-2022/Slides/17676.pdf,proceedings.mlr.press/v162/saha22b/saha22b.pdf
90,TPC: Transformation-Specific Smoothing for Point Cloud Models,icml.cc/media/icml-2022/Slides/18366.pdf,proceedings.mlr.press/v162/chu22b/chu22b.pdf
91,Fishr: Invariant Gradient Variances for Out-of-Distribution Generalization,icml.cc/media/icml-2022/Slides/17214_fxdjvMU.pdf,proceedings.mlr.press/v162/rame22a/rame22a.pdf
92,Low-Complexity Deep Convolutional Neural Networks on Fully Homomorphic Encryption Using Multiplexed Parallel Convolutions,icml.cc/media/icml-2022/Slides/17802.pdf,proceedings.mlr.press/v162/lee22e/lee22e.pdf
93,Hindering Adversarial Attacks with Implicit Neural Representations,icml.cc/media/icml-2022/Slides/18020.pdf,proceedings.mlr.press/v162/rusu22a/rusu22a.pdf
94,Generalizing to Evolving Domains with Latent Structure-Aware Sequential Autoencoder,icml.cc/media/icml-2022/Slides/18056.pdf,proceedings.mlr.press/v162/qin22a/qin22a.pdf
95,Branchformer: Parallel MLP-Attention Architectures to Capture Local and Global Context for Speech Recognition and Understanding,icml.cc/media/icml-2022/Slides/18226.pdf,proceedings.mlr.press/v162/peng22a/peng22a.pdf
96,Active Sampling for Min-Max Fairness,icml.cc/media/icml-2022/Slides/18332.pdf,proceedings.mlr.press/v162/abernethy22a/abernethy22a.pdf
97,Online Nonsubmodular Minimization with Delayed Costs: From Full Information to Bandit Feedback,icml.cc/media/icml-2022/Slides/17752_I8rnBhB.pdf,proceedings.mlr.press/v162/lin22g/lin22g.pdf
98,From Noisy Prediction to True Label: Noisy Prediction Calibration via Generative Model,icml.cc/media/icml-2022/Slides/18350_oZIPQgX.pdf,proceedings.mlr.press/v162/bae22a/bae22a.pdf
99,Region-Based Semantic Factorization in GANs,icml.cc/media/icml-2022/Slides/18034.pdf,proceedings.mlr.press/v162/zhu22j/zhu22j.pdf
100,Robin Hood and Matthew Effects: Differential Privacy Has Disparate Impact on Synthetic Data,icml.cc/media/icml-2022/Slides/18248.pdf,proceedings.mlr.press/v162/ganev22a/ganev22a.pdf
101,Partial disentanglement for domain adaptation,icml.cc/media/icml-2022/Slides/18106.pdf,proceedings.mlr.press/v162/kong22a/kong22a.pdf
102,ROCK: Causal Inference Principles for Reasoning about Commonsense Causality,icml.cc/media/icml-2022/Slides/16472.pdf,proceedings.mlr.press/v162/zhang22am/zhang22am.pdf
103,Topology-Aware Network Pruning using Multi-stage Graph Embedding and Reinforcement Learning,icml.cc/media/icml-2022/Slides/16772.pdf,proceedings.mlr.press/v162/yu22e/yu22e.pdf
104,Align-RUDDER: Learning From Few Demonstrations by Reward Redistribution,icml.cc/media/icml-2022/Slides/17808.pdf,proceedings.mlr.press/v162/patil22a/patil22a.pdf
105,Robustness Implies Generalization via Data-Dependent Generalization Bounds,icml.cc/media/icml-2022/Slides/16122.pdf,proceedings.mlr.press/v162/kawaguchi22a/kawaguchi22a.pdf
106,Learning Mixtures of Linear Dynamical Systems,icml.cc/media/icml-2022/Slides/15994.pdf,proceedings.mlr.press/v162/chen22t/chen22t.pdf
107,Meaningfully debugging model mistakes using conceptual counterfactual explanations,icml.cc/media/icml-2022/Slides/16722.pdf,proceedings.mlr.press/v162/abid22a/abid22a.pdf
108,Online Continual Learning through Mutual Information Maximization,icml.cc/media/icml-2022/Slides/17488.pdf,proceedings.mlr.press/v162/guo22g/guo22g.pdf
109,Robust Group Synchronization via Quadratic Programming,icml.cc/media/icml-2022/Slides/17256.pdf,proceedings.mlr.press/v162/shi22g/shi22g.pdf
110,pathGCN: Learning General Graph Spatial Operators from Paths,icml.cc/media/icml-2022/Slides/17146.pdf,proceedings.mlr.press/v162/eliasof22a/eliasof22a.pdf
111,An iterative clustering algorithm for the Contextual Stochastic Block Model with optimality guarantees,icml.cc/media/icml-2022/Slides/16028.pdf,proceedings.mlr.press/v162/braun22a/braun22a.pdf
112,Additive Gaussian Processes Revisited,icml.cc/media/icml-2022/Slides/16274_xzadjqC.pdf,proceedings.mlr.press/v162/lu22b/lu22b.pdf
113,Probabilistic ODE Solutions in Millions of Dimensions,icml.cc/media/icml-2022/Slides/16336.pdf,proceedings.mlr.press/v162/kramer22b/kramer22b.pdf
114,Measuring the Effect of Training Data on Deep Learning Predictions via Randomized Experiments,icml.cc/media/icml-2022/Slides/16816_eYnOVfI.pdf,proceedings.mlr.press/v162/lin22h/lin22h.pdf
115,UAST: Uncertainty-Aware Siamese Tracking,icml.cc/media/icml-2022/Slides/17464.pdf,proceedings.mlr.press/v162/zhang22g/zhang22g.pdf
116,Learning Iterative Reasoning through Energy Minimization,icml.cc/media/icml-2022/Slides/17508_lUEKt9b.pdf,proceedings.mlr.press/v162/du22d/du22d.pdf
117,Graph-Coupled Oscillator Networks,icml.cc/media/icml-2022/Slides/17242.pdf,proceedings.mlr.press/v162/rusch22a/rusch22a.pdf
118,Smoothed Adaptive Weighting for Imbalanced Semi-Supervised Learning: Improve Reliability Against Unknown Distribution Data,icml.cc/media/icml-2022/Slides/16062.pdf,proceedings.mlr.press/v162/lai22b/lai22b.pdf
119,Robust Counterfactual Explanations for Tree-Based Ensembles,icml.cc/media/icml-2022/Slides/16964_HEoCCe8.pdf,proceedings.mlr.press/v162/dutta22a/dutta22a.pdf
120,HousE: Knowledge Graph Embedding with Householder Parameterization,icml.cc/media/icml-2022/Slides/17408.pdf,proceedings.mlr.press/v162/li22ab/li22ab.pdf
121,DepthShrinker: A New Compression Paradigm Towards Boosting Real-Hardware Efficiency of Compact Neural Networks,icml.cc/media/icml-2022/Slides/17550.pdf,proceedings.mlr.press/v162/fu22c/fu22c.pdf
122,Adaptive Gaussian Process Change Point Detection,icml.cc/media/icml-2022/Slides/17218.pdf,proceedings.mlr.press/v162/caldarelli22a/caldarelli22a.pdf
123,You Only Cut Once: Boosting Data Augmentation with a Single Cut,icml.cc/media/icml-2022/Slides/17624_k01InFw.pdf,proceedings.mlr.press/v162/han22a/han22a.pdf
124,PoF: Post-Training of Feature Extractor for Improving Generalization,icml.cc/media/icml-2022/Slides/17728.pdf,proceedings.mlr.press/v162/sato22a/sato22a.pdf
125,Volatility Based Kernels and Moving Average Means for Accurate Forecasting with Gaussian Processes,icml.cc/media/icml-2022/Slides/16874.pdf,proceedings.mlr.press/v162/benton22a/benton22a.pdf
126,Interpretable and Generalizable Graph Learning via Stochastic Attention Mechanism,icml.cc/media/icml-2022/Slides/17430.pdf,proceedings.mlr.press/v162/miao22a/miao22a.pdf
127,A Rigorous Study of Integrated Gradients Method and Extensions to Internal Neuron Attributions,icml.cc/media/icml-2022/Slides/17262.pdf,proceedings.mlr.press/v162/lundstrom22a/lundstrom22a.pdf
128,Generative Modeling for Multi-task Visual Learning,icml.cc/media/icml-2022/Slides/17652.pdf,proceedings.mlr.press/v162/bao22c/bao22c.pdf
129,AnyMorph: Learning Transferable Polices By Inferring Agent Morphology,icml.cc/media/icml-2022/Slides/17812_AbHrcuP.pdf,proceedings.mlr.press/v162/trabucco22b/trabucco22b.pdf
130,"Learning to Hash Robustly, Guaranteed",icml.cc/media/icml-2022/Slides/15992.pdf,proceedings.mlr.press/v162/andoni22a/andoni22a.pdf
131,Stochastic Reweighted Gradient Descent,icml.cc/media/icml-2022/Slides/16118.pdf,proceedings.mlr.press/v162/hanchi22a/hanchi22a.pdf
132,Estimating and Penalizing Induced Preference Shifts in Recommender Systems,icml.cc/media/icml-2022/Slides/17366.pdf,proceedings.mlr.press/v162/carroll22a/carroll22a.pdf
133,Meta-Learning Hypothesis Spaces for Sequential Decision-making,icml.cc/media/icml-2022/Slides/18152.pdf,proceedings.mlr.press/v162/kassraie22a/kassraie22a.pdf
134,ProGCL: Rethinking Hard Negative Mining in Graph Contrastive Learning,icml.cc/media/icml-2022/Slides/17578.pdf,proceedings.mlr.press/v162/xia22b/xia22b.pdf
135,Fenrir: Physics-Enhanced Regression for Initial Value Problems,icml.cc/media/icml-2022/Slides/17164.pdf,proceedings.mlr.press/v162/tronarp22a/tronarp22a.pdf
136,Improving Ensemble Distillation With Weight Averaging and Diversifying Perturbation,icml.cc/media/icml-2022/Slides/17838.pdf,proceedings.mlr.press/v162/nam22a/nam22a.pdf
137,HyperTransformer: Model Generation for Supervised and Semi-Supervised Few-Shot Learning,icml.cc/media/icml-2022/Slides/17688.pdf,proceedings.mlr.press/v162/zhmoginov22a/zhmoginov22a.pdf
138,DreamerPro: Reconstruction-Free Model-Based Reinforcement Learning with Prototypical Representations,icml.cc/media/icml-2022/Slides/17996.pdf,proceedings.mlr.press/v162/deng22a/deng22a.pdf
139,Sharpened Quasi-Newton Methods: Faster Superlinear Rate and Larger Local Convergence Neighborhood,icml.cc/media/icml-2022/Slides/16724.pdf,proceedings.mlr.press/v162/jin22b/jin22b.pdf
140,Residual-Based Sampling for Online Outlier-Robust PCA,icml.cc/media/icml-2022/Slides/16102_ZkCEA6R.pdf,proceedings.mlr.press/v162/zhu22i/zhu22i.pdf
141,Policy Gradient Method For Robust Reinforcement Learning,icml.cc/media/icml-2022/Slides/16374.pdf,proceedings.mlr.press/v162/wang22at/wang22at.pdf
142,Set Based Stochastic Subsampling,icml.cc/media/icml-2022/Slides/17894_LIlZfer.pdf,proceedings.mlr.press/v162/andreis22a/andreis22a.pdf
143,Variational nearest neighbor Gaussian process,icml.cc/media/icml-2022/Slides/17620_XXlnTGd.pdf,proceedings.mlr.press/v162/wu22h/wu22h.pdf
144,"A Tighter Analysis of Spectral Clustering, and Beyond",icml.cc/media/icml-2022/Slides/17964.pdf,proceedings.mlr.press/v162/macgregor22a/macgregor22a.pdf
145,Parametric Visual Program Induction with Function Modularization,icml.cc/media/icml-2022/Slides/17856.pdf,proceedings.mlr.press/v162/duan22c/duan22c.pdf
146,Preconditioning for Scalable Gaussian Process Hyperparameter Optimization,icml.cc/media/icml-2022/Slides/16534_8lbF0C6.pdf,proceedings.mlr.press/v162/wenger22a/wenger22a.pdf
147,Online Active Regression,icml.cc/media/icml-2022/Slides/17814_TcLObqJ.pdf,proceedings.mlr.press/v162/chen22l/chen22l.pdf
148,Monarch: Expressive Structured Matrices for Efficient and Accurate Training,icml.cc/media/icml-2022/Slides/17900_R7TNeV4.pdf,proceedings.mlr.press/v162/dao22a/dao22a.pdf
149,Path-Gradient Estimators for Continuous Normalizing Flows,icml.cc/media/icml-2022/Slides/17304_0S8DqlX.pdf,proceedings.mlr.press/v162/vaitl22a/vaitl22a.pdf
150,Image-to-Image Regression with Distribution-Free Uncertainty Quantification and Applications in Imaging,icml.cc/media/icml-2022/Slides/16834.pdf,proceedings.mlr.press/v162/angelopoulos22a/angelopoulos22a.pdf
151,Scaling Gaussian Process Optimization by Evaluating a Few Unique Candidates Multiple Times,icml.cc/media/icml-2022/Slides/16538.pdf,proceedings.mlr.press/v162/calandriello22a/calandriello22a.pdf
152,Stabilizing Off-Policy Deep Reinforcement Learning from Pixels,icml.cc/media/icml-2022/Slides/18002.pdf,proceedings.mlr.press/v162/cetin22a/cetin22a.pdf
153,A query-optimal algorithm for finding counterfactuals,icml.cc/media/icml-2022/Slides/16452.pdf,proceedings.mlr.press/v162/blanc22a/blanc22a.pdf
154,A Consistent and Efficient Evaluation Strategy for Attribution Methods,icml.cc/media/icml-2022/Slides/17562.pdf,proceedings.mlr.press/v162/rong22a/rong22a.pdf
