,titles,slides,papers
926,Neuro-Symbolic Hierarchical Rule Induction,icml.cc/media/icml-2022/Slides/17188.pdf,proceedings.mlr.press/v162/glanois22a/glanois22a.pdf
927,Faster Fundamental Graph Algorithms via Learned Predictions,icml.cc/media/icml-2022/Slides/16398_S6GTloV.pdf,proceedings.mlr.press/v162/chen22v/chen22v.pdf
928,Gaussian Process Uniform Error Bounds with Unknown Hyperparameters for Safety-Critical Applications,icml.cc/media/icml-2022/Slides/16024.pdf,proceedings.mlr.press/v162/capone22a/capone22a.pdf
929,Information Discrepancy in Strategic Learning,icml.cc/media/icml-2022/Slides/16480.pdf,proceedings.mlr.press/v162/bechavod22a/bechavod22a.pdf
930,A Reduction from Linear Contextual Bandits Lower Bounds to Estimations Lower Bounds,icml.cc/media/icml-2022/Slides/17008.pdf,proceedings.mlr.press/v162/he22e/he22e.pdf
931,A Hierarchical Bayesian Approach to Inverse Reinforcement Learning with Symbolic Reward Machines,icml.cc/media/icml-2022/Slides/17422_JMgSKcE.pdf,proceedings.mlr.press/v162/zhou22b/zhou22b.pdf
932,Learning Stochastic Shortest Path with Linear Function Approximation,icml.cc/media/icml-2022/Slides/16868.pdf,proceedings.mlr.press/v162/min22a/min22a.pdf
933,Practical Almost-Linear-Time Approximation Algorithms for Hybrid and Overlapping Graph Clustering,icml.cc/media/icml-2022/Slides/16880_M2pKLQk.pdf,proceedings.mlr.press/v162/orecchia22a/orecchia22a.pdf
934,"General-purpose, long-context autoregressive modeling with Perceiver AR",icml.cc/media/icml-2022/Slides/17886.pdf,proceedings.mlr.press/v162/hawthorne22a/hawthorne22a.pdf
935,An Asymptotic Test for Conditional Independence using Analytic Kernel Embeddings,icml.cc/media/icml-2022/Slides/17724.pdf,proceedings.mlr.press/v162/scetbon22a/scetbon22a.pdf
936,Particle Transformer for Jet Tagging,icml.cc/media/icml-2022/Slides/17990.pdf,proceedings.mlr.press/v162/qu22b/qu22b.pdf
937,Input Dependent Sparse Gaussian Processes,icml.cc/media/icml-2022/Slides/16064.pdf,proceedings.mlr.press/v162/jafrasteh22a/jafrasteh22a.pdf
938,Branching Reinforcement Learning,icml.cc/media/icml-2022/Slides/17088.pdf,proceedings.mlr.press/v162/du22a/du22a.pdf
939,Robust Imitation Learning against Variations in Environment Dynamics,icml.cc/media/icml-2022/Slides/17564_vsGshLP.pdf,proceedings.mlr.press/v162/chae22a/chae22a.pdf
940,A Psychological Theory of Explainability,icml.cc/media/icml-2022/Slides/16250.pdf,proceedings.mlr.press/v162/yang22c/yang22c.pdf
941,AutoIP: A United Framework to Integrate Physics into Gaussian Processes,icml.cc/media/icml-2022/Slides/16202_4quYt4k.pdf,proceedings.mlr.press/v162/long22a/long22a.pdf
942,Difference Advantage Estimation for Multi-Agent Policy Gradients,icml.cc/media/icml-2022/Slides/16126.pdf,proceedings.mlr.press/v162/li22w/li22w.pdf
943,Fair and Fast k-Center Clustering for Data Summarization,icml.cc/media/icml-2022/Slides/17570.pdf,proceedings.mlr.press/v162/angelidakis22a/angelidakis22a.pdf
944,Marginal Tail-Adaptive Normalizing Flows,icml.cc/media/icml-2022/Slides/18186.pdf,proceedings.mlr.press/v162/laszkiewicz22a/laszkiewicz22a.pdf
945,Injecting Logical Constraints into Neural Networks via Straight-Through Estimators,icml.cc/media/icml-2022/Slides/18336_1RutBq4.pdf,proceedings.mlr.press/v162/yang22h/yang22h.pdf
946,Nyström Kernel Mean Embeddings,icml.cc/media/icml-2022/Slides/17772.pdf,proceedings.mlr.press/v162/chatalic22a/chatalic22a.pdf
947,Fast rates for noisy interpolation require rethinking the effect of inductive bias,icml.cc/media/icml-2022/Slides/17650_HeXoOxI.pdf,proceedings.mlr.press/v162/donhauser22a/donhauser22a.pdf
948,Discriminator-Weighted Offline Imitation Learning from Suboptimal Demonstrations,icml.cc/media/icml-2022/Slides/17686.pdf,proceedings.mlr.press/v162/xu22l/xu22l.pdf
949,Task-aware Privacy Preservation for Multi-dimensional Data,icml.cc/media/icml-2022/Slides/16590_uyf9q9u.pdf,proceedings.mlr.press/v162/cheng22a/cheng22a.pdf
950,Online and Consistent Correlation Clustering,icml.cc/media/icml-2022/Slides/17638.pdf,proceedings.mlr.press/v162/cohen-addad22a/cohen-addad22a.pdf
951,"Prioritized Training on Points that are Learnable, Worth Learning, and not yet Learnt",icml.cc/media/icml-2022/Slides/18420.pdf,proceedings.mlr.press/v162/mindermann22a/mindermann22a.pdf
952,Plan Better Amid Conservatism: Offline Multi-Agent Reinforcement Learning with Actor Rectification,icml.cc/media/icml-2022/Slides/17592.pdf,proceedings.mlr.press/v162/pan22a/pan22a.pdf
953,Distribution Regression with Sliced Wasserstein Kernels,icml.cc/media/icml-2022/Slides/17914.pdf,proceedings.mlr.press/v162/meunier22b/meunier22b.pdf
954,SkexGen: Autoregressive Generation of CAD Construction Sequences with Disentangled Codebooks,icml.cc/media/icml-2022/Slides/18218.pdf,proceedings.mlr.press/v162/xu22k/xu22k.pdf
955,Learning from Demonstration: Provably Efficient Adversarial Policy Imitation with Linear Function Approximation,icml.cc/media/icml-2022/Slides/17216_pcbAtw2.pdf,proceedings.mlr.press/v162/liu22u/liu22u.pdf
956,Strategic Representation,icml.cc/media/icml-2022/Slides/17612_lESPoeg.pdf,proceedings.mlr.press/v162/nair22a/nair22a.pdf
957,Near-Optimal Algorithms for Autonomous Exploration and Multi-Goal Stochastic Shortest Path,icml.cc/media/icml-2022/Slides/18096.pdf,proceedings.mlr.press/v162/cai22a/cai22a.pdf
958,On Distribution Shift in Learning-based Bug Detectors,icml.cc/media/icml-2022/Slides/18392.pdf,proceedings.mlr.press/v162/he22a/he22a.pdf
959,NeuroFluid: Fluid Dynamics Grounding with Particle-Driven Neural Radiance Fields,icml.cc/media/icml-2022/Slides/18386.pdf,proceedings.mlr.press/v162/guan22a/guan22a.pdf
960,Generalized Leverage Scores: Geometric Interpretation and Applications,icml.cc/media/icml-2022/Slides/17978.pdf,proceedings.mlr.press/v162/ordozgoiti22a/ordozgoiti22a.pdf
961,Streaming Algorithm for Monotone k-Submodular Maximization with Cardinality Constraints,icml.cc/media/icml-2022/Slides/16614.pdf,proceedings.mlr.press/v162/ene22a/ene22a.pdf
962,UnderGrad: A Universal Black-Box Optimization Method with Almost Dimension-Free Convergence Rate Guarantees,icml.cc/media/icml-2022/Slides/17904.pdf,proceedings.mlr.press/v162/antonakopoulos22b/antonakopoulos22b.pdf
963,Generalised Policy Improvement with Geometric Policy Composition,icml.cc/media/icml-2022/Slides/17512.pdf,proceedings.mlr.press/v162/thakoor22a/thakoor22a.pdf
964,Stochastic Deep Networks with Linear Competing Units for Model-Agnostic Meta-Learning,icml.cc/media/icml-2022/Slides/15956.pdf,proceedings.mlr.press/v162/kalais22a/kalais22a.pdf
965,Learning Bellman Complete Representations for Offline Policy Evaluation,icml.cc/media/icml-2022/Slides/16802.pdf,proceedings.mlr.press/v162/chang22b/chang22b.pdf
966,A Context-Integrated Transformer-Based Neural Network for Auction Design,icml.cc/media/icml-2022/Slides/17744.pdf,proceedings.mlr.press/v162/duan22a/duan22a.pdf
967,Dynamic Topic Models for Temporal Document Networks,icml.cc/media/icml-2022/Slides/16124.pdf,proceedings.mlr.press/v162/zhang22n/zhang22n.pdf
968,Ripple Attention for Visual Perception with Sub-quadratic Complexity,icml.cc/media/icml-2022/Slides/16150.pdf,proceedings.mlr.press/v162/zheng22a/zheng22a.pdf
969,Provable Stochastic Optimization for Global Contrastive Learning: Small Batch Does Not Harm Performance,icml.cc/media/icml-2022/Slides/16562_kHxy7uV.pdf,proceedings.mlr.press/v162/yuan22b/yuan22b.pdf
970,A Functional Information Perspective on Model Interpretation,icml.cc/media/icml-2022/Slides/17196.pdf,proceedings.mlr.press/v162/gat22a/gat22a.pdf
971,Domain Adaptation for Time Series Forecasting via Attention Sharing,icml.cc/media/icml-2022/Slides/16938.pdf,proceedings.mlr.press/v162/jin22d/jin22d.pdf
972,Data-Efficient Double-Win Lottery Tickets from Robust Pre-training,icml.cc/media/icml-2022/Slides/16056.pdf,proceedings.mlr.press/v162/chen22ae/chen22ae.pdf
973,Be Like Water: Adaptive Floating Point for Machine Learning,icml.cc/media/icml-2022/Slides/17288.pdf,proceedings.mlr.press/v162/yeh22a/yeh22a.pdf
974,Continuous-Time Modeling of Counterfactual Outcomes Using Neural Controlled Differential Equations,icml.cc/media/icml-2022/Slides/17112.pdf,proceedings.mlr.press/v162/seedat22b/seedat22b.pdf
975,"OFA: Unifying Architectures, Tasks, and Modalities Through a Simple Sequence-to-Sequence Learning Framework",icml.cc/media/icml-2022/Slides/17836.pdf,proceedings.mlr.press/v162/wang22al/wang22al.pdf
976,Attentional Meta-learners for Few-shot Polythetic Classification,icml.cc/media/icml-2022/Slides/16068.pdf,proceedings.mlr.press/v162/day22a/day22a.pdf
977,Plug-In Inversion: Model-Agnostic Inversion for Vision with Data Augmentations,icml.cc/media/icml-2022/Slides/16376.pdf,proceedings.mlr.press/v162/ghiasi22a/ghiasi22a.pdf
978,In defense of dual-encoders for neural ranking,icml.cc/media/icml-2022/Slides/16410.pdf,proceedings.mlr.press/v162/menon22a/menon22a.pdf
979,Multirate Training of Neural Networks,icml.cc/media/icml-2022/Slides/16706.pdf,proceedings.mlr.press/v162/vlaar22b/vlaar22b.pdf
980,Lie Point Symmetry Data Augmentation for Neural PDE Solvers,icml.cc/media/icml-2022/Slides/17314.pdf,proceedings.mlr.press/v162/brandstetter22a/brandstetter22a.pdf
981,Disentangling Disease-related Representation from Obscure for Disease Prediction,icml.cc/media/icml-2022/Slides/17212.pdf,proceedings.mlr.press/v162/wang22f/wang22f.pdf
982,Offline Meta-Reinforcement Learning with Online Self-Supervision,icml.cc/media/icml-2022/Slides/16152.pdf,proceedings.mlr.press/v162/pong22a/pong22a.pdf
983,Safe Learning in Tree-Form Sequential Decision Making: Handling Hard and Soft Constraints,icml.cc/media/icml-2022/Slides/17522.pdf,proceedings.mlr.press/v162/bernasconi22a/bernasconi22a.pdf
984,Nonparametric Factor Trajectory Learning for Dynamic Tensor Decomposition,icml.cc/media/icml-2022/Slides/16046.pdf,proceedings.mlr.press/v162/wang22ar/wang22ar.pdf
985,Doubly Robust Distributionally Robust Off-Policy Evaluation and Learning,icml.cc/media/icml-2022/Slides/16750_xJaPVAO.pdf,proceedings.mlr.press/v162/kallus22a/kallus22a.pdf
986,Fast Provably Robust Decision Trees and Boosting,icml.cc/media/icml-2022/Slides/16128.pdf,proceedings.mlr.press/v162/guo22h/guo22h.pdf
987,Design-Bench: Benchmarks for Data-Driven Offline Model-Based Optimization,icml.cc/media/icml-2022/Slides/17232.pdf,proceedings.mlr.press/v162/trabucco22a/trabucco22a.pdf
988,Variational Wasserstein gradient flow,icml.cc/media/icml-2022/Slides/16824.pdf,proceedings.mlr.press/v162/fan22d/fan22d.pdf
989,From block-Toeplitz matrices to differential equations on graphs: towards a general theory for scalable masked Transformers,icml.cc/media/icml-2022/Slides/16582.pdf,proceedings.mlr.press/v162/choromanski22a/choromanski22a.pdf
990,Adaptive Second Order Coresets for Data-efficient Machine Learning,icml.cc/media/icml-2022/Slides/16584.pdf,proceedings.mlr.press/v162/pooladzandi22a/pooladzandi22a.pdf
991,"A Marriage between Adversarial Team Games and 2-player Games: Enabling Abstractions, No-regret Learning, and Subgame Solving",icml.cc/media/icml-2022/Slides/17642_SuXXWzo.pdf,proceedings.mlr.press/v162/carminati22a/carminati22a.pdf
992,Nonparametric Embeddings of Sparse High-Order Interaction Events,icml.cc/media/icml-2022/Slides/16050.pdf,proceedings.mlr.press/v162/wang22ah/wang22ah.pdf
993,Kernel Methods for Radial Transformed Compositional Data with Many Zeros,icml.cc/media/icml-2022/Slides/16214_oySemB3.pdf,proceedings.mlr.press/v162/park22d/park22d.pdf
994,Order Constraints in Optimal Transport,icml.cc/media/icml-2022/Slides/16076_e9VzqhL.pdf,proceedings.mlr.press/v162/lim22b/lim22b.pdf
995,Building Robust Ensembles via Margin Boosting,icml.cc/media/icml-2022/Slides/17006_1iZmz0H.pdf,proceedings.mlr.press/v162/zhang22aj/zhang22aj.pdf
996,Linear Complexity Randomized Self-attention Mechanism,icml.cc/media/icml-2022/Slides/16978.pdf,proceedings.mlr.press/v162/zheng22b/zheng22b.pdf
997,Sublinear-Time Clustering Oracle for Signed Graphs,icml.cc/media/icml-2022/Slides/16038.pdf,proceedings.mlr.press/v162/neumann22a/neumann22a.pdf
998,Understanding Policy Gradient Algorithms: A Sensitivity-Based Approach,icml.cc/media/icml-2022/Slides/16060.pdf,proceedings.mlr.press/v162/wu22i/wu22i.pdf
999,Nesterov Accelerated Shuffling Gradient Method for Convex Optimization,icml.cc/media/icml-2022/Slides/16394.pdf,proceedings.mlr.press/v162/tran22a/tran22a.pdf
1000,Exact Learning of Preference Structure: Single-peaked Preferences and Beyond,icml.cc/media/icml-2022/Slides/17950.pdf,proceedings.mlr.press/v162/kraiczy22a/kraiczy22a.pdf
1001,Adapting the Linearised Laplace Model Evidence for Modern Deep Learning,icml.cc/media/icml-2022/Slides/18290.pdf,proceedings.mlr.press/v162/antoran22a/antoran22a.pdf
1002,Versatile Offline Imitation from Observations and Examples via Regularized State-Occupancy Matching,icml.cc/media/icml-2022/Slides/16598.pdf,proceedings.mlr.press/v162/ma22a/ma22a.pdf
1003,Learning of Cluster-based Feature Importance for Electronic Health Record Time-series,icml.cc/media/icml-2022/Slides/17712.pdf,proceedings.mlr.press/v162/aguiar22a/aguiar22a.pdf
1004,Efficient Representation Learning via Adaptive Context Pooling,icml.cc/media/icml-2022/Slides/17010.pdf,proceedings.mlr.press/v162/huang22j/huang22j.pdf
1005,Robust Task Representations for Offline Meta-Reinforcement Learning via Contrastive Learning,icml.cc/media/icml-2022/Slides/16240_K4BQpKc.pdf,proceedings.mlr.press/v162/yuan22a/yuan22a.pdf
1006,"Connect, Not Collapse: Explaining Contrastive Learning for Unsupervised Domain Adaptation",icml.cc/media/icml-2022/Slides/18406_Uh53VaG.pdf,proceedings.mlr.press/v162/shen22d/shen22d.pdf
1007,Causal Conceptions of Fairness and their Consequences,icml.cc/media/icml-2022/Slides/17122_eHjIkLG.pdf,proceedings.mlr.press/v162/nilforoshan22a/nilforoshan22a.pdf
1008,Do Differentiable Simulators Give Better Policy Gradients?,icml.cc/media/icml-2022/Slides/16770_9rTdCsb.pdf,proceedings.mlr.press/v162/suh22b/suh22b.pdf
1009,Toward Compositional Generalization in Object-Oriented World Modeling,icml.cc/media/icml-2022/Slides/18212.pdf,proceedings.mlr.press/v162/zhao22b/zhao22b.pdf
1010,Efficient Low Rank Convex Bounds for Pairwise Discrete Graphical Models,icml.cc/media/icml-2022/Slides/17754_aM2bhsN.pdf,proceedings.mlr.press/v162/durante22a/durante22a.pdf
1011,Temporal Difference Learning for Model Predictive Control,icml.cc/media/icml-2022/Slides/17050.pdf,proceedings.mlr.press/v162/hansen22a/hansen22a.pdf
1012,Selling Data To a Machine Learner: Pricing via Costly Signaling,icml.cc/media/icml-2022/Slides/18030.pdf,proceedings.mlr.press/v162/chen22m/chen22m.pdf
1013,NOMU: Neural Optimization-based Model Uncertainty,icml.cc/media/icml-2022/Slides/16226.pdf,proceedings.mlr.press/v162/heiss22a/heiss22a.pdf
1014,Off-Policy Reinforcement Learning with Delayed Rewards,icml.cc/media/icml-2022/Slides/16162.pdf,proceedings.mlr.press/v162/han22e/han22e.pdf
1015,"Bayesian Model Selection, the Marginal Likelihood, and Generalization",icml.cc/media/icml-2022/Slides/17992_WgaoCVN.pdf,proceedings.mlr.press/v162/lotfi22a/lotfi22a.pdf
1016,Hardness and Algorithms for Robust and Sparse Optimization,icml.cc/media/icml-2022/Slides/17150_54PW4iO.pdf,proceedings.mlr.press/v162/price22a/price22a.pdf
1017,Model Selection in Batch Policy Optimization,icml.cc/media/icml-2022/Slides/17070_oociP3b.pdf,proceedings.mlr.press/v162/lee22k/lee22k.pdf
1018,Direct Behavior Specification via Constrained Reinforcement Learning,icml.cc/media/icml-2022/Slides/16264_ayzHupx.pdf,proceedings.mlr.press/v162/roy22a/roy22a.pdf
1019,Large Batch Experience Replay,icml.cc/media/icml-2022/Slides/15972.pdf,proceedings.mlr.press/v162/lahire22a/lahire22a.pdf
1020,A Convergent and Dimension-Independent Min-Max Optimization Algorithm,icml.cc/media/icml-2022/Slides/18204.pdf,proceedings.mlr.press/v162/keswani22a/keswani22a.pdf
1021,Adversarially Trained Actor Critic for Offline Reinforcement Learning,icml.cc/media/icml-2022/Slides/17174.pdf,proceedings.mlr.press/v162/cheng22b/cheng22b.pdf
1022,PAC-Bayesian Bounds on Rate-Efficient Classifiers,icml.cc/media/icml-2022/Slides/16338_MSGx0x3.pdf,proceedings.mlr.press/v162/abbas22a/abbas22a.pdf
1023,Adaptive Conformal Predictions for Time Series,icml.cc/media/icml-2022/Slides/17818.pdf,proceedings.mlr.press/v162/zaffran22a/zaffran22a.pdf
1024,More Efficient Sampling for Tensor Decomposition With Worst-Case Guarantees,icml.cc/media/icml-2022/Slides/16646_wsn5EEN.pdf,proceedings.mlr.press/v162/malik22a/malik22a.pdf
1025,Fairness with Adaptive Weights,icml.cc/media/icml-2022/Slides/17016.pdf,proceedings.mlr.press/v162/chai22a/chai22a.pdf
1026,Fast Population-Based Reinforcement Learning on a Single Machine,icml.cc/media/icml-2022/Slides/18254.pdf,proceedings.mlr.press/v162/flajolet22a/flajolet22a.pdf
1027,The Combinatorial Brain Surgeon: Pruning Weights That Cancel One Another in Neural Networks,icml.cc/media/icml-2022/Slides/18322.pdf,proceedings.mlr.press/v162/yu22f/yu22f.pdf
1028,Fast-Rate PAC-Bayesian Generalization Bounds for Meta-Learning,icml.cc/media/icml-2022/Slides/16026_eRlN95z.pdf,proceedings.mlr.press/v162/guan22b/guan22b.pdf
1029,NeuralEF: Deconstructing Kernels by Deep Neural Networks,icml.cc/media/icml-2022/Slides/18262.pdf,proceedings.mlr.press/v162/deng22b/deng22b.pdf
1030,Let Invariant Rationale Discovery Inspire Graph Contrastive Learning,icml.cc/media/icml-2022/Slides/17738.pdf,proceedings.mlr.press/v162/li22v/li22v.pdf
1031,Sharp-MAML: Sharpness-Aware Model-Agnostic Meta Learning,icml.cc/media/icml-2022/Slides/16662.pdf,proceedings.mlr.press/v162/abbas22b/abbas22b.pdf
1032,Wide Neural Networks Forget Less Catastrophically,icml.cc/media/icml-2022/Slides/17092.pdf,proceedings.mlr.press/v162/mirzadeh22a/mirzadeh22a.pdf
1033,Stochastic Continuous Submodular Maximization: Boosting via Non-oblivious Function,icml.cc/media/icml-2022/Slides/17306.pdf,proceedings.mlr.press/v162/zhang22e/zhang22e.pdf
1034,Optimal Estimation of Policy Gradient via Double Fitted Iteration,icml.cc/media/icml-2022/Slides/17156.pdf,proceedings.mlr.press/v162/ni22b/ni22b.pdf
1035,Evolving Curricula with Regret-Based Environment Design,icml.cc/media/icml-2022/Slides/16334.pdf,proceedings.mlr.press/v162/parker-holder22a/parker-holder22a.pdf
1036,Instance Dependent Regret Analysis of Kernelized Bandits,icml.cc/media/icml-2022/Slides/16114.pdf,proceedings.mlr.press/v162/shekhar22a/shekhar22a.pdf
1037,Visual Attention Emerges from Recurrent Sparse Reconstruction,icml.cc/media/icml-2022/Slides/17270.pdf,proceedings.mlr.press/v162/shi22e/shi22e.pdf
1038,Achieving Fairness at No Utility Cost via Data Reweighing with Influence,icml.cc/media/icml-2022/Slides/17310.pdf,proceedings.mlr.press/v162/li22p/li22p.pdf
1039,On the Convergence of Local Stochastic Compositional Gradient Descent with Momentum,icml.cc/media/icml-2022/Slides/16940.pdf,proceedings.mlr.press/v162/gao22c/gao22c.pdf
1040,Rethinking Graph Neural Networks for Anomaly Detection,icml.cc/media/icml-2022/Slides/17968_le6HH92.pdf,proceedings.mlr.press/v162/tang22b/tang22b.pdf
1041,A Unified View on PAC-Bayes Bounds for Meta-Learning,icml.cc/media/icml-2022/Slides/17498.pdf,proceedings.mlr.press/v162/rezazadeh22a/rezazadeh22a.pdf
1042,Provably Efficient Offline Reinforcement Learning for Partially Observable Markov Decision Processes,icml.cc/media/icml-2022/Slides/17394_FGNZka4.pdf,proceedings.mlr.press/v162/guo22a/guo22a.pdf
1043,Robust Deep Reinforcement Learning through Bootstrapped Opportunistic Curriculum,icml.cc/media/icml-2022/Slides/16758_JeyJ3Ai.pdf,proceedings.mlr.press/v162/wu22k/wu22k.pdf
1044,Accelerated Gradient Methods for Geodesically Convex Optimization: Tractable Algorithms and Convergence Analysis,icml.cc/media/icml-2022/Slides/17548.pdf,proceedings.mlr.press/v162/kim22k/kim22k.pdf
1045,Fast Aquatic Swimmer Optimization with Differentiable Projective Dynamics and Neural Network Hydrodynamic Models,icml.cc/media/icml-2022/Slides/18076_x16McSu.pdf,proceedings.mlr.press/v162/nava22a/nava22a.pdf
1046,Mitigating Gender Bias in Face Recognition using the von Mises-Fisher Mixture Model,icml.cc/media/icml-2022/Slides/17420.pdf,proceedings.mlr.press/v162/conti22a/conti22a.pdf
1047,How Powerful are Spectral Graph Neural Networks,icml.cc/media/icml-2022/Slides/17796.pdf,proceedings.mlr.press/v162/wang22am/wang22am.pdf
1048,Transformer Quality in Linear Time,icml.cc/media/icml-2022/Slides/17274.pdf,proceedings.mlr.press/v162/hua22a/hua22a.pdf
1049,SPDY: Accurate Pruning with Speedup Guarantees,icml.cc/media/icml-2022/Slides/17438.pdf,proceedings.mlr.press/v162/frantar22a/frantar22a.pdf
1050,Transformers are Meta-Reinforcement Learners,icml.cc/media/icml-2022/Slides/17086.pdf,proceedings.mlr.press/v162/melo22a/melo22a.pdf
1051,Off-Policy Fitted Q-Evaluation with Differentiable Function Approximators: Z-Estimation and Inference Theory,icml.cc/media/icml-2022/Slides/17760.pdf,proceedings.mlr.press/v162/zhang22al/zhang22al.pdf
1052,The Complexity of k-Means Clustering when Little is Known,icml.cc/media/icml-2022/Slides/17704_0vpztex.pdf,proceedings.mlr.press/v162/ganian22a/ganian22a.pdf
1053,Tell me why! Explanations support learning relational and causal structure,icml.cc/media/icml-2022/Slides/16192.pdf,proceedings.mlr.press/v162/lampinen22a/lampinen22a.pdf
1054,What Dense Graph Do You Need for Self-Attention?,icml.cc/media/icml-2022/Slides/17504.pdf,proceedings.mlr.press/v162/wang22l/wang22l.pdf
1055,Selective Regression under Fairness Criteria,icml.cc/media/icml-2022/Slides/18234_ISssTKe.pdf,proceedings.mlr.press/v162/shah22a/shah22a.pdf
1056,Flashlight: Enabling Innovation in Tools for Machine Learning,icml.cc/media/icml-2022/Slides/17878_23lP44f.pdf,proceedings.mlr.press/v162/kahn22a/kahn22a.pdf
1057,Proving Theorems using Incremental Learning and Hindsight Experience Replay,icml.cc/media/icml-2022/Slides/18098.pdf,proceedings.mlr.press/v162/aygun22a/aygun22a.pdf
1058,Constraint-based graph network simulator,icml.cc/media/icml-2022/Slides/17852.pdf,proceedings.mlr.press/v162/rubanova22a/rubanova22a.pdf
1059,Koopman Q-learning: Offline Reinforcement Learning via Symmetries of Dynamics,icml.cc/media/icml-2022/Slides/17726.pdf,proceedings.mlr.press/v162/weissenbacher22a/weissenbacher22a.pdf
1060,Discovering Generalizable Spatial Goal Representations via Graph-based Active Reward Learning,icml.cc/media/icml-2022/Slides/18242_7r2ECqw.pdf,proceedings.mlr.press/v162/netanyahu22a/netanyahu22a.pdf
1061,On the Robustness of CountSketch to Adaptive Inputs,icml.cc/media/icml-2022/Slides/18044_uz2pLAa.pdf,proceedings.mlr.press/v162/cohen22a/cohen22a.pdf
1062,Input-agnostic Certified Group Fairness via Gaussian Parameter Smoothing,icml.cc/media/icml-2022/Slides/18358.pdf,proceedings.mlr.press/v162/jin22g/jin22g.pdf
1063,Constrained Variational Policy Optimization for Safe Reinforcement Learning,icml.cc/media/icml-2022/Slides/16642.pdf,proceedings.mlr.press/v162/liu22b/liu22b.pdf
1064,Proximal Denoiser for Convergent Plug-and-Play Optimization with Nonconvex Regularization,icml.cc/media/icml-2022/Slides/18136_WaFn4hZ.pdf,proceedings.mlr.press/v162/hurault22a/hurault22a.pdf
1065,On the Role of Discount Factor in Offline Reinforcement Learning,icml.cc/media/icml-2022/Slides/18282.pdf,proceedings.mlr.press/v162/hu22d/hu22d.pdf
1066,Structure-Aware Transformer for Graph Representation Learning,icml.cc/media/icml-2022/Slides/17988.pdf,proceedings.mlr.press/v162/chen22r/chen22r.pdf
1067,Generalized Strategic Classification and the Case of Aligned Incentives,icml.cc/media/icml-2022/Slides/16372_6CJGMw0.pdf,proceedings.mlr.press/v162/levanon22a/levanon22a.pdf
1068,From Dirichlet to Rubin: Optimistic Exploration in RL without Bonuses,icml.cc/media/icml-2022/Slides/16390_mp0EdPK.pdf,proceedings.mlr.press/v162/tiapkin22a/tiapkin22a.pdf
1069,Learning to Cut by Looking Ahead: Cutting Plane Selection via Imitation Learning,icml.cc/media/icml-2022/Slides/16910.pdf,proceedings.mlr.press/v162/paulus22a/paulus22a.pdf
1070,GLaM: Efficient Scaling of Language Models with Mixture-of-Experts,icml.cc/media/icml-2022/Slides/17378.pdf,proceedings.mlr.press/v162/du22c/du22c.pdf
1071,Bregman Neural Networks,icml.cc/media/icml-2022/Slides/17634.pdf,proceedings.mlr.press/v162/frecon22a/frecon22a.pdf
1072,Revisiting End-to-End Speech-to-Text Translation From Scratch,icml.cc/media/icml-2022/Slides/17532.pdf,proceedings.mlr.press/v162/zhang22i/zhang22i.pdf
1073,Convergence of Invariant Graph Networks,icml.cc/media/icml-2022/Slides/16106_vZknJrK.pdf,proceedings.mlr.press/v162/cai22b/cai22b.pdf
1074,Global Optimization Networks,icml.cc/media/icml-2022/Slides/16108.pdf,proceedings.mlr.press/v162/zhao22f/zhao22f.pdf
1075,"ProgFed: Effective, Communication, and Computation Efficient Federated Learning by Progressive Training",icml.cc/media/icml-2022/Slides/16194_hmjFNsN.pdf,proceedings.mlr.press/v162/wang22y/wang22y.pdf
1076,Deploying Convolutional Networks on Untrusted Platforms Using 2D Holographic Reduced Representations,icml.cc/media/icml-2022/Slides/16462_zD50OrJ.pdf,proceedings.mlr.press/v162/alam22a/alam22a.pdf
1077,Federated Learning with Label Distribution Skew via Logits Calibration,icml.cc/media/icml-2022/Slides/16222_ACMSuAk.pdf,proceedings.mlr.press/v162/zhang22p/zhang22p.pdf
1078,Generalized Federated Learning via Sharpness Aware Minimization,icml.cc/media/icml-2022/Slides/16134.pdf,proceedings.mlr.press/v162/qu22a/qu22a.pdf
1079,Strategies for Safe Multi-Armed Bandits with Logarithmic Regret and Risk,icml.cc/media/icml-2022/Slides/16294_m64FOxf.pdf,proceedings.mlr.press/v162/chen22e/chen22e.pdf
1080,Data Scaling Laws in NMT: The Effect of Noise and Architecture,icml.cc/media/icml-2022/Slides/17568.pdf,proceedings.mlr.press/v162/bansal22b/bansal22b.pdf
1081,Quantifying and Learning Linear Symmetry-Based Disentanglement,icml.cc/media/icml-2022/Slides/17702.pdf,proceedings.mlr.press/v162/tonnaer22a/tonnaer22a.pdf
