,titles,slides,papers
619,On the Sample Complexity of Learning Infinite-horizon Discounted Linear Kernel MDPs,icml.cc/media/icml-2022/Slides/17896_clc6CuM.pdf,proceedings.mlr.press/v162/chen22f/chen22f.pdf
620,Stochastic smoothing of the top-K calibrated hinge loss for deep imbalanced classification,icml.cc/media/icml-2022/Slides/17930.pdf,proceedings.mlr.press/v162/garcin22a/garcin22a.pdf
621,Constrained Optimization with Dynamic Bound-scaling for Effective NLP Backdoor Defense,icml.cc/media/icml-2022/Slides/17166.pdf,proceedings.mlr.press/v162/shen22e/shen22e.pdf
622,Provable Acceleration of Heavy Ball beyond Quadratics for a Class of Polyak-Lojasiewicz Functions when the Non-Convexity is Averaged-Out,icml.cc/media/icml-2022/Slides/16518.pdf,proceedings.mlr.press/v162/wang22p/wang22p.pdf
623,Certified Adversarial Robustness Under the Bounded Support Set,icml.cc/media/icml-2022/Slides/17478.pdf,proceedings.mlr.press/v162/kou22a/kou22a.pdf
624,A Unified Weight Initialization Paradigm for Tensorial Convolutional Neural Networks,icml.cc/media/icml-2022/Slides/18058.pdf,proceedings.mlr.press/v162/pan22b/pan22b.pdf
625,Thompson Sampling for Robust Transfer in Multi-Task Bandits,icml.cc/media/icml-2022/Slides/16878.pdf,proceedings.mlr.press/v162/wang22an/wang22an.pdf
626,Action-Sufficient State Representation Learning for Control with Structural Constraints,icml.cc/media/icml-2022/Slides/17324.pdf,proceedings.mlr.press/v162/huang22f/huang22f.pdf
627,Fast Lossless Neural Compression with Integer-Only Discrete Flows,icml.cc/media/icml-2022/Slides/17734.pdf,proceedings.mlr.press/v162/wang22a/wang22a.pdf
628,Path-Aware and Structure-Preserving Generation of Synthetically Accessible Molecules,icml.cc/media/icml-2022/Slides/18316.pdf,proceedings.mlr.press/v162/noh22a/noh22a.pdf
629,Predicting Out-of-Distribution Error with the Projection Norm,icml.cc/media/icml-2022/Slides/17656_6Q3N8nr.pdf,proceedings.mlr.press/v162/yu22i/yu22i.pdf
630,On Learning Mixture of Linear Regressions in the Non-Realizable Setting,icml.cc/media/icml-2022/Slides/16904_lwoF2bG.pdf,proceedings.mlr.press/v162/pal22b/pal22b.pdf
631,A Modern Self-Referential Weight Matrix That Learns to Modify Itself,icml.cc/media/icml-2022/Slides/17700_Qq7FBxu.pdf,proceedings.mlr.press/v162/irie22b/irie22b.pdf
632,Constants Matter: The Performance Gains of Active Learning,icml.cc/media/icml-2022/Slides/17610_YXtDzcj.pdf,proceedings.mlr.press/v162/mussmann22a/mussmann22a.pdf
633,Denoised MDPs: Learning World Models Better Than the World Itself,icml.cc/media/icml-2022/Slides/17444_20IRPwo.pdf,proceedings.mlr.press/v162/wang22c/wang22c.pdf
634,PLATINUM: Semi-Supervised Model Agnostic Meta-Learning using Submodular Mutual Information,icml.cc/media/icml-2022/Slides/18232.pdf,proceedings.mlr.press/v162/li22k/li22k.pdf
635,SQ-VAE: Variational Bayes on Discrete Representation with Self-annealed Stochastic Quantization,icml.cc/media/icml-2022/Slides/17788.pdf,proceedings.mlr.press/v162/takida22a/takida22a.pdf
636,EquiBind: Geometric Deep Learning for Drug Binding Structure Prediction,icml.cc/media/icml-2022/Slides/18362.pdf,proceedings.mlr.press/v162/stark22b/stark22b.pdf
637,Random Forest Density Estimation,icml.cc/media/icml-2022/Slides/17320.pdf,proceedings.mlr.press/v162/wen22c/wen22c.pdf
638,Efficient Approximate Inference for Stationary Kernel on Frequency Domain,icml.cc/media/icml-2022/Slides/18382.pdf,proceedings.mlr.press/v162/jung22b/jung22b.pdf
639,Adversarially Robust Models may not Transfer Better: Sufficient Conditions for Domain Transferability from the View of Regularization,icml.cc/media/icml-2022/Slides/18194.pdf,proceedings.mlr.press/v162/xu22n/xu22n.pdf
640,Short-Term Plasticity Neurons Learning to Learn and Forget,icml.cc/media/icml-2022/Slides/18310.pdf,proceedings.mlr.press/v162/rodriguez22b/rodriguez22b.pdf
641,Multicoated Supermasks Enhance Hidden Networks,icml.cc/media/icml-2022/Slides/18246.pdf,proceedings.mlr.press/v162/okoshi22a/okoshi22a.pdf
642,A New Perspective on the Effects of Spectrum in Graph Neural Networks,icml.cc/media/icml-2022/Slides/16962.pdf,proceedings.mlr.press/v162/yang22n/yang22n.pdf
643,Improved Regret for Differentially Private Exploration in Linear MDP,icml.cc/media/icml-2022/Slides/16760_JJ3AjUG.pdf,proceedings.mlr.press/v162/ngo22a/ngo22a.pdf
644,NISPA: Neuro-Inspired Stability-Plasticity Adaptation for Continual Learning in Sparse Networks,icml.cc/media/icml-2022/Slides/16096.pdf,proceedings.mlr.press/v162/gurbuz22a/gurbuz22a.pdf
645,Neural Tangent Kernel Beyond the Infinite-Width Limit: Effects of Depth and Initialization,icml.cc/media/icml-2022/Slides/16474.pdf,proceedings.mlr.press/v162/seleznova22a/seleznova22a.pdf
646,The Infinite Contextual Graph Markov Model,icml.cc/media/icml-2022/Slides/16216.pdf,proceedings.mlr.press/v162/castellana22a/castellana22a.pdf
647,Implicit Regularization in Hierarchical Tensor Factorization and Deep Convolutional Neural Networks,icml.cc/media/icml-2022/Slides/16018_xL30pIS.pdf,proceedings.mlr.press/v162/razin22a/razin22a.pdf
648,Matching Structure for Dual Learning,icml.cc/media/icml-2022/Slides/16006.pdf,proceedings.mlr.press/v162/fei22a/fei22a.pdf
649,Bayesian Nonparametrics for Offline Skill Discovery,icml.cc/media/icml-2022/Slides/16270.pdf,proceedings.mlr.press/v162/villecroze22a/villecroze22a.pdf
650,Equivariant Quantum Graph Circuits,icml.cc/media/icml-2022/Slides/16082.pdf,proceedings.mlr.press/v162/mernyei22a/mernyei22a.pdf
651,Differentially Private Community Detection for Stochastic Block Models,icml.cc/media/icml-2022/Slides/16780.pdf,proceedings.mlr.press/v162/mohamed22a/mohamed22a.pdf
652,A Tree-based Model Averaging Approach for Personalized Treatment Effect Estimation from Heterogeneous Data Sources,icml.cc/media/icml-2022/Slides/16612.pdf,proceedings.mlr.press/v162/tan22a/tan22a.pdf
653,"Synergy and Symmetry in Deep Learning: Interactions between the Data, Model, and Inference Algorithm",icml.cc/media/icml-2022/Slides/16698_ROEGd80.pdf,proceedings.mlr.press/v162/xiao22a/xiao22a.pdf
654,Molecular Representation Learning via Heterogeneous Motif Graph Neural Networks,icml.cc/media/icml-2022/Slides/17132.pdf,proceedings.mlr.press/v162/yu22a/yu22a.pdf
655,Implicit Bias of Linear Equivariant Networks,icml.cc/media/icml-2022/Slides/16544_Sv109cR.pdf,proceedings.mlr.press/v162/lawrence22a/lawrence22a.pdf
656,Understanding Clipping for Federated Learning: Convergence and Client-Level Differential Privacy,icml.cc/media/icml-2022/Slides/16804.pdf,proceedings.mlr.press/v162/zhang22b/zhang22b.pdf
657,The State of Sparse Training in Deep Reinforcement Learning,icml.cc/media/icml-2022/Slides/16714.pdf,proceedings.mlr.press/v162/graesser22a/graesser22a.pdf
658,Efficient Online ML API Selection for Multi-Label Classification Tasks,icml.cc/media/icml-2022/Slides/16688_ihsMij9.pdf,proceedings.mlr.press/v162/chen22ad/chen22ad.pdf
659,Detached Error Feedback for Distributed SGD with Random Sparsification,icml.cc/media/icml-2022/Slides/16508_j2w1OHr.pdf,proceedings.mlr.press/v162/xu22c/xu22c.pdf
660,Partial Label Learning via Label Influence Function,icml.cc/media/icml-2022/Slides/15976.pdf,proceedings.mlr.press/v162/gong22c/gong22c.pdf
661,Convergence of Policy Gradient for Entropy Regularized MDPs with Neural Network Approximation in the Mean-Field Regime,icml.cc/media/icml-2022/Slides/16286.pdf,proceedings.mlr.press/v162/leahy22a/leahy22a.pdf
662,A Theoretical Comparison of Graph Neural Network Extensions,icml.cc/media/icml-2022/Slides/16098.pdf,proceedings.mlr.press/v162/papp22a/papp22a.pdf
663,Estimation in Rotationally Invariant Generalized Linear Models via Approximate Message Passing,icml.cc/media/icml-2022/Slides/16164.pdf,proceedings.mlr.press/v162/venkataramanan22a/venkataramanan22a.pdf
664,Auxiliary Learning with Joint Task and Data Scheduling,icml.cc/media/icml-2022/Slides/17292_xchL02y.pdf,proceedings.mlr.press/v162/chen22y/chen22y.pdf
665,Curriculum Reinforcement Learning via Constrained Optimal Transport,icml.cc/media/icml-2022/Slides/16304.pdf,proceedings.mlr.press/v162/klink22a/klink22a.pdf
666,Minimax Classification under Concept Drift with Multidimensional Adaptation and Performance Guarantees,icml.cc/media/icml-2022/Slides/16094_xLRQJz7.pdf,proceedings.mlr.press/v162/alvarez22a/alvarez22a.pdf
667,YourTTS: Towards Zero-Shot Multi-Speaker TTS and Zero-Shot Voice Conversion for Everyone,icml.cc/media/icml-2022/Slides/16092_np5fq8L.pdf,proceedings.mlr.press/v162/casanova22a/casanova22a.pdf
668,Variational On-the-Fly Personalization,icml.cc/media/icml-2022/Slides/16110.pdf,proceedings.mlr.press/v162/kim22e/kim22e.pdf
669,Large-scale Stochastic Optimization of NDCG Surrogates for Deep Learning with Provable Convergence,icml.cc/media/icml-2022/Slides/17312_PtSvs8w.pdf,proceedings.mlr.press/v162/qiu22a/qiu22a.pdf
670,Hermite Polynomial Features for Private Data Generation,icml.cc/media/icml-2022/Slides/16814.pdf,proceedings.mlr.press/v162/vinaroz22a/vinaroz22a.pdf
671,Training OOD Detectors in their Natural Habitats,icml.cc/media/icml-2022/Slides/16530.pdf,proceedings.mlr.press/v162/katz-samuels22a/katz-samuels22a.pdf
672,Set Norm and Equivariant Skip Connections: Putting the Deep in Deep Sets,icml.cc/media/icml-2022/Slides/16894_i8cQdgw.pdf,proceedings.mlr.press/v162/zhang22ac/zhang22ac.pdf
673,Entropic Causal Inference: Graph Identifiability,icml.cc/media/icml-2022/Slides/16754_FlhU41Q.pdf,proceedings.mlr.press/v162/compton22a/compton22a.pdf
674,Architecture Agnostic Federated Learning for Neural Networks,icml.cc/media/icml-2022/Slides/16926.pdf,proceedings.mlr.press/v162/makhija22a/makhija22a.pdf
675,How to Steer Your Adversary: Targeted and Efficient Model Stealing Defenses with Gradient Redirection,icml.cc/media/icml-2022/Slides/16922_Qlem1nL.pdf,proceedings.mlr.press/v162/mazeika22a/mazeika22a.pdf
676,Datamodels: Understanding Predictions with Data and Data with Predictions,icml.cc/media/icml-2022/Slides/16972.pdf,proceedings.mlr.press/v162/ilyas22a/ilyas22a.pdf
677,Gating Dropout: Communication-efficient Regularization for Sparsely Activated Transformers,icml.cc/media/icml-2022/Slides/17416.pdf,proceedings.mlr.press/v162/liu22g/liu22g.pdf
678,Constrained Gradient Descent: A Powerful and Principled Evasion Attack Against Neural Networks,icml.cc/media/icml-2022/Slides/16716.pdf,proceedings.mlr.press/v162/lin22e/lin22e.pdf
679,Deep symbolic regression for recurrence prediction,icml.cc/media/icml-2022/Slides/16220_1gIXRPd.pdf,proceedings.mlr.press/v162/d-ascoli22a/d-ascoli22a.pdf
680,Regret Bounds for Stochastic Shortest Path Problems with Linear Function Approximation,icml.cc/media/icml-2022/Slides/16386.pdf,proceedings.mlr.press/v162/vial22a/vial22a.pdf
681,Recurrent Model-Free RL Can Be a Strong Baseline for Many POMDPs,icml.cc/media/icml-2022/Slides/16432.pdf,proceedings.mlr.press/v162/ni22a/ni22a.pdf
682,Understanding Robust Overfitting of Adversarial Training and Beyond,icml.cc/media/icml-2022/Slides/16154.pdf,proceedings.mlr.press/v162/yu22b/yu22b.pdf
683,Universal Joint Approximation of Manifolds and Densities by Simple Injective Flows,icml.cc/media/icml-2022/Slides/16428.pdf,proceedings.mlr.press/v162/puthawala22a/puthawala22a.pdf
684,Geometric Multimodal Contrastive Representation Learning,icml.cc/media/icml-2022/Slides/16228.pdf,proceedings.mlr.press/v162/poklukar22a/poklukar22a.pdf
685,Generalizing Gaussian Smoothing for Random Search,icml.cc/media/icml-2022/Slides/16434.pdf,proceedings.mlr.press/v162/gao22f/gao22f.pdf
686,Deduplicating Training Data Mitigates Privacy Risks in Language Models,icml.cc/media/icml-2022/Slides/17280_YD8oR2N.pdf,proceedings.mlr.press/v162/kandpal22a/kandpal22a.pdf
687,Revisiting and Advancing Fast Adversarial Training Through The Lens of Bi-Level Optimization,icml.cc/media/icml-2022/Slides/17272_MRQSpN2.pdf,proceedings.mlr.press/v162/zhang22ak/zhang22ak.pdf
688,SDQ: Stochastic Differentiable Quantization with Mixed Precision,icml.cc/media/icml-2022/Slides/16258.pdf,proceedings.mlr.press/v162/huang22h/huang22h.pdf
689,Neural Tangent Kernel Empowered Federated Learning,icml.cc/media/icml-2022/Slides/16732.pdf,proceedings.mlr.press/v162/yue22a/yue22a.pdf
690,Conformal Prediction Sets with Limited False Positives,icml.cc/media/icml-2022/Slides/17300.pdf,proceedings.mlr.press/v162/fisch22a/fisch22a.pdf
691,Hierarchical Shrinkage: Improving the accuracy and interpretability of tree-based models.,icml.cc/media/icml-2022/Slides/16830_sRTAhDI.pdf,proceedings.mlr.press/v162/agarwal22b/agarwal22b.pdf
692,A General Recipe for Likelihood-free Bayesian Optimization,icml.cc/media/icml-2022/Slides/16468.pdf,proceedings.mlr.press/v162/song22b/song22b.pdf
693,"IGLUE: A Benchmark for Transfer Learning across Modalities, Tasks, and Languages",icml.cc/media/icml-2022/Slides/16296.pdf,proceedings.mlr.press/v162/bugliarello22a/bugliarello22a.pdf
694,Scalable Computation of Causal Bounds,icml.cc/media/icml-2022/Slides/16298.pdf,proceedings.mlr.press/v162/shridharan22a/shridharan22a.pdf
695,Universality of Winning Tickets: A Renormalization Group Perspective,icml.cc/media/icml-2022/Slides/16284.pdf,proceedings.mlr.press/v162/redman22a/redman22a.pdf
696,Constrained Offline Policy Optimization,icml.cc/media/icml-2022/Slides/16570_YortKS6.pdf,proceedings.mlr.press/v162/polosky22a/polosky22a.pdf
697,Deep Causal Metric Learning,icml.cc/media/icml-2022/Slides/17252.pdf,proceedings.mlr.press/v162/deng22c/deng22c.pdf
698,Private frequency estimation via projective geometry,icml.cc/media/icml-2022/Slides/17330.pdf,proceedings.mlr.press/v162/feldman22a/feldman22a.pdf
699,The Poisson Binomial Mechanism for Unbiased Federated Learning with Secure Aggregation,icml.cc/media/icml-2022/Slides/17922_u8B84RF.pdf,proceedings.mlr.press/v162/chen22s/chen22s.pdf
700,Partial and Asymmetric Contrastive Learning for Out-of-Distribution Detection in Long-Tailed Recognition,icml.cc/media/icml-2022/Slides/16860_9OpKZdg.pdf,proceedings.mlr.press/v162/wang22aq/wang22aq.pdf
701,LIDL: Local Intrinsic Dimension Estimation Using Approximate Likelihood,icml.cc/media/icml-2022/Slides/18216.pdf,proceedings.mlr.press/v162/tempczyk22a/tempczyk22a.pdf
702,Causal Dynamics Learning for Task-Independent State Abstraction,icml.cc/media/icml-2022/Slides/16840_2CvH90r.pdf,proceedings.mlr.press/v162/wang22ae/wang22ae.pdf
703,Last Iterate Risk Bounds of SGD with Decaying Stepsize for Overparameterized Linear Regression,icml.cc/media/icml-2022/Slides/17038_RVAKqjT.pdf,proceedings.mlr.press/v162/wu22p/wu22p.pdf
704,Not All Poisons are Created Equal: Robust Training against Data Poisoning,icml.cc/media/icml-2022/Slides/17154.pdf,proceedings.mlr.press/v162/yang22j/yang22j.pdf
705,Supervised Learning with General Risk Functionals,icml.cc/media/icml-2022/Slides/16766_m7vWuQN.pdf,proceedings.mlr.press/v162/leqi22a/leqi22a.pdf
706,Feature Space Particle Inference for Neural Network Ensembles,icml.cc/media/icml-2022/Slides/16980_15Vidoa.pdf,proceedings.mlr.press/v162/yashima22a/yashima22a.pdf
707,Faster Privacy Accounting via Evolving Discretization,icml.cc/media/icml-2022/Slides/17466.pdf,proceedings.mlr.press/v162/ghazi22a/ghazi22a.pdf
708,Leveraging Approximate Symbolic Models for Reinforcement Learning via Skill Diversity,icml.cc/media/icml-2022/Slides/17382.pdf,proceedings.mlr.press/v162/guan22c/guan22c.pdf
709,Locally Sparse Neural Networks for Tabular Biomedical Data,icml.cc/media/icml-2022/Slides/16810.pdf,proceedings.mlr.press/v162/yang22i/yang22i.pdf
710,Learning Symmetric Embeddings for Equivariant World Models,icml.cc/media/icml-2022/Slides/17396.pdf,proceedings.mlr.press/v162/park22a/park22a.pdf
711,Risk-Averse No-Regret Learning in Online Convex Games,icml.cc/media/icml-2022/Slides/16588.pdf,proceedings.mlr.press/v162/wang22w/wang22w.pdf
712,Learning Pseudometric-based Action Representations for Offline Reinforcement Learning,icml.cc/media/icml-2022/Slides/17586.pdf,proceedings.mlr.press/v162/gu22b/gu22b.pdf
713,Loss Function Learning for Domain Generalization by Implicit Gradient,icml.cc/media/icml-2022/Slides/16426.pdf,proceedings.mlr.press/v162/gao22b/gao22b.pdf
714,A Statistical Manifold Framework for Point Cloud Data,icml.cc/media/icml-2022/Slides/17932.pdf,proceedings.mlr.press/v162/lee22d/lee22d.pdf
715,Efficient Learning of CNNs using Patch Based Features,icml.cc/media/icml-2022/Slides/17342.pdf,proceedings.mlr.press/v162/brutzkus22a/brutzkus22a.pdf
716,Dual Perspective of Label-Specific Feature Learning for Multi-Label Classification,icml.cc/media/icml-2022/Slides/16632.pdf,proceedings.mlr.press/v162/hang22a/hang22a.pdf
717,Reinforcement Learning with Action-Free Pre-Training from Videos,icml.cc/media/icml-2022/Slides/17410_VtDtB4a.pdf,proceedings.mlr.press/v162/seo22a/seo22a.pdf
718,Improve Single-Point Zeroth-Order Optimization Using High-Pass and Low-Pass Filters,icml.cc/media/icml-2022/Slides/16792_AYFN4Xs.pdf,proceedings.mlr.press/v162/chen22w/chen22w.pdf
719,A Study on the Ramanujan Graph Property of Winning Lottery Tickets,icml.cc/media/icml-2022/Slides/16786.pdf,proceedings.mlr.press/v162/pal22a/pal22a.pdf
720,Robust alignment of cross-session recordings of neural population activity by behaviour via unsupervised domain adaptation,icml.cc/media/icml-2022/Slides/16482.pdf,proceedings.mlr.press/v162/jude22a/jude22a.pdf
721,Accelerated Federated Learning with Decoupled Adaptive Optimization,icml.cc/media/icml-2022/Slides/17540.pdf,proceedings.mlr.press/v162/jin22e/jin22e.pdf
722,GraphFM: Improving Large-Scale GNN Training via Feature Momentum,icml.cc/media/icml-2022/Slides/16580.pdf,proceedings.mlr.press/v162/yu22g/yu22g.pdf
723,The Fundamental Price of Secure Aggregation in Differentially Private Federated Learning,icml.cc/media/icml-2022/Slides/17530_Bo3D3ZY.pdf,proceedings.mlr.press/v162/chen22c/chen22c.pdf
724,Byzantine Machine Learning Made Easy By Resilient Averaging of Momentums,icml.cc/media/icml-2022/Slides/17606.pdf,proceedings.mlr.press/v162/farhadkhani22a/farhadkhani22a.pdf
725,PAC-Net: A Model Pruning Approach to Inductive Transfer Learning,icml.cc/media/icml-2022/Slides/17176.pdf,proceedings.mlr.press/v162/myung22a/myung22a.pdf
726,HyperImpute: Generalized Iterative Imputation with Automatic Model Selection,icml.cc/media/icml-2022/Slides/17572.pdf,proceedings.mlr.press/v162/jarrett22a/jarrett22a.pdf
727,Generalization Guarantee of Training Graph Convolutional Networks with Graph Topology Sampling,icml.cc/media/icml-2022/Slides/16764.pdf,proceedings.mlr.press/v162/li22u/li22u.pdf
728,Neural Tangent Kernel Analysis of Deep Narrow Neural Networks,icml.cc/media/icml-2022/Slides/17536.pdf,proceedings.mlr.press/v162/lee22a/lee22a.pdf
729,Private Adaptive Optimization with Side information,icml.cc/media/icml-2022/Slides/17542.pdf,proceedings.mlr.press/v162/li22x/li22x.pdf
730,Symmetric Machine Theory of Mind,icml.cc/media/icml-2022/Slides/16608.pdf,proceedings.mlr.press/v162/sclar22a/sclar22a.pdf
731,Robust Multi-Objective Bayesian Optimization Under Input Noise,icml.cc/media/icml-2022/Slides/16838.pdf,proceedings.mlr.press/v162/daulton22a/daulton22a.pdf
732,Detecting Corrupted Labels Without Training a Model to Predict,icml.cc/media/icml-2022/Slides/17022.pdf,proceedings.mlr.press/v162/zhu22a/zhu22a.pdf
733,A Natural Actor-Critic Framework for Zero-Sum Markov Games,icml.cc/media/icml-2022/Slides/16710.pdf,proceedings.mlr.press/v162/alacaoglu22a/alacaoglu22a.pdf
734,EDEN: Communication-Efficient and Robust Distributed Mean Estimation for Federated Learning,icml.cc/media/icml-2022/Slides/17680.pdf,proceedings.mlr.press/v162/vargaftik22a/vargaftik22a.pdf
735,Prototype-Anchored Learning for Learning with Imperfect Annotations,icml.cc/media/icml-2022/Slides/17178.pdf,proceedings.mlr.press/v162/zhou22f/zhou22f.pdf
736,Delayed Reinforcement Learning by Imitation,icml.cc/media/icml-2022/Slides/18064.pdf,proceedings.mlr.press/v162/liotet22a/liotet22a.pdf
737,Secure Quantized Training for Deep Learning,icml.cc/media/icml-2022/Slides/17362.pdf,proceedings.mlr.press/v162/keller22a/keller22a.pdf
738,TSPipe: Learn from Teacher Faster with Pipelines,icml.cc/media/icml-2022/Slides/18108.pdf,proceedings.mlr.press/v162/lim22a/lim22a.pdf
739,Gradient-Free Method for Heavily Constrained Nonconvex Optimization,icml.cc/media/icml-2022/Slides/17462.pdf,proceedings.mlr.press/v162/shi22a/shi22a.pdf
740,A Differential Entropy Estimator for Training Neural Networks,icml.cc/media/icml-2022/Slides/16326.pdf,proceedings.mlr.press/v162/pichler22a/pichler22a.pdf
741,PLATON: Pruning Large Transformer Models with Upper Confidence Bound of Weight Importance,icml.cc/media/icml-2022/Slides/17018_GmtIazd.pdf,proceedings.mlr.press/v162/zhang22ao/zhang22ao.pdf
742,Reachability Constrained Reinforcement Learning,icml.cc/media/icml-2022/Slides/18134.pdf,proceedings.mlr.press/v162/yu22d/yu22d.pdf
743,Personalized Federated Learning through Local Memorization,icml.cc/media/icml-2022/Slides/18222.pdf,proceedings.mlr.press/v162/marfoq22a/marfoq22a.pdf
744,LCANets: Lateral Competition Improves Robustness Against Corruption and Attack,icml.cc/media/icml-2022/Slides/17160_tFzIpN7.pdf,proceedings.mlr.press/v162/teti22a/teti22a.pdf
745,Learning to Predict Graphs with Fused Gromov-Wasserstein Barycenters,icml.cc/media/icml-2022/Slides/18000.pdf,proceedings.mlr.press/v162/brogat-motte22a/brogat-motte22a.pdf
746,Private optimization in the interpolation regime: faster rates and hardness results,icml.cc/media/icml-2022/Slides/17982_7yhQyrM.pdf,proceedings.mlr.press/v162/asi22a/asi22a.pdf
747,Scaling Out-of-Distribution Detection for Real-World Settings,icml.cc/media/icml-2022/Slides/16908_VznmczL.pdf,proceedings.mlr.press/v162/hendrycks22a/hendrycks22a.pdf
748,Fully-Connected Network on Noncompact Symmetric Space and Ridgelet Transform based on Helgason-Fourier Analysis,icml.cc/media/icml-2022/Slides/17890.pdf,proceedings.mlr.press/v162/sonoda22a/sonoda22a.pdf
749,Fisher SAM: Information Geometry and Sharpness Aware Minimisation,icml.cc/media/icml-2022/Slides/17842.pdf,proceedings.mlr.press/v162/kim22f/kim22f.pdf
750,The power of first-order smooth optimization for black-box non-smooth problems,icml.cc/media/icml-2022/Slides/18128_vV5sNtU.pdf,proceedings.mlr.press/v162/gasnikov22a/gasnikov22a.pdf
751,Score-based Generative Modeling of Graphs via the System of Stochastic Differential Equations,icml.cc/media/icml-2022/Slides/18140.pdf,proceedings.mlr.press/v162/jo22a/jo22a.pdf
752,Three-stage Evolution and Fast Equilibrium for SGD with Non-degerate Critical Points,icml.cc/media/icml-2022/Slides/16528.pdf,proceedings.mlr.press/v162/wang22ab/wang22ab.pdf
753,Adaptive Model Design for Markov Decision Process,icml.cc/media/icml-2022/Slides/18318.pdf,proceedings.mlr.press/v162/chen22ab/chen22ab.pdf
754,Deep Safe Incomplete Multi-view Clustering: Theorem and Algorithm,icml.cc/media/icml-2022/Slides/18210.pdf,proceedings.mlr.press/v162/tang22c/tang22c.pdf
755,Differentially Private Coordinate Descent for Composite Empirical Risk Minimization,icml.cc/media/icml-2022/Slides/18090_GPVFYEP.pdf,proceedings.mlr.press/v162/mangold22a/mangold22a.pdf
756,Deep Networks on Toroids: Removing Symmetries Reveals the Structure of Flat Regions in the Landscape Geometry,icml.cc/media/icml-2022/Slides/17898_VSbJLuR.pdf,proceedings.mlr.press/v162/pittorino22a/pittorino22a.pdf
757,Non-Vacuous Generalisation Bounds for Shallow Neural Networks,icml.cc/media/icml-2022/Slides/17948.pdf,proceedings.mlr.press/v162/biggs22a/biggs22a.pdf
758,SPECTRE: Spectral Conditioning Helps to Overcome the Expressivity Limits of One-shot Graph Generators,icml.cc/media/icml-2022/Slides/18394_prUWMOu.pdf,proceedings.mlr.press/v162/martinkus22a/martinkus22a.pdf
759,Goal Misgeneralization in Deep Reinforcement Learning,icml.cc/media/icml-2022/Slides/18380.pdf,proceedings.mlr.press/v162/langosco22a/langosco22a.pdf
760,Saute RL: Almost Surely Safe Reinforcement Learning Using State Augmentation,icml.cc/media/icml-2022/Slides/16982.pdf,proceedings.mlr.press/v162/sootla22a/sootla22a.pdf
761,Towards Understanding Sharpness-Aware Minimization,icml.cc/media/icml-2022/Slides/18252.pdf,proceedings.mlr.press/v162/andriushchenko22a/andriushchenko22a.pdf
762,Optimization-Derived Learning with Essential Convergence Analysis of Training and Hyper-training,icml.cc/media/icml-2022/Slides/17660_PrpXhJE.pdf,proceedings.mlr.press/v162/liu22j/liu22j.pdf
763,"Neural Language Models are not Born Equal to Fit Brain Data, but Training Helps",icml.cc/media/icml-2022/Slides/18284.pdf,proceedings.mlr.press/v162/pasquiou22a/pasquiou22a.pdf
764,Translating Robot Skills: Learning Unsupervised Skill Correspondences Across Robots,icml.cc/media/icml-2022/Slides/16262_6J07rjH.pdf,proceedings.mlr.press/v162/shankar22a/shankar22a.pdf
765,Unsupervised Flow-Aligned Sequence-to-Sequence Learning for Video Restoration,icml.cc/media/icml-2022/Slides/16143.pdf,proceedings.mlr.press/v162/lin22d/lin22d.pdf
766,MAE-DET: Revisiting Maximum Entropy Principle in Zero-Shot NAS for Efficient Object Detection,icml.cc/media/icml-2022/Slides/16415_aThN57W.pdf,proceedings.mlr.press/v162/sun22c/sun22c.pdf
767,Tranception: Protein Fitness Prediction with Autoregressive Transformers and Inference-time Retrieval,icml.cc/media/icml-2022/Slides/18181.pdf,proceedings.mlr.press/v162/notin22a/notin22a.pdf
768,Examining Scaling and Transfer of Language Model Architectures for Machine Translation,icml.cc/media/icml-2022/Slides/17047.pdf,proceedings.mlr.press/v162/zhang22h/zhang22h.pdf
769,State Transition of Dendritic Spines Improves Learning of Sparse Spiking Neural Networks,icml.cc/media/icml-2022/Slides/17413.pdf,proceedings.mlr.press/v162/chen22ac/chen22ac.pdf
770,MemSR: Training Memory-efficient Lightweight Model for Image Super-Resolution,icml.cc/media/icml-2022/Slides/16085_CAvKgor.pdf,proceedings.mlr.press/v162/wu22f/wu22f.pdf
771,ROCK: Causal Inference Principles for Reasoning about Commonsense Causality,icml.cc/media/icml-2022/Slides/16471_R9X6Y4u.pdf,proceedings.mlr.press/v162/zhang22am/zhang22am.pdf
