uuid,title,slide_url,paper_url
1cb7d62d-75a4-45de-932e-ba8fd94ffa93,Domain Generalization with MixStyle,iclr.cc/media/iclr-2021/Slides/2738.pdf,openreview.net/pdf?id=6xHJ37MVxxp
11d17ca8-d6eb-4f91-8cd0-2e5c0e6474df,Wasserstein-2 Generative Networks,iclr.cc/media/iclr-2021/Slides/2664.pdf,openreview.net/pdf?id=bEoxzW_EXsa
52c9c257-9f44-413c-96b9-d409ae35587e,Neural Jump Ordinary Differential Equations: Consistent Continuous-Time Prediction and Filtering,iclr.cc/media/iclr-2021/Slides/3339.pdf,openreview.net/pdf?id=JFKR3WqwyXR
b15c41b9-7586-4c11-9aa8-54656386ad7e,QPLEX: Duplex Dueling Multi-Agent Q-Learning,iclr.cc/media/iclr-2021/Slides/3237.pdf,openreview.net/pdf?id=Rcmk0xxIQV
91bf4072-7818-40d5-a03c-c39a48b247f8,Mutual Information State Intrinsic Control,iclr.cc/media/iclr-2021/Slides/2723.pdf,openreview.net/pdf?id=OthEq8I5v1
c8b993c6-f4b8-4899-9a71-aeca06d46d8c,Does enhanced shape bias improve neural network robustness to common corruptions?,iclr.cc/media/iclr-2021/Slides/3235.pdf,openreview.net/pdf?id=yUxUNaj2Sl
317c5e6e-98ac-434b-8f7f-4b1cdb21fb20,SALD: Sign Agnostic Learning with Derivatives,iclr.cc/media/iclr-2021/Slides/3221.pdf,openreview.net/pdf?id=7EDgLu9reQD
baca3e81-22d5-4ea4-94e2-a34128e47ccc,Wasserstein Embedding for Graph Learning,iclr.cc/media/iclr-2021/Slides/3182.pdf,openreview.net/pdf?id=AAes_3W-2z
a578f956-0b84-4f52-a91f-3bbff42f8a5e,Learning N:M  Fine-grained Structured Sparse Neural Networks From Scratch,iclr.cc/media/iclr-2021/Slides/3174.pdf,openreview.net/pdf?id=K9bw7vqp_s
e12a705b-543b-4818-817f-7dd6baa5c981,LEAF: A Learnable Frontend for Audio Classification,iclr.cc/media/iclr-2021/Slides/2668.pdf,openreview.net/pdf?id=jM76BCb6F9m
39073a1f-77c4-484c-98d1-d6821e629b56,Gauge Equivariant Mesh CNNs: Anisotropic convolutions on geometric graphs,iclr.cc/media/iclr-2021/Slides/3367.pdf,openreview.net/pdf?id=Jnspzp-oIZE
1b98ec44-b87e-4a55-9cfc-39004d5de688,Towards Robust Neural Networks via Close-loop Control,iclr.cc/media/iclr-2021/Slides/2963.pdf,openreview.net/pdf?id=2AL06y9cDE-
1c216d07-915f-43f9-8628-231282db86ad,Randomized Ensembled Double Q-Learning: Learning Fast Without a Model,iclr.cc/media/iclr-2021/Slides/3320.pdf,openreview.net/pdf?id=AY8zfZm0tDd
4d03a553-f44c-4e2d-83a0-611e457ce50c,Rapid Neural Architecture Search by Learning to Generate Graphs from Datasets,iclr.cc/media/iclr-2021/Slides/3142.pdf,openreview.net/pdf?id=rkQuFUmUOg3
85499a5c-751a-4aa0-8bb8-6f7581419b4e,A Good Image Generator Is What You Need for High-Resolution Video Synthesis,iclr.cc/media/iclr-2021/Slides/2810.pdf,openreview.net/pdf?id=6puCSjH3hwA
a63866fd-b67f-4918-bcb1-b4d39e5e263e,PSTNet: Point Spatio-Temporal Convolution on Point Cloud Sequences,iclr.cc/media/iclr-2021/Slides/3101.pdf,openreview.net/pdf?id=O3bqkf_Puys
a22706d7-07da-4e95-9b7e-2a571ab3ccdb,WaNet - Imperceptible Warping-based Backdoor Attack,iclr.cc/media/iclr-2021/Slides/3087.pdf,openreview.net/pdf?id=eEn8KTtJOx
dcb9cafb-afe3-47e6-bd5d-a7f9c382bbfc,Implicit Normalizing Flows,iclr.cc/media/iclr-2021/Slides/2983.pdf,openreview.net/pdf?id=8PS8m9oYtNy
6d3cf4c6-d577-4cbc-b217-0afbed88be9b,Progressive Skeletonization: Trimming more fat from a network at initialization,iclr.cc/media/iclr-2021/Slides/2957.pdf,openreview.net/pdf?id=9GsFOUyUPi
7cb183c4-fc43-4d4b-bbc5-fce4e4ff0f3f,SaliencyMix: A Saliency Guided Data Augmentation Strategy for Better Regularization,iclr.cc/media/iclr-2021/Slides/2986.pdf,openreview.net/pdf?id=-M0QkvBGTTq
699a9723-490d-42ab-89a2-22665278da2a,On the Universality of the Double Descent Peak in Ridgeless Regression,iclr.cc/media/iclr-2021/Slides/2611.pdf,openreview.net/pdf?id=0IO5VdnSAaH
eb818cb6-2a20-4d5f-8792-d16284b28b2d,Rethinking the Role of Gradient-based Attribution Methods for Model Interpretability,iclr.cc/media/iclr-2021/Slides/2943.pdf,openreview.net/pdf?id=dYeAHXnpWJ4
f4b9a092-eb90-49f0-9d93-272731fa7ba4,What Can You Learn From Your Muscles? Learning Visual Representation from Human Interactions,iclr.cc/media/iclr-2021/Slides/2586.pdf,openreview.net/pdf?id=Qm8UNVCFdh
e07d8a2b-b663-42b7-a263-2b84c803d4a8,Scaling Symbolic Methods using Gradients for Neural Model Explanation,iclr.cc/media/iclr-2021/Slides/2581.pdf,openreview.net/pdf?id=V5j-jdoDDP
d2d4a9d9-84cf-4040-9c58-30e9ec45be26,Shape-Texture Debiased Neural Network Training,iclr.cc/media/iclr-2021/Slides/2870.pdf,openreview.net/pdf?id=Db4yerZTYkz
b275bba0-48fd-46b0-ab9b-766eba46743e,Multi-Time Attention Networks for Irregularly Sampled Time Series,iclr.cc/media/iclr-2021/Slides/2703.pdf,openreview.net/pdf?id=4c0J6lwQ4_
cb1ec4f1-bff3-4c62-bb6e-047d1a845ba0,"On the Stability of Fine-tuning BERT: Misconceptions, Explanations, and Strong Baselines",iclr.cc/media/iclr-2021/Slides/2558.pdf,openreview.net/pdf?id=nzpLWnVAyah
6f26412a-87cb-47f4-95ee-69d699c713f3,The Traveling Observer Model: Multi-task Learning Through Spatial Variable Embeddings,iclr.cc/media/iclr-2021/Slides/3007.pdf,openreview.net/pdf?id=qYda4oLEc1
808685a5-a25f-49d1-abd7-c068e78d4b93,Universal approximation power of deep residual neural networks via nonlinear control theory,iclr.cc/media/iclr-2021/Slides/3010.pdf,openreview.net/pdf?id=-IXhmY16R3M
c00d8f09-b548-4927-ac77-480937941812,Plan-Based Relaxed Reward Shaping for Goal-Directed Tasks,iclr.cc/media/iclr-2021/Slides/3020.pdf,openreview.net/pdf?id=w2Z2OwVNeK
e05cf7ec-1e75-4276-bcbe-f87f3aebabea,Single-Photon Image Classification,iclr.cc/media/iclr-2021/Slides/3024.pdf,openreview.net/pdf?id=CHLhSw9pSw8
99682ad5-6afa-449c-bca9-ff0cbff8af80,Training GANs with Stronger Augmentations via Contrastive Discriminator,iclr.cc/media/iclr-2021/Slides/2840.pdf,openreview.net/pdf?id=eo6U4CAwVmg
c350acb7-1d81-453c-ab85-1041dfc2ac7b,Language-Agnostic Representation Learning of Source Code from Structure and Context,iclr.cc/media/iclr-2021/Slides/2838.pdf,openreview.net/pdf?id=Xh5eMZVONGF
4f329f26-5dfc-44d0-a6a8-7ca89c2bb748,MoVie: Revisiting Modulated Convolutions for Visual Counting and Beyond,iclr.cc/media/iclr-2021/Slides/3071.pdf,openreview.net/pdf?id=8e6BrwU6AjQ
a82e2d73-0cac-4011-b07d-a19fe3be36dc,Revisiting Few-sample BERT Fine-tuning,iclr.cc/media/iclr-2021/Slides/2678.pdf,openreview.net/pdf?id=cO1IH43yUF
eb6c55e8-1342-46a7-8a62-344d19f1edb7,Overparameterisation and worst-case generalisation: friend or foe?,iclr.cc/media/iclr-2021/Slides/2683.pdf,openreview.net/pdf?id=jphnJNOwe36
ce590000-9cef-4ded-9fd6-66968f3d88ce,Into the Wild with AudioScope: Unsupervised Audio-Visual Separation of On-Screen Sounds,iclr.cc/media/iclr-2021/Slides/3161.pdf,openreview.net/pdf?id=MDsQkFP1Aw
3e433aa2-217e-4871-8ee2-42c2362cb444,Shapley Explanation Networks,iclr.cc/media/iclr-2021/Slides/3172.pdf,openreview.net/pdf?id=vsU0efpivw
cf7f1218-e7ec-4f2c-9387-0283fe7524cf,The role of Disentanglement in Generalisation,iclr.cc/media/iclr-2021/Slides/3173.pdf,openreview.net/pdf?id=qbH974jKUVy
94e7a408-7b63-490a-a663-aed2c751720e,Image Augmentation Is All You Need: Regularizing Deep Reinforcement Learning from Pixels,iclr.cc/media/iclr-2021/Slides/3188.pdf,openreview.net/pdf?id=GY6-6sTvGaf
359df19f-7905-4f65-88e4-f9a48cc35eef,Share or Not? Learning to Schedule Language-Specific Capacity for Multilingual Translation,iclr.cc/media/iclr-2021/Slides/3193.pdf,openreview.net/pdf?id=Wj4ODo0uyCF
dc586300-5844-49c1-ac99-daced52f27ec,Learning Structural Edits via Incremental Tree Transformations,iclr.cc/media/iclr-2021/Slides/3205.pdf,openreview.net/pdf?id=v9hAX77--cZ
49537bdc-b1ea-4827-8b43-5e5b8c9e06a9,Self-Supervised Policy Adaptation during Deployment,iclr.cc/media/iclr-2021/Slides/2761.pdf,openreview.net/pdf?id=o_V-MjyyGV_
96b77436-e971-4409-9625-9434e2291282,The Risks of Invariant Risk Minimization,iclr.cc/media/iclr-2021/Slides/2752.pdf,openreview.net/pdf?id=BbNIbVPJ-42
21ad4e45-de1e-4437-bf38-4ab596dc3dc9,PAC Confidence Predictions for Deep Neural Network Classifiers,iclr.cc/media/iclr-2021/Slides/3264.pdf,openreview.net/pdf?id=Qk-Wq5AIjpq
d6e26837-0ae6-44a0-a1d4-bd8e7f6d2554,The Intrinsic Dimension of Images and Its Impact on Learning,iclr.cc/media/iclr-2021/Slides/3230.pdf,openreview.net/pdf?id=XJk19XzGq2J
39bb420b-7f0b-4d64-9a52-a55c84c5c9cf,Learning Energy-Based Models by Diffusion Recovery Likelihood,iclr.cc/media/iclr-2021/Slides/3238.pdf,openreview.net/pdf?id=v_1Soh8QUNc
50ff2e46-655d-453d-a734-df961d1e754f,Remembering for the Right Reasons: Explanations Reduce Catastrophic Forgetting,iclr.cc/media/iclr-2021/Slides/2950.pdf,openreview.net/pdf?id=tHgJoMfy6nI
ba4ba095-2574-4d9b-a347-324ef1a4336a,Benefit of deep learning with non-convex noisy gradient descent: Provable excess risk bound and superiority to kernel methods,iclr.cc/media/iclr-2021/Slides/2725.pdf,openreview.net/pdf?id=2m0g1wEafh
06bc9545-03ef-4a65-9575-7aab85ac0d03, Decentralized Attribution of Generative Models,iclr.cc/media/iclr-2021/Slides/3321.pdf,openreview.net/pdf?id=_kxlwvhOodK
6255dd7a-ef56-484a-b995-665c8740c160,SOLAR: Sparse Orthogonal Learned and Random Embeddings,iclr.cc/media/iclr-2021/Slides/3284.pdf,openreview.net/pdf?id=fw-BHZ1KjxJ
e46cc5aa-fcf8-41bb-b921-52ed62db19a0,Deberta: Decoding-Enhanced Bert With Disentangled Attention,iclr.cc/media/iclr-2021/Slides/2562.pdf,openreview.net/pdf?id=XPZIaotutsD
34d14722-91a4-4eab-814c-4fcc3bad0e8d,Sequential Density Ratio Estimation for Simultaneous Optimization of Speed and Accuracy,iclr.cc/media/iclr-2021/Slides/3247.pdf,openreview.net/pdf?id=Rhsu5qD36cL
961a1b54-a86d-4e06-b6a6-fc173fb15d75,Robust Curriculum Learning: from clean label detection to noisy label self-correction,iclr.cc/media/iclr-2021/Slides/3000.pdf,openreview.net/pdf?id=lmTWnm3coJJ
0d7170a5-9ccc-4cbf-a378-6a7c3d46bb65,Representation Learning for Sequence Data with Deep Autoencoding Predictive Components,iclr.cc/media/iclr-2021/Slides/2825.pdf,openreview.net/pdf?id=Naqw7EHIfrv
76482af7-f202-45bc-87fe-d252f2c4f479,Random Feature Attention,iclr.cc/media/iclr-2021/Slides/3213.pdf,openreview.net/pdf?id=QtTKTdVrFBB
c22d83aa-e127-4b23-8f71-8d2faebdf070,When does preconditioning help or hurt generalization?,iclr.cc/media/iclr-2021/Slides/3104.pdf,openreview.net/pdf?id=S724o4_WB3
cf5b2b9b-6d3d-487e-b78c-8624cd6d5da6,Latent Skill Planning for Exploration and Transfer,iclr.cc/media/iclr-2021/Slides/3027.pdf,openreview.net/pdf?id=jXe91kq3jAq
54f0e682-1903-44b8-9e27-f7f3b27441db,Regularized Inverse Reinforcement Learning,iclr.cc/media/iclr-2021/Slides/2850.pdf,openreview.net/pdf?id=HgLO8yalfwc
225b1d2b-c692-4bd1-ada9-5391738b09ef,MONGOOSE: A Learnable LSH Framework for Efficient Neural Network Training,iclr.cc/media/iclr-2021/Slides/3277.pdf,openreview.net/pdf?id=wWK7yXkULyh
61fb7b9d-d4c0-469a-883f-725261da89a1,Zero-shot Synthesis with Group-Supervised Learning,iclr.cc/media/iclr-2021/Slides/3059.pdf,openreview.net/pdf?id=8wqCDnBmnrT
5070a7bc-76b1-44b6-ae93-103d15c61f81,Probing BERT in Hyperbolic Spaces,iclr.cc/media/iclr-2021/Slides/2905.pdf,openreview.net/pdf?id=17VnwXYZyhH
86acc2d7-6d67-49b4-a48a-40dd5bd9044e,Generalization in data-driven models of primary visual cortex,iclr.cc/media/iclr-2021/Slides/3042.pdf,openreview.net/pdf?id=Tp7kI90Htd
3644cb36-af50-4e75-a673-eb7af406b5e4,Large-width functional asymptotics for deep Gaussian neural networks,iclr.cc/media/iclr-2021/Slides/2635.pdf,openreview.net/pdf?id=0aW6lYOYB7d
341f28b5-64ee-4283-8c38-8d3d23ccf406,Sample-Efficient Automated Deep Reinforcement Learning,iclr.cc/media/iclr-2021/Slides/3206.pdf,openreview.net/pdf?id=hSjxQ3B7GWq
e44e403c-9a6b-4089-86a1-9e91690a364e,Generalized Multimodal ELBO,iclr.cc/media/iclr-2021/Slides/2632.pdf,openreview.net/pdf?id=5Y21V0RDBV
9f39a191-f42b-47ad-bab0-f8b53f978be6,Identifying nonlinear dynamical systems with multiple time scales and long-range dependencies,iclr.cc/media/iclr-2021/Slides/3338.pdf,openreview.net/pdf?id=_XYzwxPIQu6
7a842278-d65e-4b07-bc69-eb2d4ef0eba1,MiCE: Mixture of Contrastive Experts for Unsupervised Image Clustering,iclr.cc/media/iclr-2021/Slides/2882.pdf,openreview.net/pdf?id=gV3wdEOGy_V
71a964dd-83f4-4a66-a90f-22cab24ab2e9,Class Normalization for (Continual)? Generalized Zero-Shot Learning,iclr.cc/media/iclr-2021/Slides/3288.pdf,openreview.net/pdf?id=7pgFL2Dkyyy
b005add3-62a8-44ac-9710-37f51e8e42f7,A Distributional Approach to Controlled Text Generation,iclr.cc/media/iclr-2021/Slides/2796.pdf,openreview.net/pdf?id=jWkw45-9AbL
47ba2d46-b860-4352-a2ab-9683125a6b4e,Do 2D GANs Know 3D Shape? Unsupervised 3D Shape Reconstruction from 2D Image GANs,iclr.cc/media/iclr-2021/Slides/2881.pdf,openreview.net/pdf?id=FGqiDsBUKL0
54aa8934-98d7-47c6-a95b-548291323b3e,Contemplating Real-World Object Classification,iclr.cc/media/iclr-2021/Slides/2746.pdf,openreview.net/pdf?id=Q4EUywJIkqr
90c589b0-4e54-4aca-8f10-00627c83eeb9,Efficient Certified Defenses Against Patch Attacks on Image Classifiers,iclr.cc/media/iclr-2021/Slides/2629.pdf,openreview.net/pdf?id=hr-3PMvDpil
9fea4cad-8393-42ae-acc3-256fba756a0c,SkipW: Resource Adaptable RNN with Strict Upper Computational Limit,iclr.cc/media/iclr-2021/Slides/3160.pdf,openreview.net/pdf?id=2CjEVW-RGOJ
69b9506b-c238-4b26-ad03-eba933e73bc1,Bayesian Context Aggregation for Neural Processes,iclr.cc/media/iclr-2021/Slides/3148.pdf,openreview.net/pdf?id=ufZN2-aehFa
37bb6a1f-ea33-4e3c-ad0a-1cf7086ae45a,Scaling the Convex Barrier with Active Sets,iclr.cc/media/iclr-2021/Slides/3035.pdf,openreview.net/pdf?id=uQfOy7LrlTR
5be10764-a2c7-475e-bc97-f493fbfd195a,PDE-Driven Spatiotemporal Disentanglement,iclr.cc/media/iclr-2021/Slides/3233.pdf,openreview.net/pdf?id=vLaHRtHvfFp
eb4d92a8-b38e-49f7-ad97-cd6b0dc789d7,Effective Abstract Reasoning with Dual-Contrast Network,iclr.cc/media/iclr-2021/Slides/2833.pdf,openreview.net/pdf?id=ldxlzGYWDmW
89192431-e66a-4374-bf0c-2bc47b4cf485,Complex Query Answering with Neural Link Predictors,iclr.cc/media/iclr-2021/Slides/3140.pdf,openreview.net/pdf?id=Mos9F9kDwkz
528008f7-780f-4e9f-a58e-845bdfd7fda9,Capturing Label Characteristics in VAEs,iclr.cc/media/iclr-2021/Slides/3121.pdf,openreview.net/pdf?id=wQRlSUZ5V7B
f34eaa43-fbc8-4b70-bafd-1a59041b5983,Policy-Driven Attack: Learning to Query for Hard-label Black-box Adversarial Examples,iclr.cc/media/iclr-2021/Slides/2823.pdf,openreview.net/pdf?id=pzpytjk3Xb2
437ee53d-4ae9-4b98-b0da-58ec063a0339,Group Equivariant Stand-Alone Self-Attention For Vision,iclr.cc/media/iclr-2021/Slides/3118.pdf,openreview.net/pdf?id=JkfYjnOEo6M
9c0afd4c-edda-40f6-90cd-555d1ee60bcd,Lossless Compression of Structured Convolutional Models via Lifting,iclr.cc/media/iclr-2021/Slides/2929.pdf,openreview.net/pdf?id=oxnp2q-PGL4
8e5aa555-9a8b-4e90-82f8-9828951f39cd,Exemplary Natural Images Explain CNN Activations Better than State-of-the-Art Feature Visualization,iclr.cc/media/iclr-2021/Slides/3153.pdf,openreview.net/pdf?id=QO9-y8also-
117529c3-cc85-4d43-b7a8-5e57d352ea55,Disambiguating Symbolic Expressions in Informal Documents,iclr.cc/media/iclr-2021/Slides/2931.pdf,openreview.net/pdf?id=K5j7D81ABvt
becf8ad1-8ffb-480a-9899-7b2a7c529d0e,Unsupervised Object Keypoint Learning using Local Spatial Predictability,iclr.cc/media/iclr-2021/Slides/3023.pdf,openreview.net/pdf?id=GJwMHetHc73
d22d2b43-8448-4a43-82eb-99787aee0053,Tent: Fully Test-Time Adaptation by Entropy Minimization,iclr.cc/media/iclr-2021/Slides/2874.pdf,openreview.net/pdf?id=uXl3bZLkr3c
a43bf950-896c-4d27-93c6-bd4994e313ed,Quantifying Differences in Reward Functions,iclr.cc/media/iclr-2021/Slides/3348.pdf,openreview.net/pdf?id=LwEQnp6CYev
9137de0d-cb14-4609-9446-5c8dccb7d9be,Representation Learning via Invariant Causal Mechanisms,iclr.cc/media/iclr-2021/Slides/3350.pdf,openreview.net/pdf?id=9p2ekP904Rs
645ab8d3-6c84-4cad-86f0-3eeac4cf4068,Large Associative Memory Problem in Neurobiology and Machine Learning,iclr.cc/media/iclr-2021/Slides/2695.pdf,openreview.net/pdf?id=X4y_10OX-hX
af41dd60-e8e3-4ea7-96ed-a933cbd1352e,Rank the Episodes: A Simple Approach for Exploration in Procedurally-Generated Environments,iclr.cc/media/iclr-2021/Slides/2671.pdf,openreview.net/pdf?id=MtEE0CktZht
b149b820-71b9-4def-9738-d1038bcd5015,Direction Matters: On the Implicit Bias of Stochastic Gradient Descent with Moderate Learning Rate,iclr.cc/media/iclr-2021/Slides/2821.pdf,openreview.net/pdf?id=3X64RLgzY6O
0c6602ec-2303-4607-ae47-1bb1ca926d98,Recurrent Independent Mechanisms,iclr.cc/media/iclr-2021/Slides/3224.pdf,openreview.net/pdf?id=mLcmdlEUxy-
af56ef22-2368-48c0-b7a1-9ad77995b413,VAEBM: A Symbiosis between Variational Autoencoders and Energy-based Models,iclr.cc/media/iclr-2021/Slides/2615.pdf,openreview.net/pdf?id=5m3SEczOV8L
3bebda1b-fafc-480b-8c8a-f08c490709c1,Sharper Generalization Bounds for Learning with Gradient-dominated Objective Functions,iclr.cc/media/iclr-2021/Slides/3141.pdf,openreview.net/pdf?id=r28GdiQF7vM
74314432-b87e-4aff-b76e-d6b6f92cad50,Shape or Texture: Understanding Discriminative Features in CNNs,iclr.cc/media/iclr-2021/Slides/3180.pdf,openreview.net/pdf?id=NcFEZOi-rLa
2d1305db-3614-4025-b6af-b4583df59d54,DC3: A learning method for optimization with hard constraints,iclr.cc/media/iclr-2021/Slides/2868.pdf,openreview.net/pdf?id=V1ZHVxJ6dSS
4e63ba43-ac62-41c9-8c78-148351b4d284,DINO: A Conditional Energy-Based GAN for Domain Translation,iclr.cc/media/iclr-2021/Slides/3166.pdf,openreview.net/pdf?id=WAISmwsqDsb
0e037476-3221-4084-a925-70f7480be789,Robust Pruning at Initialization,iclr.cc/media/iclr-2021/Slides/2902.pdf,openreview.net/pdf?id=vXj_ucZQ4hA
5bd5db66-0871-40df-a3d7-6d7d7546cb48,The geometry of integration in text classification RNNs,iclr.cc/media/iclr-2021/Slides/2576.pdf,openreview.net/pdf?id=42kiJ7n_8xO
40c40996-0ec1-4420-b682-877b11a7d22b,Systematic generalisation with group invariant predictions,iclr.cc/media/iclr-2021/Slides/2649.pdf,openreview.net/pdf?id=b9PoimzZFJ
fbe37a69-15da-454e-949a-5e7bb8022565,Are wider nets better given the same number of parameters?,iclr.cc/media/iclr-2021/Slides/2643.pdf,openreview.net/pdf?id=_zx8Oka09eF
430391c1-e721-4874-9862-51343e67869d,Reducing the Computational Cost of Deep Generative Models with Binary Neural Networks,iclr.cc/media/iclr-2021/Slides/2946.pdf,openreview.net/pdf?id=sTeoJiB4uR
b6df4ea4-7dbb-4983-a9ee-bb08d9f8cd8a,Text Generation by Learning from Demonstrations,iclr.cc/media/iclr-2021/Slides/2765.pdf,openreview.net/pdf?id=RovX-uQ1Hua
64e8de28-b6e5-4e13-8659-16e8225ba884,Towards Resolving the Implicit Bias of Gradient Descent for Matrix Factorization: Greedy Low-Rank Learning,iclr.cc/media/iclr-2021/Slides/3291.pdf,openreview.net/pdf?id=AHOs7Sm5H7R
bfdddfc2-6187-4b38-a46d-aac0a8aaea9c,Fourier Neural Operator for Parametric Partial Differential Equations,iclr.cc/media/iclr-2021/Slides/3281.pdf,openreview.net/pdf?id=c8P9NQVtmnO
f05c2b91-9b06-4724-b633-1235006c4e0a,Deep Equals Shallow for ReLU Networks in Kernel Regimes,iclr.cc/media/iclr-2021/Slides/2645.pdf,openreview.net/pdf?id=aDjoksTpXOP
2eccf060-8e7a-4b94-8c8e-4448ebd63fee,Diverse Video Generation using a Gaussian Process Trigger,iclr.cc/media/iclr-2021/Slides/2565.pdf,openreview.net/pdf?id=Qm7R_SdqTpT
311254ea-5de2-48bd-94e0-d3f20857941c,A Discriminative Gaussian Mixture Model with Sparsity,iclr.cc/media/iclr-2021/Slides/3362.pdf,openreview.net/pdf?id=-_Zp7r2-cGK
4736dfa3-6036-4b9b-843e-4edfa919f663,Universal Weakly Supervised Segmentation by Pixel-to-Segment Contrastive Learning,iclr.cc/media/iclr-2021/Slides/3167.pdf,openreview.net/pdf?id=N33d7wjgzde
d1fdf73b-4c4c-49cc-838c-067f8badfbdf,Drop-Bottleneck: Learning Discrete Compressed Representation for Noise-Robust Exploration,iclr.cc/media/iclr-2021/Slides/3127.pdf,openreview.net/pdf?id=1rxHOBjeDUW
91b3683a-087c-4cfb-826e-80190f0905df,DrNAS: Dirichlet Neural Architecture Search,iclr.cc/media/iclr-2021/Slides/3124.pdf,openreview.net/pdf?id=9FWas6YbmB3
cd58b7d5-ac0c-4662-81e4-4487b4aa1eb6,Lipschitz Recurrent Neural Networks,iclr.cc/media/iclr-2021/Slides/3112.pdf,openreview.net/pdf?id=-N7PBXqOUJZ
d9632edc-0376-4a8b-bf50-f1bd6f05943b,Can a Fruit Fly Learn Word Embeddings?,iclr.cc/media/iclr-2021/Slides/3085.pdf,openreview.net/pdf?id=xfmSoxdxFCG
329fb514-1752-4ec0-a5f7-3e43e76d14ac,On Graph Neural Networks versus Graph-Augmented MLPs,iclr.cc/media/iclr-2021/Slides/3074.pdf,openreview.net/pdf?id=tiqI7w64JG2
3f5f4763-4931-4fe5-aa63-b012a69cba82,SEDONA: Search for Decoupled Neural Networks toward Greedy Block-wise Learning,iclr.cc/media/iclr-2021/Slides/2972.pdf,openreview.net/pdf?id=XLfdzwNKzch
7d212ef0-6ff5-4b91-8941-749dac9e7589,Topology-Aware Segmentation Using Discrete Morse Theory,iclr.cc/media/iclr-2021/Slides/2910.pdf,openreview.net/pdf?id=LGgdb4TS4Z
ba8da05a-00ff-408e-855b-2f3a24d48384,Implicit Convex Regularizers of CNN Architectures: Convex Optimization of Two- and Three-Layer Networks in Polynomial Time,iclr.cc/media/iclr-2021/Slides/3039.pdf,openreview.net/pdf?id=0N8jUH4JMv6
42e7a08c-336d-48ea-9d13-68ed43fbcfb6,Fuzzy Tiling Activations: A Simple Approach to Learning Sparse Representations Online,iclr.cc/media/iclr-2021/Slides/2951.pdf,openreview.net/pdf?id=zElset1Klrp
f0ee054c-9949-4b44-9214-764b9dbdfae6,Usable Information and Evolution of Optimal Representations During Training,iclr.cc/media/iclr-2021/Slides/2864.pdf,openreview.net/pdf?id=p8agn6bmTbr
8d5ec243-120b-4a54-9240-644027fb6670,Autoregressive Dynamics Models for Offline Policy Evaluation and Optimization,iclr.cc/media/iclr-2021/Slides/2845.pdf,openreview.net/pdf?id=kmqjgSNXby
cb811aa5-a719-45fb-a916-7e047159ace2,Hierarchical Autoregressive Modeling for Neural Video Compression,iclr.cc/media/iclr-2021/Slides/2626.pdf,openreview.net/pdf?id=TK_6nNb_C7q
ae1453be-e018-496d-8f67-a0bfbd315107,Mirostat: A Neural Text Decoding Algorithm That Directly Controls Perplexity,iclr.cc/media/iclr-2021/Slides/2700.pdf,openreview.net/pdf?id=W1G1JZEIy5_
dfed233f-6e47-40a2-a2d7-2bdf7444f76d,The Importance of Pessimism in Fixed-Dataset Policy Optimization,iclr.cc/media/iclr-2021/Slides/2655.pdf,openreview.net/pdf?id=E3Ys6a1NTGT
ceccbd16-46e2-418c-9aab-66b42e43544d,Debiasing Concept-based Explanations with Causal Analysis,iclr.cc/media/iclr-2021/Slides/2732.pdf,openreview.net/pdf?id=6puUoArESGp
41e43a71-18ff-4fe8-8294-f5422ac0625c,Differentiable Segmentation of Sequences,iclr.cc/media/iclr-2021/Slides/2993.pdf,openreview.net/pdf?id=4T489T4yav
52004ca0-d7ba-4345-9e20-5eb693a4de2a,Expressive Power of Invariant and Equivariant Graph Neural Networks,iclr.cc/media/iclr-2021/Slides/2559.pdf,openreview.net/pdf?id=lxHgXYN4bwl
ba6a3666-1e2f-4876-ae87-11511f62090c,Robust Learning of Fixed-Structure Bayesian Networks in Nearly-Linear Time,iclr.cc/media/iclr-2021/Slides/3328.pdf,openreview.net/pdf?id=euDnVs0Ynts
df5ad565-b26d-4f79-bc66-35e84d2d6150,Improving Relational Regularized Autoencoders with Spherical Sliced Fused Gromov Wasserstein,iclr.cc/media/iclr-2021/Slides/2980.pdf,openreview.net/pdf?id=DiQD7FWL233
1d19a581-d35f-4fac-b8c3-ed286689481c,Neural Delay Differential Equations,iclr.cc/media/iclr-2021/Slides/3120.pdf,openreview.net/pdf?id=Q1jmmQz72M2
9f994162-ee9e-407e-aa77-5c985c67ea67,Neural ODE Processes,iclr.cc/media/iclr-2021/Slides/2925.pdf,openreview.net/pdf?id=27acGyyI1BY
02970a1c-6920-4a9c-93eb-dfb7685b4592,Graph Edit Networks,iclr.cc/media/iclr-2021/Slides/3122.pdf,openreview.net/pdf?id=dlEJsyHGeaL
05a167b6-86b3-4022-bce9-110c2d9dca5f,Return-Based Contrastive Representation Learning for Reinforcement  Learning,iclr.cc/media/iclr-2021/Slides/3151.pdf,openreview.net/pdf?id=_TM6rT7tXke
67f3e3b8-1542-4f5e-ab75-ceaf7e2ef497,Removing Undesirable Feature Contributions Using Out-of-Distribution Data,iclr.cc/media/iclr-2021/Slides/2608.pdf,openreview.net/pdf?id=eIHYL6fpbkA
ea685767-abed-49ed-9dd4-1de277f57847,Interpretable Neural Architecture Search via Bayesian Optimisation with Weisfeiler-Lehman Kernels,iclr.cc/media/iclr-2021/Slides/3361.pdf,openreview.net/pdf?id=j9Rv7qdXjd
75306213-238d-4e10-aebb-6095ec6ff5f6,Bag of Tricks for Adversarial Training,iclr.cc/media/iclr-2021/Slides/2754.pdf,openreview.net/pdf?id=Xb8xvrtB8Ce
c08f613c-5f67-4144-8afc-9c022c38f303,"A Panda? No, It's a Sloth: Slowdown Attacks on Adaptive Multi-Exit Neural Network Inference",iclr.cc/media/iclr-2021/Slides/3283.pdf,openreview.net/pdf?id=9xC2tWEwBD
a9f956a6-f461-4310-b441-9fcb8a4cbf6e,Efficient Continual Learning with Modular Networks and Task-Driven Priors,iclr.cc/media/iclr-2021/Slides/3040.pdf,openreview.net/pdf?id=EKV158tSfwv
d1cdcfcc-3583-466b-be8e-02d710602b8a, Dance Revolution: Long-Term Dance Generation with Music via Curriculum Learning,iclr.cc/media/iclr-2021/Slides/3263.pdf,openreview.net/pdf?id=xGZG2kS5bFk
fb7ae90f-da01-47bf-a47c-74964bcf7ebf,Negative Data Augmentation ,iclr.cc/media/iclr-2021/Slides/2546.pdf,openreview.net/pdf?id=Ovp8dvB8IBH
a878da4b-6b0d-402a-b74b-2b84def5a773,Deployment-Efficient Reinforcement Learning via Model-Based Offline Optimization,iclr.cc/media/iclr-2021/Slides/3081.pdf,openreview.net/pdf?id=3hGNqpI4WS
446a4610-dc87-4b5e-8df1-3e226271e3f5,You Only Need Adversarial Supervision for Semantic Image Synthesis,iclr.cc/media/iclr-2021/Slides/2686.pdf,openreview.net/pdf?id=yvQKLaqNE6M
09eae552-c849-4045-9629-1aa3abb58c5c,Long-tail learning via logit adjustment,iclr.cc/media/iclr-2021/Slides/2675.pdf,openreview.net/pdf?id=37nvvqkCo5
0043dfe5-79ec-4efe-8a88-501259ecbb64,Multiplicative Filter Networks,iclr.cc/media/iclr-2021/Slides/3198.pdf,openreview.net/pdf?id=OmtmcPkkhT
8a124540-43ac-4213-a9c8-6c9b2a50ffaa,Learning Task-General Representations with Generative Neuro-Symbolic Modeling,iclr.cc/media/iclr-2021/Slides/3058.pdf,openreview.net/pdf?id=qzBUIzq5XR2
003dc682-bfbf-4fe9-a164-f0be2404d95b,Average-case Acceleration for Bilinear Games and Normal Matrices,iclr.cc/media/iclr-2021/Slides/3051.pdf,openreview.net/pdf?id=H0syOoy3Ash
f9f0b4f4-2a7d-445b-8705-0a1a3810b41c,Continuous Wasserstein-2 Barycenter Estimation without Minimax Optimization,iclr.cc/media/iclr-2021/Slides/2713.pdf,openreview.net/pdf?id=3tFAs5E-Pe
effaa623-6f00-4e3a-8828-26a78c7e21ce,Pre-training Text-to-Text Transformers for Concept-centric Common Sense,iclr.cc/media/iclr-2021/Slides/3272.pdf,openreview.net/pdf?id=3k20LAiHYL2
