uuid,title,slide_url,paper_url
772d2e9c-84ce-4386-a796-579e99940f19,Differentiable Trust Region Layers for Deep Reinforcement Learning,iclr.cc/media/iclr-2021/Slides/2985.pdf,openreview.net/pdf?id=qYZD-AO1Vn
81e1661f-e7d7-447d-9bea-e21474a2c4ac,Learning advanced mathematical computations from examples,iclr.cc/media/iclr-2021/Slides/3219.pdf,openreview.net/pdf?id=-gfhS00XfKj
88e3a403-0913-4dd6-b019-d4195949ba86,Perceptual Adversarial Robustness: Defense Against Unseen Threat Models,iclr.cc/media/iclr-2021/Slides/2860.pdf,openreview.net/pdf?id=dFwBosAcJkN
718a494d-32c4-4599-a623-43407959cde9,Are Neural Nets Modular? Inspecting Functional Modularity Through Differentiable Weight Masks,iclr.cc/media/iclr-2021/Slides/3200.pdf,openreview.net/pdf?id=7uVcpu-gMD
65589450-2cec-4ea0-bbf0-78c06c2a0f1f,Anytime Sampling for Autoregressive Models via Ordered Autoencoding,iclr.cc/media/iclr-2021/Slides/3304.pdf,openreview.net/pdf?id=TSRTzJnuEBS
567dc0f3-e3e5-44aa-8edc-41ab2cff6bca,Watch-And-Help: A Challenge for Social Perception and Human-AI Collaboration,iclr.cc/media/iclr-2021/Slides/2798.pdf,openreview.net/pdf?id=w_7JMpGZRh0
d577eaa5-4dbc-44ce-9c81-7566690ecd3c,Multivariate Probabilistic Time Series Forecasting via Conditioned Normalizing Flows,iclr.cc/media/iclr-2021/Slides/3117.pdf,openreview.net/pdf?id=WiGQBFuVRv
c684a910-1feb-4f66-8650-53f3d6adc4b2,Iterated learning for emergent systematicity in VQA,iclr.cc/media/iclr-2021/Slides/3302.pdf,openreview.net/pdf?id=Pd_oMxH8IlF
65080dbe-904a-49f7-a794-944e1efb9664,On the Bottleneck of Graph Neural Networks and its Practical Implications,iclr.cc/media/iclr-2021/Slides/2575.pdf,openreview.net/pdf?id=i80OPhOCVH2
ae2de953-b106-44d9-aaf0-9bbd6c09da35,Coupled Oscillatory Recurrent Neural Network (coRNN): An accurate and (gradient) stable architecture for learning long time dependencies,iclr.cc/media/iclr-2021/Slides/3335.pdf,openreview.net/pdf?id=F3s69XzWOia
e6c44f60-d704-4c84-bfa2-e393032a4272,IsarStep: a Benchmark for High-level Mathematical Reasoning,iclr.cc/media/iclr-2021/Slides/3049.pdf,openreview.net/pdf?id=Pzj6fzU6wkj
d3e4f526-cfad-4e58-b8ef-dc54d86aefea,Entropic gradient descent algorithms and wide flat minima,iclr.cc/media/iclr-2021/Slides/2728.pdf,openreview.net/pdf?id=xjXg0bnoDmS
11dab943-a6eb-4423-801b-836e66c9ecca,Self-supervised Visual Reinforcement Learning with Object-centric Representations,iclr.cc/media/iclr-2021/Slides/3331.pdf,openreview.net/pdf?id=xppLmXCbOw1
802124f7-271e-47ca-ae23-47b7a087db33,Federated Learning via Posterior Averaging: A New Perspective and Practical Algorithms,iclr.cc/media/iclr-2021/Slides/2670.pdf,openreview.net/pdf?id=GFsU8a0sGB
d3e92f27-bbb8-417c-a168-2c01014fac3a,OPAL: Offline Primitive Discovery for Accelerating Offline Reinforcement Learning,iclr.cc/media/iclr-2021/Slides/3234.pdf,openreview.net/pdf?id=V69LGwJ0lIN
5890b400-0afc-43ae-a7da-9ba641f1830c,Faster Binary Embeddings for Preserving Euclidean Distances,iclr.cc/media/iclr-2021/Slides/3243.pdf,openreview.net/pdf?id=YCXrx6rRCXO
be134def-2830-483d-973a-887eaaa7b2f7,Learning to Represent Action Values as a Hypergraph on the Action Vertices,iclr.cc/media/iclr-2021/Slides/2731.pdf,openreview.net/pdf?id=Xv_s64FiXTv
c8e19305-9325-40d2-a561-1252db705703,Learning to Deceive Knowledge Graph Augmented Models via Targeted Perturbation,iclr.cc/media/iclr-2021/Slides/2769.pdf,openreview.net/pdf?id=b7g3_ZMHnT0
b50f56bb-3699-4418-b365-1457f76033fc,A Geometric Analysis of Deep Generative Image Models and Its Applications,iclr.cc/media/iclr-2021/Slides/3366.pdf,openreview.net/pdf?id=GH7QRzUDdXG
29529666-7f55-473f-a819-b9353803a3fd,CPR: Classifier-Projection Regularization for Continual Learning,iclr.cc/media/iclr-2021/Slides/3353.pdf,openreview.net/pdf?id=F2v4aqEL6ze
b15d259b-c23e-49be-83c4-299a92c943f0,CoCo: Controllable Counterfactuals for Evaluating Dialogue State Trackers,iclr.cc/media/iclr-2021/Slides/3227.pdf,openreview.net/pdf?id=eom0IUrF__F
c747f295-9d82-4898-b853-66427155ffb9,Simple Augmentation Goes a Long Way: ADRL for DNN Quantization,iclr.cc/media/iclr-2021/Slides/3162.pdf,openreview.net/pdf?id=Qr0aRliE_Hb
f802cc0c-be39-4391-ba0a-c6f89fe5426a,"Deep Encoder, Shallow Decoder: Reevaluating Non-autoregressive Machine Translation",iclr.cc/media/iclr-2021/Slides/3096.pdf,openreview.net/pdf?id=KpfasTaLUpq
6605144d-42ae-43c6-8ac4-eef50ab810df,Evaluations and Methods for Explanation through Robustness Analysis,iclr.cc/media/iclr-2021/Slides/3083.pdf,openreview.net/pdf?id=4dXmpCDGNp7
ca333865-7d8e-48c2-bb7f-96515ec6b552,BERTology Meets Biology: Interpreting Attention in Protein Language Models,iclr.cc/media/iclr-2021/Slides/3057.pdf,openreview.net/pdf?id=YWtLZvLmud7
77acd2f9-2d50-4d3d-b0cc-7940fe65e4a9,AutoLRS: Automatic Learning-Rate Schedule by Bayesian Optimization on the Fly,iclr.cc/media/iclr-2021/Slides/3054.pdf,openreview.net/pdf?id=SlrqM9_lyju
9b7001b7-67ee-46b7-aae4-440774d9910d,In-N-Out: Pre-Training and Self-Training using Auxiliary Information for Out-of-Distribution Robustness,iclr.cc/media/iclr-2021/Slides/2947.pdf,openreview.net/pdf?id=jznizqvr15J
f7b5696b-46df-4ffc-8c4e-27ffec8cce44,Adaptive Universal Generalized PageRank Graph Neural Network,iclr.cc/media/iclr-2021/Slides/2940.pdf,openreview.net/pdf?id=n6jl7fLxrP
635a3791-09d5-4d09-92a0-11d48ceeca1d,Efficient Wasserstein Natural Gradients for Reinforcement Learning,iclr.cc/media/iclr-2021/Slides/2903.pdf,openreview.net/pdf?id=OHgnfSrn2jv
09e79ac0-431a-4e54-9415-608082017f6b,Neural Architecture Search on ImageNet in Four GPU Hours: A Theoretically Inspired Perspective,iclr.cc/media/iclr-2021/Slides/2816.pdf,openreview.net/pdf?id=Cnon5ezMHtu
3d25cc9f-4cdc-4a92-8d4c-f24ceddcc555,Efficient Reinforcement Learning in Factored MDPs with Application to Constrained RL,iclr.cc/media/iclr-2021/Slides/2756.pdf,openreview.net/pdf?id=fmtSg8591Q
7acb376d-914f-401c-8305-20f22c59ae63,Learning with Instance-Dependent Label Noise: A Sample Sieve Approach,iclr.cc/media/iclr-2021/Slides/2755.pdf,openreview.net/pdf?id=2VXyy9mIyU3
92866b4f-998c-4b52-afa0-49ad569556e1,Empirical or Invariant Risk Minimization? A Sample Complexity Perspective,iclr.cc/media/iclr-2021/Slides/2580.pdf,openreview.net/pdf?id=jrA5GAccy_
dfa92229-908d-48b0-b190-4674e756c4aa,Graph-Based Continual Learning,iclr.cc/media/iclr-2021/Slides/2524.pdf,openreview.net/pdf?id=HHSEKOnPvaO
062cc4ac-7bb5-4688-be84-65d3e9f091e6,Is Attention Better Than Matrix Decomposition?,iclr.cc/media/iclr-2021/Slides/3364.pdf,openreview.net/pdf?id=1FvkSpWosOl
f7e60f5b-f4ed-470e-aeb1-05e2c0438371,Evolving Reinforcement Learning Algorithms,iclr.cc/media/iclr-2021/Slides/3056.pdf,openreview.net/pdf?id=0XXpJ4OtjW
bee35ab7-e240-4f50-80e6-4036ce0cc34c,Mind the Pad -- CNNs Can Develop Blind Spots,iclr.cc/media/iclr-2021/Slides/3295.pdf,openreview.net/pdf?id=m1CD7tPubNy
73a3b98a-8189-4ef4-b59a-1f08eb81dd28,Learning and Evaluating Representations for Deep One-Class Classification,iclr.cc/media/iclr-2021/Slides/3244.pdf,openreview.net/pdf?id=HCSgyPUfeDj
a21e16b2-d882-4cd4-a76d-3ae43819ef36,Do not Let Privacy Overbill Utility:  Gradient Embedding Perturbation for Private Learning,iclr.cc/media/iclr-2021/Slides/2834.pdf,openreview.net/pdf?id=7aogOj_VYO0
8c723675-ed8a-4432-a270-3cac61e924b1,Colorization Transformer,iclr.cc/media/iclr-2021/Slides/2844.pdf,openreview.net/pdf?id=5NA1PinlGFu
17032e79-4e58-48d2-991e-ea4f084f2f9d,AdamP: Slowing Down the Slowdown for Momentum Optimizers on Scale-invariant Weights,iclr.cc/media/iclr-2021/Slides/2880.pdf,openreview.net/pdf?id=Iz3zU3M316D
cd670802-21f5-4663-9421-43a828523ee6,Private Image Reconstruction from System Side Channels Using Generative Models,iclr.cc/media/iclr-2021/Slides/2886.pdf,openreview.net/pdf?id=y06VOYLcQXa
e163403e-4b39-44c6-a62f-d9bfccb21838,The inductive bias of ReLU networks on orthogonally separable data,iclr.cc/media/iclr-2021/Slides/2889.pdf,openreview.net/pdf?id=krz7T0xU9Z_
4b7b144a-d8b5-4503-8646-28ff099359ae,Categorical Normalizing Flows via Continuous Transformations,iclr.cc/media/iclr-2021/Slides/2730.pdf,openreview.net/pdf?id=-GLNZeVDuik
874b69c7-e518-48ed-a384-473555a056d5,Incremental few-shot learning via vector quantization in deep embedded space,iclr.cc/media/iclr-2021/Slides/2948.pdf,openreview.net/pdf?id=3SV-ZePhnZM
b0fe3569-13aa-47bc-a28c-9e3d6fd5c293,"Kanerva++: Extending the Kanerva Machine With Differentiable, Locally Block Allocated Latent Memory",iclr.cc/media/iclr-2021/Slides/2961.pdf,openreview.net/pdf?id=QoWatN-b8T
43eb716a-6d6b-4ea4-a35c-58902bd857c3,Network Pruning That Matters:  A Case Study on Retraining Variants,iclr.cc/media/iclr-2021/Slides/2991.pdf,openreview.net/pdf?id=Cb54AMqHQFP
9d6e860a-a366-4e07-a7d4-49df1cb43fae,Genetic Soft Updates for Policy Evolution in Deep Reinforcement Learning,iclr.cc/media/iclr-2021/Slides/3046.pdf,openreview.net/pdf?id=TGFO0DbD_pk
a309955f-caf3-4fb7-afea-c94f0bd9130d,Understanding the effects of data parallelism and sparsity on neural network training,iclr.cc/media/iclr-2021/Slides/3069.pdf,openreview.net/pdf?id=rsogjAnYs4z
eaec0add-18eb-4272-b07f-880f6544a70f,Sparse Quantized Spectral Clustering,iclr.cc/media/iclr-2021/Slides/2523.pdf,openreview.net/pdf?id=pBqLS-7KYAF
2f832002-c332-4d3b-9513-f8f7a6c41714,Continual learning in recurrent neural networks,iclr.cc/media/iclr-2021/Slides/2851.pdf,openreview.net/pdf?id=8xeBUgD8u9
9c871413-d6b0-4887-8c6b-3dbf6b773d88,Learning Reasoning Paths over Semantic Graphs for Video-grounded Dialogues,iclr.cc/media/iclr-2021/Slides/3106.pdf,openreview.net/pdf?id=hPWj1qduVw8
b45bf61d-95b6-4228-9875-66e4091f7b43,Grounding Language to Autonomously-Acquired Skills via Goal Generation,iclr.cc/media/iclr-2021/Slides/3190.pdf,openreview.net/pdf?id=chPj_I5KMHG
71dabe12-2981-4d0c-8262-d5ba3dc52418,Revisiting Hierarchical Approach for Persistent Long-Term Video Prediction,iclr.cc/media/iclr-2021/Slides/2718.pdf,openreview.net/pdf?id=3RLN4EPMdYd
396ea115-5092-4e7a-b266-7a54af547733,Interpretable Models for Granger Causality Using Self-explaining Neural Networks,iclr.cc/media/iclr-2021/Slides/2605.pdf,openreview.net/pdf?id=DEa4JdMWRHp
8dbe6152-7364-4d58-aec0-93b660211bc1,Certify or Predict: Boosting Certified Robustness with Compositional Architectures,iclr.cc/media/iclr-2021/Slides/3359.pdf,openreview.net/pdf?id=USCNapootw
4187f28e-862b-4322-a860-bd09b782631e,Influence Estimation for Generative Adversarial Networks,iclr.cc/media/iclr-2021/Slides/2970.pdf,openreview.net/pdf?id=opHLcXxYTC_
7ba5b151-5ed0-4fa3-a353-2e4f9d4db213,Collective Robustness Certificates: Exploiting Interdependence in Graph Neural Networks,iclr.cc/media/iclr-2021/Slides/2727.pdf,openreview.net/pdf?id=ULQdiUTHe3y
45ac4aee-1444-40ff-b436-07483163cd66,Adaptive Extra-Gradient Methods for Min-Max Optimization and Games,iclr.cc/media/iclr-2021/Slides/2773.pdf,openreview.net/pdf?id=R0a0kFI3dJx
2fcc0731-4645-4f1a-9ff8-d6c1bc913994,Uncertainty in Gradient Boosting via Ensembles,iclr.cc/media/iclr-2021/Slides/2928.pdf,openreview.net/pdf?id=1Jv6b0Zq3qi
98a7711c-3ff3-43a2-9b29-b5716c408019,Enforcing robust control guarantees within neural network policies,iclr.cc/media/iclr-2021/Slides/2899.pdf,openreview.net/pdf?id=5lhWG3Hj2By
f47497bc-d3f3-47b1-aaa3-65cce5fc9225,Dynamic Tensor Rematerialization,iclr.cc/media/iclr-2021/Slides/2537.pdf,openreview.net/pdf?id=Vfs_2RnOD0H
924046fd-76c0-426f-be5c-527bb4706c26,Contrastive Learning with Hard Negative Samples,iclr.cc/media/iclr-2021/Slides/2801.pdf,openreview.net/pdf?id=CR1XOQ0UTh-
b1938b75-d1bb-4bee-82a2-920d77e69bba,On Position Embeddings in BERT,iclr.cc/media/iclr-2021/Slides/3249.pdf,openreview.net/pdf?id=onxoVA9FxMw
2e23930e-abb6-469a-b376-b9ce293d93b9,Hierarchical Reinforcement Learning by Discovering Intrinsic Options,iclr.cc/media/iclr-2021/Slides/2805.pdf,openreview.net/pdf?id=r-gPPHEjpmw
6de31d12-cc70-4de0-aab0-880944a1bb93,Analyzing the Expressive Power of Graph Neural Networks in a Spectral Perspective,iclr.cc/media/iclr-2021/Slides/3158.pdf,openreview.net/pdf?id=-qh0M9XWxnv
cbee9730-a27d-436d-8219-15b380ad8a91,Local Search Algorithms for Rank-Constrained Convex Optimization,iclr.cc/media/iclr-2021/Slides/3273.pdf,openreview.net/pdf?id=tH6_VWZjoq
9310d619-dcc2-48ca-974e-c3120bebcbce,CaPC Learning: Confidential and Private Collaborative Learning,iclr.cc/media/iclr-2021/Slides/2786.pdf,openreview.net/pdf?id=h2EbJ4_wMVq
1928bde6-1df2-48d4-b9ab-b374a0a482d8,Neural Learning of One-of-Many Solutions for Combinatorial Problems in Structured Output Spaces,iclr.cc/media/iclr-2021/Slides/2941.pdf,openreview.net/pdf?id=ATp1nW2FuZL
855982bb-c9c6-4f60-84d8-1821f5ed6149,"Heating up decision boundaries: isocapacitory saturation, adversarial scenarios and generalization bounds",iclr.cc/media/iclr-2021/Slides/2788.pdf,openreview.net/pdf?id=UwGY2qjqoLD
4aa1fc42-c978-4d60-804b-6d83e16fd2e5,Contrastive Behavioral Similarity Embeddings for Generalization in Reinforcement Learning,iclr.cc/media/iclr-2021/Slides/2609.pdf,openreview.net/pdf?id=qda7-sVg84
afb8132b-be0d-4dfd-b618-a211336f940b,Deep Networks and the Multiple Manifold Problem,iclr.cc/media/iclr-2021/Slides/2530.pdf,openreview.net/pdf?id=O-6Pm_d_Q-
6b688ca3-89b5-4fe4-9ab2-cada2aa606eb,Generative Language-Grounded Policy in Vision-and-Language Navigation with Bayes' Rule,iclr.cc/media/iclr-2021/Slides/2660.pdf,openreview.net/pdf?id=45uOPa46Kh
0b11b66a-e696-4515-9e32-d894c9e50574,BSQ: Exploring Bit-Level Sparsity for Mixed-Precision Neural Network Quantization,iclr.cc/media/iclr-2021/Slides/3053.pdf,openreview.net/pdf?id=TiXl51SCNw8
11ed2149-8f37-4253-9f96-97321b3d2ee3,Dual-mode ASR: Unify and Improve Streaming ASR with Full-context Modeling,iclr.cc/media/iclr-2021/Slides/3075.pdf,openreview.net/pdf?id=Pz_dcqfcKW8
4139c597-802c-4150-8006-a72dcebd22d7,Graph Coarsening with Neural Networks,iclr.cc/media/iclr-2021/Slides/2646.pdf,openreview.net/pdf?id=uxpzitPEooJ
441ca887-e6c8-4823-bfb7-289a2ca47a97,Flowtron: an Autoregressive Flow-based Generative Network for Text-to-Speech Synthesis,iclr.cc/media/iclr-2021/Slides/3204.pdf,openreview.net/pdf?id=Ig53hpHxS4
f4f75a72-edf8-4c4b-9931-0799b4f95720,Meta-learning with negative learning rates,iclr.cc/media/iclr-2021/Slides/3183.pdf,openreview.net/pdf?id=60j5LygnmD
cd75bf8b-be43-4abd-a74a-8a7dc5ceccd8,Integrating Categorical Semantics into Unsupervised Domain Translation,iclr.cc/media/iclr-2021/Slides/2614.pdf,openreview.net/pdf?id=IMPA6MndSXU
f9172f3c-57b1-4c43-a99f-ce78ba5ef8ee,"Few-Shot Learning via Learning the Representation, Provably",iclr.cc/media/iclr-2021/Slides/2535.pdf,openreview.net/pdf?id=pW2Q2xLwIMD
7bec3032-1920-4a19-941d-698a8aa91763,Neural Pruning via Growing Regularization,iclr.cc/media/iclr-2021/Slides/2526.pdf,openreview.net/pdf?id=o966_Is_nPA
ad42d00d-972e-488d-9eec-27fe844f2832,Molecule Optimization by Explainable Evolution,iclr.cc/media/iclr-2021/Slides/3099.pdf,openreview.net/pdf?id=jHefDGsorp5
ef523ab4-9ebf-4781-9539-27a33adf92e0,HeteroFL: Computation and Communication Efficient Federated Learning for Heterogeneous Clients,iclr.cc/media/iclr-2021/Slides/3165.pdf,openreview.net/pdf?id=TNkPBBYFkXg
8d14a9d5-394a-44a2-a239-a19258f453e3,Contrastive Syn-to-Real Generalization,iclr.cc/media/iclr-2021/Slides/2949.pdf,openreview.net/pdf?id=F8whUO8HNbP
dc00e5ff-d80d-47c1-af4c-ed27308949f8,In Defense of Pseudo-Labeling: An Uncertainty-Aware Pseudo-label Selection Framework for Semi-Supervised Learning,iclr.cc/media/iclr-2021/Slides/3255.pdf,openreview.net/pdf?id=-ODN6SbiUU
815f6dea-db88-42b2-b9fc-535146b6583f,Combining Ensembles and Data Augmentation Can Harm Your Calibration,iclr.cc/media/iclr-2021/Slides/3282.pdf,openreview.net/pdf?id=g11CZSghXyY
08b5ec01-d7d9-4824-87df-7d4df0e193e0,MARS: Markov Molecular Sampling for Multi-objective Drug Discovery,iclr.cc/media/iclr-2021/Slides/3352.pdf,openreview.net/pdf?id=kHSu4ebxFXY
f5a2c54b-24c8-454c-8733-6ce6eb0923d5,CO2: Consistent Contrast for Unsupervised Visual Representation Learning,iclr.cc/media/iclr-2021/Slides/3354.pdf,openreview.net/pdf?id=U4XLJhqwNF1
1af31a87-8598-41fc-a8ff-14e4c8c9abb2,Distributional Sliced-Wasserstein and Applications to Generative Modeling,iclr.cc/media/iclr-2021/Slides/3072.pdf,openreview.net/pdf?id=QYjO70ACDK
da71a079-ee62-4be5-b994-eb57c36868d6,Generative Scene Graph Networks,iclr.cc/media/iclr-2021/Slides/3373.pdf,openreview.net/pdf?id=RmcPm9m3tnk
77c94634-77fc-4423-a693-b4ca48eceb18,Non-asymptotic Confidence Intervals of Off-policy Evaluation:  Primal and Dual Bounds ,iclr.cc/media/iclr-2021/Slides/2875.pdf,openreview.net/pdf?id=dKg5D1Z1Lm
c0d524ee-fd54-47b6-b1a8-ea75b45b5c76,Large Scale Image Completion via Co-Modulated Generative Adversarial Networks,iclr.cc/media/iclr-2021/Slides/2759.pdf,openreview.net/pdf?id=sSjqmfsk95O
7f14aab0-1b76-4392-833a-46cb0cedc755,Linear Convergent Decentralized Optimization with Compression,iclr.cc/media/iclr-2021/Slides/2693.pdf,openreview.net/pdf?id=84gjULz1t5
6ff8c848-c40f-4c44-998c-3b3a770053cc,ANOCE: Analysis of Causal Effects with Multiple Mediators via Constrained Structural Learning,iclr.cc/media/iclr-2021/Slides/3019.pdf,openreview.net/pdf?id=7I12hXRi8F
